Facility Name,Facility Type,County,Unique Confirmed Cases,Deaths Residents/Patients,Deaths Staff,Attack Rate Residents/Patients,Attack Rate Staff,Confirmed COVID-19 Cases Residents/Patients,Confirmed COVID-19 Cases Staff,Confirmed COVID-19 Cases Imported
Select all-Assisted Living,Assisted Living,Carson City,2245,257,5,28.13%,22.60%,"1,408",837,60
A HAND OF HOPE,Assisted Living,Clark,2,0,0,50.00%,33.33%,1,1,0
A SUMMERDALE HOMES @ RIATA,Assisted Living,Washoe,7,0,0,100.00%,0.00%,7,0,0
ABSOLUTE CIRCLE OF CARE ACKERMAN,Assisted Living,Clark,1,0,0,0.00%,33.33%,0,1,0
ACACIA OASIS,Assisted Living,Clark,23,1,0,28.57%,16.67%,10,13,1
AEGIS OF LAS VEGAS,Assisted Living,Clark,12,0,0,8.16%,16.00%,4,8,0
"ALOHA PARADISE CARE, LLC",Assisted Living,Clark,2,1,0,14.29%,33.33%,1,1,0
ALZHEIMERS LUXURY CARE,Assisted Living,Clark,7,2,0,85.71%,20.00%,6,1,0
AMERICAN SENIOR HOME-ROBINDALE/ LANIKEHA RESIDENTIAL,Assisted Living,Clark,6,0,0,50.00%,100.00%,3,3,0
AMY'S CABIN HIRC,Assisted Living,Carson City,2,1,0,50.00%,50.00%,1,1,0
ANGEL PRESTIGE RESIDENTIAL CARE,Assisted Living,Clark,2,0,1,12.50%,50.00%,1,1,0
ANGELICA'S LOVING HOME CARE,Assisted Living,Washoe,5,0,0,80.00%,50.00%,4,1,1
ARBORS MEMORY CARE,Assisted Living,Washoe,50,16,0,81.63%,20.83%,40,10,0
AS TIME GOES BY III,Assisted Living,Clark,6,0,0,50.00%,42.86%,3,3,0
ATRIA SEVILLE,Assisted Living,Clark,13,1,0,6.25%,12.73%,6,7,0
ATRIA SUMMIT RIDGE,Assisted Living,Washoe,5,0,0,5.36%,4.88%,3,2,0
AVAMERE AT CHEYENNE,Assisted Living,Clark,32,1,0,34.21%,15.00%,26,6,2
BEE HIVE HOMES OF HENDERSON,Assisted Living,Clark,4,0,0,0.00%,28.57%,0,4,0
BEE HIVE HOMES OF HENDERSON MEMORY CARE,Assisted Living,Clark,5,0,0,0.00%,71.43%,0,5,0
BEE HIVE HOMES OF MESQUITE,Assisted Living,Clark,11,0,0,37.50%,80.00%,3,8,0
BEE HIVE HOMES OF MESQUITE II,Assisted Living,Clark,11,2,0,27.27%,80.00%,3,8,0
BELLA CARE HOME,Assisted Living,Clark,5,0,0,50.00%,50.00%,4,1,1
BETHEL CARE HOME,Assisted Living,Clark,5,0,0,66.67%,25.00%,4,1,0
BETTER LIVING FOR SENIORS,Assisted Living,Clark,1,1,0,14.29%,0.00%,1,0,0
BLUE SKY MEMORY CARE,Assisted Living,Clark,13,2,0,55.56%,13.64%,10,3,0
BROOKDALE LAS VEGAS,Assisted Living,Clark,17,4,0,13.25%,13.04%,11,6,3
BROOKDALE RENO,Assisted Living,Washoe,48,5,0,75.56%,38.89%,34,14,0
BROOKDALE VISTA,Assisted Living,Washoe,35,0,0,43.64%,30.56%,24,11,0
CARSON TAHOE EXPRESSIONS MEMORY CARE,Assisted Living,Carson City,58,4,0,73.91%,60.00%,34,24,0
CARSON VALLEY SENIOR LIVING,Assisted Living,Douglas,1,0,0,0.00%,2.44%,0,1,0
CASCADES OF THE SIERRA,Assisted Living,Washoe,57,3,0,16.10%,17.78%,33,24,0
CNC ALZHEIMERS HOME CARE,Assisted Living,Clark,7,2,0,100.00%,50.00%,5,2,0
CORONADO HEIGHTS SENIOR LIVING,Assisted Living,Clark,38,3,0,34.21%,20.34%,26,12,1
CROSSROADS LIVING,Assisted Living,Washoe,1,0,0,0.00%,12.50%,0,1,0
DESERT INN RESIDENTIAL,Assisted Living,Clark,1,0,0,0.00%,33.33%,0,1,0
DESERT REGIONAL CENTER,Assisted Living,Clark,25,0,0,28.95%,9.86%,11,14,1
DESERT SPRINGS SENIOR LIVING,Assisted Living,Clark,9,0,0,2.21%,13.33%,3,6,0
DESERT VIEW SENIOR LIVING,Assisted Living,Clark,51,2,0,41.18%,15.79%,42,9,0
DIGNIFIED MANOR,Assisted Living,Clark,7,3,0,83.33%,50.00%,5,2,0
DUNCAN MANOR,Assisted Living,Clark,9,0,0,83.33%,66.67%,5,4,0
EAGLE VALLEY CHILDRENS HOME,Assisted Living,Carson City,43,0,0,70.59%,36.90%,12,31,1
ELKHORN JONES MEMORY CARE,Assisted Living,Clark,14,2,1,52.38%,13.64%,11,3,0
EVERGREEN RESIDENCE,Assisted Living,Washoe,10,2,0,85.71%,100.00%,6,4,0
FAMILY HOME CARE RHL,Assisted Living,Washoe,5,3,0,44.44%,50.00%,4,1,0
FERNLEY ESTATES (SENIOR LIVING),Assisted Living,Lyon,28,2,0,31.71%,33.33%,13,15,0
FIVE STAR SENIOR LIVING,Assisted Living,Washoe,31,0,0,3.28%,25.00%,6,25,4
FLORENCE SENIOR CARE HOME,Assisted Living,Clark,2,0,0,40.00%,0.00%,2,0,0
GAYE HAVEN INTERMEDIATE CARE,Assisted Living,Clark,17,3,0,100.00%,11.76%,15,2,0
GENTLE BREEZE CARE HOME,Assisted Living,Clark,1,0,0,12.50%,0.00%,1,0,0
GENTLE SOULS HOME CARE,Assisted Living,Clark,2,0,0,50.00%,50.00%,1,1,0
GENTLE SPRING CARE HOME,Assisted Living,Clark,8,3,0,77.78%,25.00%,7,1,0
GLENDA CARE,Assisted Living,Washoe,19,1,0,77.27%,20.00%,17,2,0
GOLDEN HEART GROUP HOME CARE II,Assisted Living,Washoe,15,4,1,100.00%,100.00%,10,5,0
GOLDEN MANOR,Assisted Living,Washoe,7,0,0,100.00%,50.00%,5,2,0
GOLDEN MANOR SERENITY,Assisted Living,Washoe,2,0,0,16.67%,50.00%,1,1,0
GOLDEN MEADOWS RESIDENTIAL,Assisted Living,Clark,1,0,0,12.50%,0.00%,1,0,0
GOLDEN VALLEY GROUP CARE II,Assisted Living,Washoe,3,0,0,33.33%,0.00%,3,0,0
GOLDEN YEARS CASTLE HOME OF FERNLEY,Assisted Living,Lyon,1,1,0,6.25%,0.00%,1,0,5
GOLDEN YEARS RESIDENTIAL CARE,Assisted Living,Clark,6,0,0,33.33%,50.00%,3,3,0
GOOD SHEPHERD IV,Assisted Living,Clark,4,0,0,100.00%,0.00%,4,0,0
HELPING HANDS CARE HOME II,Assisted Living,Clark,1,0,0,14.29%,0.00%,1,0,0
HENDERSON CARE HOME,Assisted Living,Clark,2,0,0,20.00%,20.00%,1,1,0
HERITAGE SPRINGS ASSISTED LIVING MEMORY CARE,Assisted Living,Clark,19,0,0,3.08%,26.15%,2,17,1
HIGHLAND INN OF FALLON,Assisted Living,Churchill,13,1,0,32.26%,21.43%,10,3,1
HILLSIDE MANOR AT MOUNTAINS EDGE,Assisted Living,Clark,5,1,0,60.00%,66.67%,3,2,0
HORIZON HILLS RESIDENTIAL GROUP CARE (8115),Assisted Living,Washoe,3,1,0,60.00%,0.00%,3,0,0
INSPIRATIONS SENIOR LIVING IN PAHRUMP,Assisted Living,Nye,44,3,0,42.47%,28.26%,31,13,0
JC FAMILY SERVICES,Assisted Living,Washoe,3,0,0,0.00%,42.86%,0,3,0
JCR HOME CARE,Assisted Living,Clark,2,0,0,22.22%,0.00%,2,0,0
KIND HEARTS,Assisted Living,Clark,9,2,0,85.71%,37.50%,6,3,0
L & N HOME CARE,Assisted Living,Washoe,11,2,0,100.00%,83.33%,6,5,0
LAKEVIEW TERRACE RETIREMENT COMMUNITY,Assisted Living,Clark,2,0,0,0.00%,5.26%,0,2,0
LAS VENTANAS RETIREMENT COMM,Assisted Living,Clark,47,7,0,123.08%,34.88%,32,15,1
LEGACY HOUSE OF CENTENNIAL HILLS,Assisted Living,Clark,42,3,0,23.21%,17.78%,26,16,0
LEGACY HOUSE OF SOUTHERN HILLS,Assisted Living,Clark,57,11,1,52.05%,31.67%,38,19,0
LIBERTY RESIDENTIAL CARE,Assisted Living,Clark,2,0,0,33.33%,0.00%,2,0,0
LIFE SHARE CARE HOME,Assisted Living,Clark,12,1,0,100.00%,66.67%,8,4,0
LIVE N LOVE,Assisted Living,Clark,4,1,0,33.33%,66.67%,2,2,1
LONGEVITY RESIDENTIAL CARE,Assisted Living,Washoe,9,0,0,100.00%,33.33%,7,2,0
MARTHA'S HOUSE SENIOR LIVING,Assisted Living,Clark,1,0,0,20.00%,0.00%,1,0,0
MARVEL MANOR,Assisted Living,Clark,11,1,0,60.00%,55.56%,6,5,0
MAR-VON SENIOR CARE,Assisted Living,Washoe,14,1,0,71.43%,100.00%,10,4,0
MASON VALLEY RESIDENCE,Assisted Living,Lyon,38,5,0,71.88%,60.00%,23,15,2
MAYHILL MANOR,Assisted Living,Clark,2,0,0,25.00%,33.33%,1,1,0
MERRILL GARDENS AT GREEN VALLEY RANCH,Assisted Living,Clark,13,2,0,8.51%,11.90%,8,5,1
MERRILL GARDENS AT SIENA HILLS (ASSISTED LIVING),Assisted Living,Clark,39,2,0,28.57%,36.96%,22,17,1
MERRILL GARDENS AT SIENA HILLS (GARDEN HOUSE MEMORY CARE),Assisted Living,Clark,34,4,0,68.57%,38.46%,24,10,2
MESA VALLEY ESTATES,Assisted Living,Clark,8,2,0,19.44%,2.56%,7,1,1
MIJN CORP 1748 MINER WAY,Assisted Living,Clark,1,0,0,33.33%,0.00%,1,0,0
MIJN CORP 4009 E ST LOUIS AVE,Assisted Living,Clark,2,0,0,33.33%,100.00%,1,1,0
MIMI'S CARE HOME,Assisted Living,Clark,7,1,0,80.00%,50.00%,4,3,0
MONARCH GROUP HOME,Assisted Living,Clark,9,3,0,75.00%,75.00%,6,3,0
MORNING STAR CARE HOME,Assisted Living,Clark,10,0,0,100.00%,75.00%,7,3,0
MORNING STAR SENIOR LIVING,Assisted Living,Washoe,44,1,0,10.89%,22.22%,22,22,0
MOTHER'S TOUCH SENIOR HOME,Assisted Living,Clark,8,1,0,75.00%,40.00%,6,2,0
NEURORESTORATIVE NEVADA (MONTE CRISTO),Assisted Living,Clark,1,0,0,16.67%,0.00%,1,0,0
NOVA ALL STAR CARE HOMES,Assisted Living,Clark,1,0,0,0.00%,20.00%,0,1,0
OAKEY ASSISTED LIVING,Assisted Living,Clark,19,0,0,25.00%,24.14%,12,7,1
OAKMONT OF LAS VEGAS,Assisted Living,Clark,26,1,0,13.33%,29.17%,12,14,1
OAKMONT OF THE LAKES,Assisted Living,Clark,29,6,0,40.00%,6.80%,22,7,0
PACIFICA SENIOR LIVING GREEN VALLEY,Assisted Living,Clark,38,7,0,28.24%,19.18%,24,14,0
PACIFICA SENIOR LIVING SAN MARTIN,Assisted Living,Clark,62,10,0,55.91%,13.33%,52,10,0
PACIFICA SENIOR LIVING SPRING VALLEY,Assisted Living,Clark,39,7,0,56.00%,20.75%,28,11,0
PALM VALLEY ASSISTED LIVING,Assisted Living,Clark,10,1,0,10.10%,0.00%,10,0,1
PARADISE CREST HOME CARE,Assisted Living,Clark,2,2,0,0.00%,50.00%,0,2,5
PARADISE MEMORY CARE LLC (PREVIOUSLY ALEBRIS OF CRYSTAL SPRINGS),Assisted Living,Clark,11,0,0,77.78%,66.67%,7,4,0
PARADISO HOME,Assisted Living,Clark,4,1,0,22.22%,28.57%,2,2,0
PARK PLACE ASSISTED LIVING,Assisted Living,Washoe,11,1,0,12.20%,37.50%,5,6,0
PEARL CARE HOME,Assisted Living,Clark,6,2,0,83.33%,20.00%,5,1,0
PINEWOOD - MT. OLIVE CARE GROUP HOME,Assisted Living,Washoe,1,0,0,0.00%,0.00%,1,0,0
PINNACLE COMMUNITY SERVICES,Assisted Living,Clark,2,0,0,25.00%,8.33%,1,1,0
PLEASANT VALLEY HOME CARE,Assisted Living,Clark,9,0,0,83.33%,66.67%,5,4,0
PLEASANT VIEW HOME CARE,Assisted Living,Clark,1,1,0,50.00%,0.00%,1,0,0
POET'S WALK MEMORY CARE,Assisted Living,Clark,36,0,0,32.76%,27.87%,19,17,0
PRESTIGE ASSISTED LIVING AT HENDERSON,Assisted Living,Clark,2,0,0,0.00%,6.06%,0,2,0
PRESTIGE ASSISTED LIVING AT MIRA LOMA,Assisted Living,Clark,71,8,0,39.56%,43.21%,36,35,0
PROMENADE ON THE RIVER,Assisted Living,Washoe,1,0,0,0.00%,0.00%,0,1,0
R & L ADULT CARE HOME #1,Assisted Living,Clark,3,0,0,40.00%,50.00%,2,1,0
R & L ADULT CARE HOME #2,Assisted Living,Clark,7,0,0,85.71%,50.00%,6,1,0
RISING STAR CBLA,Assisted Living,Washoe,1,0,0,0.00%,20.00%,0,1,0
ROSARIO GROUP HOME,Assisted Living,Clark,1,0,0,25.00%,0.00%,1,0,0
SACHELE RESIDENTIAL CARE,Assisted Living,Clark,1,0,1,0.00%,50.00%,0,1,0
SACHELE SENIOR GUEST HOME,Assisted Living,Clark,1,0,0,14.29%,0.00%,1,0,0
SAINT ANNE RESIDENTIAL CARE CORP,Assisted Living,Clark,5,3,0,83.33%,0.00%,5,0,0
SAN VICENTE HOMECARE,Assisted Living,Clark,10,2,0,60.00%,57.14%,6,4,0
SENIOR RESIDENTIAL CARE,Assisted Living,Clark,5,1,0,44.44%,33.33%,4,1,0
SILVER SKY ASSISTED LIVING,Assisted Living,Clark,7,0,0,8.75%,0.00%,7,0,0
SILVER SKY AT DEER SPRINGS ASSISTED LIVING,Assisted Living,Clark,9,1,0,7.78%,4.88%,7,2,0
SILVERADO RANCH MEMORY CARE,Assisted Living,Clark,9,0,0,50.00%,57.14%,5,4,0
SKYLINE ESTATES (9346),Assisted Living,Carson City,20,5,0,18.18%,13.33%,14,6,1
SOUTH MEADOWS RESIDENTIAL CARE HOME,Assisted Living,Washoe,3,0,0,37.50%,0.00%,3,0,0
STERLING RIDGE,Assisted Living,Clark,28,4,0,18.07%,20.00%,15,13,0
STONE VALLEY ALZHEIMERS SPECIAL CARE CENTER,Assisted Living,Washoe,45,7,0,80.95%,28.95%,34,11,0
SUMMIT ESTATES ASSISTED LIVING AND MEMORY CARE,Assisted Living,Washoe,28,1,0,14.78%,15.28%,17,11,0
SUNRISE OF HENDERSON ASSISTED LIVING,Assisted Living,Clark,56,6,0,37.31%,44.29%,25,31,0
THE AMERICANA ASSISTED LIVING,Assisted Living,Clark,2,0,0,4.00%,5.00%,1,1,0
THE BRIDGE AT PARADISE VALLEY ASSISTED LIVING,Assisted Living,Clark,11,0,0,15.38%,11.63%,6,5,0
"THE CHATEAU AT GARDNERVILLE, ASSISTED LIVING AND MEMORY CARE",Assisted Living,Douglas,17,3,0,7.08%,18.00%,8,9,0
THE CORINTHIAN PLACE SOUTH LLC,Assisted Living,Washoe,8,4,0,100.00%,50.00%,7,1,0
THE HOMESTEAD,Assisted Living,Churchill,50,14,0,55.07%,24.49%,38,12,0
THE LODGE ASSISTED LIVING AND MEMORY CARE COMMUNITY,Assisted Living,Carson City,8,1,0,6.10%,6.82%,5,3,1
THE ROYAL PLACE,Assisted Living,Clark,8,2,0,85.71%,66.67%,6,2,0
THE SEASONS OF RENO,Assisted Living,Washoe,30,7,0,18.87%,18.18%,20,10,3
"TRANQUIL BREEZES CARE HOME, LLC",Assisted Living,Clark,12,5,0,81.82%,75.00%,9,3,0
TRUE LOVING CARE II,Assisted Living,Clark,7,1,0,100.00%,16.67%,6,1,0
V N SENIOR CARE OF SEVEN HILLS,Assisted Living,Clark,6,0,0,66.67%,57.14%,2,4,0
VILLA COURT ASSISTED LIVING (3985),Assisted Living,Clark,23,1,0,35.19%,13.33%,19,4,0
VILLA COURT ASSISTED LIVING AND MEMORY CARE (4025),Assisted Living,Clark,19,2,0,30.19%,6.98%,16,3,0
VINTAGE PARK AT SAN MARTIN (LEGACIES MEMORY CARE),Assisted Living,Clark,14,3,0,36.36%,30.00%,8,6,0
VITALITY VETERANS HOUSING PROGRAM,Assisted Living,Washoe,5,0,0,62.50%,0.00%,5,0,1
WASHOE SENIOR LIVING II,Assisted Living,Washoe,6,0,0,55.56%,25.00%,5,1,0
WE CARE RESIDENTIAL,Assisted Living,Clark,7,1,0,50.00%,66.67%,3,4,0
WELBROOK GRAND MONTECITO,Assisted Living,Clark,13,1,0,6.67%,60.00%,1,12,13
WENTWORTH OF LAS VEGAS,Assisted Living,Clark,36,4,0,19.82%,16.87%,22,14,2
YSL CARE HOME,Assisted Living,Clark,1,0,0,0.00%,50.00%,0,1,0
Select all-Skilled Nursing,Skilled Nursing,Carson City,5370,525,10,50.98%,30.01%,"2,906","2,464",791
ADVANCED HEALTH CARE OF HENDERSON,Skilled Nursing,Clark,22,3,0,40.00%,10.26%,14,8,1
ADVANCED HEALTH CARE OF LAS VEGAS,Skilled Nursing,Clark,38,2,0,44.44%,34.67%,12,26,2
ADVANCED HEALTH CARE OF PARADISE,Skilled Nursing,Clark,59,10,0,92.11%,29.63%,35,24,19
ADVANCED HEALTH CARE OF RENO,Skilled Nursing,Washoe,24,0,0,16.67%,11.33%,7,17,0
ADVANCED HEALTH CARE OF SUMMERLIN,Skilled Nursing,Clark,45,8,0,78.13%,36.36%,25,20,6
ALTA SKILLED NURSING AND REHABILITATION CENTER,Skilled Nursing,Washoe,190,14,0,65.73%,37.24%,117,73,19
BATTLE MOUNTAIN GENERAL HOSPITAL SKILLED NURSING FACILITY,Skilled Nursing,Lander,28,1,0,31.82%,116.67%,7,21,0
BOULDER CITY HOSPITAL (SNF),Skilled Nursing,Clark,2,0,0,2.56%,2.63%,1,1,0
CANYON VISTA,Skilled Nursing,Clark,229,17,0,134.02%,40.41%,130,99,12
CARSON NURSING AND REHABILITATION CENTER,Skilled Nursing,Carson City,56,1,0,81.63%,22.22%,40,16,3
CARSON TAHOE TRANSITIONAL REHAB CENTER,Skilled Nursing,Carson City,47,0,0,25.45%,26.40%,14,33,2
COLLEGE PARK HEALTH AND REHAB,Skilled Nursing,Clark,69,8,0,39.33%,28.57%,35,34,4
DEL MAR GARDENS,Skilled Nursing,Clark,150,29,1,60.67%,22.22%,108,42,2
EL JEN HEALTHCARE AND REHABILITATION,Skilled Nursing,Clark,113,8,0,49.17%,30.00%,59,54,14
GARDNERVILLE HEALTH & REHAB CENTER,Skilled Nursing,Douglas,59,11,0,106.06%,53.33%,35,24,0
GROVER C. DILS MEDICAL CENTER/SNF,Skilled Nursing,Lincoln,29,1,0,61.54%,28.77%,8,21,2
HARMONY MANOR,Skilled Nursing,Humboldt,18,0,0,2.56%,34.00%,1,17,1
HEARTHSTONE OF NORTHERN NEVADA,Skilled Nursing,Washoe,113,9,0,61.48%,25.33%,75,38,1
HIGHLAND MANOR OF ELKO,Skilled Nursing,Elko,124,13,0,63.75%,60.83%,51,73,0
HIGHLAND MANOR OF FALLON,Skilled Nursing,Churchill,89,15,0,73.44%,36.52%,47,42,0
HIGHLAND MANOR OF MESQUITE,Skilled Nursing,Clark,62,6,0,43.64%,36.89%,24,38,1
HORIZON HEALTH AND REHABILITATION CENTER,Skilled Nursing,Clark,85,7,0,38.38%,32.64%,38,47,2
HORIZON RIDGE SKILLED NURSING & REHABILITATION (AKA GENERATION HEATHCARE HORIZON RIDGE OF HENDERSON),Skilled Nursing,Clark,83,12,0,53.85%,17.00%,49,34,9
KINDRED FLAMINGO SNU,Skilled Nursing,Clark,100,1,0,68.66%,32.34%,46,54,1
LAKE MEAD HEALTH AND REHABILITATION CENTER,Skilled Nursing,Clark,198,19,1,67.80%,13.15%,160,38,12
LAKESIDE HEALTH & WELLNESS SUITES,Skilled Nursing,Washoe,92,29,1,56.78%,24.75%,67,25,0
LAS VEGAS POST ACUTE AND REHABILITATION,Skilled Nursing,Clark,61,4,0,30.56%,30.23%,22,39,12
LAS VENTANAS RETIREMENT COMM-SNF,Skilled Nursing,Clark,35,6,0,5.06%,7.14%,16,19,24
LEFA SERAN SKILLED NURSING FACILITY,Skilled Nursing,Mineral,33,3,0,71.43%,39.13%,15,18,0
LIFE CARE CENTER OF LAS VEGAS,Skilled Nursing,Clark,56,10,0,30.71%,10.12%,39,17,10
LIFE CARE CENTER OF RENO,Skilled Nursing,Washoe,81,7,0,43.12%,17.62%,47,34,16
LIFE CARE CENTER OF SOUTH LAS VEGAS,Skilled Nursing,Clark,109,14,0,84.51%,42.98%,60,49,18
MARQUIS CARE AT CENTENNIAL HILLS,Skilled Nursing,Clark,93,7,0,45.65%,31.10%,42,51,0
MARQUIS PLAZA REGENCY POST ACUTE REHAB,Skilled Nursing,Clark,74,4,0,4.26%,29.57%,6,68,79
MISSION PINES NURSING & REHAB CENTER,Skilled Nursing,Clark,91,5,0,32.04%,23.74%,58,33,3
MOUNTAIN VIEW CARE CENTER,Skilled Nursing,Clark,49,10,0,47.50%,11.00%,38,11,0
MOUNTAIN VIEW HEALTH & REHAB CTR,Skilled Nursing,Carson City,155,25,0,86.92%,35.90%,113,42,2
NEURORESTORATIVE 4KIDS - BUFFALO,Skilled Nursing,Clark,33,1,1,52.17%,84.00%,12,21,0
NEURORESTORATIVE FOR KIDS (CARMEN),Skilled Nursing,Clark,20,0,0,6.06%,18.56%,2,18,0
NEURORESTORATIVE NEVADA,Skilled Nursing,Washoe,13,0,0,5.56%,18.46%,1,12,2
NEVADA STATE VETERANS HOME - BOULDER CITY,Skilled Nursing,Clark,145,18,0,41.57%,33.19%,69,76,11
NORTH LAS VEGAS CARE CENTER,Skilled Nursing,Clark,145,2,0,56.33%,37.09%,89,56,0
NORTHERN NEVADA STATE VETERANS HOME,Skilled Nursing,Washoe,59,4,0,21.05%,25.00%,16,43,0
ORMSBY POST-ACUTE REHAB,Skilled Nursing,Carson City,92,16,1,67.53%,0.00%,52,40,2
PAHRUMP HEALTH AND REHABILITATION CENTER,Skilled Nursing,Nye,66,9,1,64.29%,20.79%,45,21,5
PERSHING GENERAL HOSPITAL SKILLED NURSING FACILITY,Skilled Nursing,Pershing,11,0,0,8.00%,11.25%,2,9,0
PREMIER HEALTH AND REHAB,Skilled Nursing,Clark,81,15,0,66.67%,27.50%,48,33,0
ROSEWOOD REHABILITATION CENTER,Skilled Nursing,Washoe,87,14,0,48.00%,35.17%,36,51,4
ROYAL SPRINGS HEALTHCARE AND REHAB,Skilled Nursing,Clark,200,8,2,59.17%,21.85%,129,71,136
SAGE CREEK POST-ACUTE,Skilled Nursing,Clark,45,4,0,54.84%,43.08%,17,28,5
SIERRA RIDGE HEALTH AND WELLNESS SUITES,Skilled Nursing,Washoe,11,0,0,13.79%,13.21%,4,7,0
SILVER HILLS HEALTH CARE CENTER,Skilled Nursing,Clark,166,14,0,80.15%,35.67%,105,61,52
SILVER RIDGE HEALTH CARE CENTER,Skilled Nursing,Clark,221,29,0,88.64%,67.10%,117,104,149
SOUTH LYON MEDICAL CENTER SNF,Skilled Nursing,Lyon,4,0,0,0.00%,5.88%,0,4,0
SPANISH HILLS WELLNESS SUITES,Skilled Nursing,Clark,33,0,0,8.89%,20.19%,12,21,3
ST. JOSEPH TRANSITIONAL REHAB,Skilled Nursing,Clark,143,12,1,73.86%,45.88%,65,78,1
THE HEIGHTS OF SUMMERLIN,Skilled Nursing,Clark,188,29,0,64.94%,44.00%,100,88,41
TLC CARE CENTER,Skilled Nursing,Clark,228,11,0,46.54%,39.69%,101,127,59
TORREY PINES POST ACUTE AND REHABILITATION,Skilled Nursing,Clark,117,5,0,74.16%,29.31%,66,51,18
TRANSITIONAL CARE OF LAS VEGAS,Skilled Nursing,Clark,248,14,1,114.29%,152.94%,144,104,24
TRELLIS CENTENNIAL,Skilled Nursing,Clark,15,0,0,11.76%,14.67%,4,11,1
WELBROOK AT CENTENNIAL HILLS,Skilled Nursing,Clark,16,0,0,23.53%,13.64%,4,12,0
WHITE PINE CARE CENTER,Skilled Nursing,White Pine,7,0,0,3.45%,11.54%,1,6,0
WINGFIELD HILLS HEALTH AND WELLNESS,Skilled Nursing,Washoe,15,1,0,4.60%,11.70%,4,11,1