state,notes,covid19Site,covid19SiteSecondary,covid19SiteTertiary,covid19SiteQuaternary,covid19SiteQuinary,twitter,covid19SiteOld,covidTrackingProjectPreferredTotalTestUnits,covidTrackingProjectPreferredTotalTestField,totalTestResultsField,pui,pum,name,fips
ID,"Idaho's data is on a 1 day lag in our timeseries due to consistently updating after 7:30 pm Eastern Time, when we publish our daily update. 

Negative test results reported in our API and CSVs are calculated by subtracting **Confirmed cases** from **Total PCR tests (people)** in the absence of better data. 

On January 12, 2021, Idaho reported 10 cumulative probable deaths on their dashboard,  a decrease from the 179 probable deaths reported the day before. We suspect that this is an error, and in order to ensure that our data is as accurate as possible, we carried over the existing value for Probable deaths on January 12, 2021.

On December 25, 2020, Idaho [announced](https://twitter.com/IDHW) via the official Idaho Department of Health and Welfare twitter that there would be no update to their data on December 25, 2020 due to the Christmas holiday. On December 31, 2020, they [noted](https://twitter.com/IDHW/status/1344793943876145152) that there would be no update to their data on January 1, 2021. Because Idaho's data is on a one day lag in our timeseries, we were unable to update their data on December 26, 2020 and January 2, 2021.

On December 9, 2020, Idaho's **Total PCR Tests (People)** dropped from 492,265 from 494,914 with no explanation.

On November 26, 2020, Idaho announced that there would be no update to their data on November 26, 2020. Because Idaho’s data is on a one day lag in our historical data due to consistently updating after we publish our daily update, we will be unable to update their data on November 27, 2020.

As of September 18, 2020, Idaho's total test results are drawn from our `totalTestsPeopleViral` field instead of calculated via positive+negative.

On August 4, 2020, after another period of missing data for **Hospitalized now**, Idaho reported current hospitalizations of 106, down from the previous report of 223 on July 31. It reported a similar drop in ICU patients from 51 on July 31 to 22 on August 4.

On July 22, 2020, Idaho reported 126 total **deaths** but also reported 103 lab-confirmed deaths and 33 probable deaths, for a calculated total of 136 deaths. We treated the 33 probable deaths data point as an error and reported 126 total deaths for this date, including 103 confirmed and 23 probable deaths. See Idaho state page screenshots for July 22. 

From July 13 through July 21, 2020, Idaho was unable to report **Hospitalized now** data due to HHS regulation changes. Idaho retroactively made figures available for these days on July 21, 2020, and we revised our figures to match.

On July 8, 2020, Idaho revised its historical numbers for **Hospitalized now**. We updated our hospitalization figures for Idaho from March 23 to July 13, 2020 to match on July 17, 2020.

On July 3, 2020, Idaho revised down their **Recovered** data by about 1,500, noting that ""an error in auto-calculation was discovered.""

On June 5, 2020, Idaho reported a large batch of previously unreported tests. The state's **Total tests** number rose by approximately 2,500 more tests on June 5 than the seven-day average for new tests at that time.

As of April 9, 2020, Idaho reports **probable and confirmed cases** separately. ",https://coronavirus.idaho.gov/,https://public.tableau.com/views/DPHIdahoCOVID-19Dashboard/Testing?%3Aembed=y&%3AshowVizHome=no&%3Adisplay_count=y,https://public.tableau.com/views/DPHIdahoCOVID-19Dashboard/Demographics?%3Aembed=y&%3AshowVizHome=no&%3Adisplay_count=y,https://public.tableau.com/views/DPHIdahoCOVID-19Dashboard/Hospitalizations?%3Aembed=y&%3Aembed=y&%3AshowVizHome=no&%3AshowVizHome=n&%3Adisplay_count=y&%3Adisplay_static_image=y&%3Alanguage=en&%3AapiID=host0#navType=0&navSrc=Parse,https://public.tableau.com/views/DPHIdahoCOVID-19Dashboard/Deaths?%3Aembed=y&%3Aembed=y&%3AshowVizHome=no&%3AshowVizHome=n&%3Adisplay_count=y&%3Adisplay_static_image=y&%3Alanguage=en&%3AapiID=host0#navType=0&navSrc=Parse,@IDHW,https://coronavirus.idaho.gov/,People,totalTestsPeopleViral,Total PCR Tests (People),All data,false,Idaho,16
IL,"Negative test results reported in our API and CSVs are calculated by subtracting **Total cases** from **Total PCR tests (specimens)** in the absence of better data.

On November 6, 2020, Illinois [announced](http://www.dph.illinois.gov/news/public-health-officials-announce-10376-new-confirmed-cases-coronavirus-disease) that they ""will report confirmed cases and probable cases combined.” The time series for the **Confirmed** and **Probable Case** metrics are available in the historical data, and our data downloads. 

As of October 15, 2020, Illinois combines PCR and antigen tests in the total tests figure reported on the state's dashboard.

On September 4, 2020, Illinois reported over 140,000 new **Total PCR tests (in specimens)** and over 5,000 new **Cases.** According to the [Chicago Tribune](https://www.chicagotribune.com/coronavirus/ct-covid-19-pandemic-chicago-illinois-news-20200904-qun7unon5fhjbfhnsml4edwqia-story.html), ""The Illinois Department of Public Health said Friday there was significant slowdown in the agency's test reporting earlier this week that it is just catching up with."" ",http://www.dph.illinois.gov/topics-services/diseases-and-conditions/diseases-a-z-list/coronavirus,http://www.dph.illinois.gov/covid19/hospitalization-utilization,,,,@IDPH,http://www.dph.illinois.gov/topics-services/diseases-and-conditions/diseases-a-z-list/coronavirus,Specimens,posNeg,posNeg,All data,false,Illinois,17
IN,"Indiana combines PCR and antigen tests in the total tests figure reported on the state's dashboard.

Negative test results reported in our API and CSVs are calculated by subtracting **Total cases** from **Total PCR tests (people)** in the absence of better data.

On January 5, 2021, Indiana’s Currently in ICU decreased by 9 without explanation.

On November 29, 2020, Indiana announced that a historical backlog of roughly 2200 Total PCR tests (people) and about 4000 Total PCR tests (specimens) would be included in their data for November 29, 2020. The `Negative` field in the API will also be affected. As a result, new tests reported on November 29, 2020 were not all reported in the previous 24 hour period.

As of October 16, 2020, Indiana’s total test results are drawn from our totalTestsViral field instead of calculated via positive+negative.",https://www.in.gov/isdh/28470.htm,https://www.regenstrief.org/covid-dashboard/,https://hub.mph.in.gov/dataset/covid-19-beds-and-vents/resource/882a7426-886f-48cc-bbe0-a8d14e3012e4/view/05961851-c7ab-4ac7-92bf-fdf9881ecdab,https://hub.mph.in.gov/api/3/action/datastore_search_sql?sql=SELECT+sum%28%22COVID_POSITIVE_TESTS_ADMIN%22%29+as+pos_tests+from+%22afaa225d-ac4e-4e80-9190-f6800c366b58%22,,@statehealthin,https://www.in.gov/isdh/28470.htm,Specimens,totalTestsViral,Total Tests (PCR),Only positives,false,Indiana,18
KS,"Kansas combines PCR and antigen tests in the total tests figure reported on the state's dashboard.

Kansas reports most of its data on Mondays, Wednesdays, and Fridays only, so there are often large changes in the values, which can represent 2-3 days of data.

The **Recovered** data point we report for Kansas reflects the number of COVID-19 patients discharged from the hospital and therefore does not represent the total number of people who have recovered from COVID-19, since many people with COVID are never hospitalized. Kansas notes that this metric only includes cases with available discharge information reported to the Kansas Department of Health and Environment.

On December 25, 2020, Kansas announced on their [COVID-19 page](https://www.coronavirus.kdheks.gov/160/COVID-19-in-Kansas) that there would be no update to their data on December 25, 2020 due to the holiday.

On December 3, 2020, Kansas’ **Currently hospitalized** decreased by 342 without explanation. Kansas does not usually update their data on Thursdays.

On November 13, 2020, Kansas announced that there was a ""technical issue with displaying the number of negative tests and people tested"" but that no other metrics were effected. The values for **Total tests (people)**, and the `Negative` field in the API, were carried over and will be updated if they become available.

On November 12, 2020, Kansas’s **Total tests (people)** and `Negative` decreased without explanation.

On October 21, 2020, the **Currently in Icu** value for KS dropped from 81 to 1 on the state's dashboard. We recorded it, but expect it to be revised at another point. 

On July 15, 2020, Kansas began reporting additional data from hospitals, and at that time, data for the **Now hospitalized** metric was only available through July 10.

From July 1–July 3, 2020, we reported incorrect numbers for Kansas **Cases or Confirmed cases**. We have corrected the error.

As of May 7, 2020, **confirmed and probable cases** are included in the case totals.",https://www.coronavirus.kdheks.gov/160/COVID-19-in-Kansas,https://public.tableau.com/views/COVID-19TableauVersion2/HospitalCapacity?%3Aembed=y&%3AshowVizHome=no,https://public.tableau.com/views/COVID-19TableauVersion2/TestingRates?%3Aembed=y&%3AshowVizHome=no,https://public.tableau.com/views/COVID-19TableauVersion2/HospitalSummary?%3Aembed=y&%3AshowVizHome=no,,@kdhe,http://www.kdheks.gov/coronavirus/,People,posNeg,posNeg,All data,false,Kansas,20
KY,"Negative test results reported in our API and CSVs are calculated by subtracting **Confirmed cases** from **Total PCR tests (specimens)** in the absence of better data.

On December 24, 2020, December 25, 2020, December 31, 2020 and January 1, 2021, Kentucky did not update their data by the time of our daily update, presumably due to the holidays.

On November 26, 2020, Kentucky did not update their data by the time of our daily update, presumably due to the Thanksgiving holiday.

On November 12, 2020, Kentucky began reporting **Currently on ventilator** in their [COVID-19 Daily Summaries](https://covid-tracking-project-data.s3.us-east-1.amazonaws.com/state_screenshots/KY/KY-tertiary-20201112-172508.pdf).

On November 7, 2020, Kentucky [reported](https://chfs.ky.gov/cvdaily/COVID19DailyReport1107.pdf) that ""due to a keystroke error, the PCR and total tested figures were incorrectly  reported on 11/6/2020."" This caused our **Total PCR tests (specimens)** to go up by ~168k on November 6, and to go down by ~130k on November 7. If we find an official source with a corrected value we will backfill it.

As of September 18, 2020, Kentucky's total test results are drawn from our `totalTestsViral` field instead of calculated via positive+negative.

As of May 27, 2020, Kentucky reports antibody tests separately from PCR tests. 

On May 23, 2020, Kentucky revised down the state's figure for **Total tests**.",https://govstatus.egov.com/kycovid19,https://chfs.ky.gov/agencies/dph/covid19/COVID19DailyReport.pdf,,,,@CHFSKy,https://chfs.ky.gov/agencies/dph/Pages/covid19.aspx,Specimens,totalTestsViral,Total Tests (PCR),All data,false,Kentucky,21
LA,"Louisiana reports probable deaths on a weekly basis.

Negative test results reported in our API and CSVs are calculated by subtracting **Confirmed cases** from **Total tests (PCR)** in the absence of better data.

On December 25, 2020, Louisiana announced on their [COVID-19 dashboard](https://ldh.la.gov/Coronavirus/) that there would be no update to their data on December 25, 2020 due to the Christmas holiday. On January 1, 2020, they noted that there would be no update to their data on January 1, 2002, due to the New Years holiday.

On December 2, 2020, Louisiana reported a backlog of 1551 cases. As a result, not all new cases reported on December 2, 2020 were reported in the previous 24 hour period.

On December 1, 2020, Louisiana reported that due to a processing error, data reported on December 1 also includes data from November 29-30.

On November 26, 2020, Louisiana announced on their [COVID-19 dashboard](https://ldh.la.gov/Coronavirus/) that there would be no update to their data on November 26, 2020 due to the Thanksgiving holiday.

On November 20, 2020, Louisiana reported a backlog of 2,538 cases, with specimen collection dates ranging from 9/12-11/18, in its total cases. As a result, not all new cases reported on November 20, 2020 were identified in the previous 24 hour period. 

On November 13, 2020, Louisiana started reporting antigen and molecular tests separately on the state's dashboard.

On November 11, 2020, Louisiana did not update their COVID-19 Dashboard in observance of Veterans Day. As a result, no data was updated.

On August 30 Louisiana's reported data included 532 older cases that had not previously been reported; these cases had specimen collection dates ranging back to July 1.

On August 26, 2020, Louisiana started reporting Probable cases, this caused a notable increase in **Total cases**.

On June 19, 2020, Louisiana's data changed due to deduplication and the state's removal of out-of-state cases.

Between April 20 and April 24, 2020, Louisiana did not report testing data from commercial labs due to a state review of data.",http://ldh.la.gov/Coronavirus/,,,,,@LADeptHealth,http://ldh.la.gov/Coronavirus/,Specimens,posNeg,posNeg,Only positives,false,Louisiana,22
MA,"Negative test results reported in our API and CSVs are calculated by subtracting **Confirmed cases** from **Total PCR tests (people)**.

On December 25, 2020, Massachusetts announced on their [COVID-19 page](https://www.mass.gov/info-details/covid-19-response-reporting) that there would be no update to their data on December 25, 2020, or on January 1, 2021. Additionally, they noted that data reported on December 26, 2020 and January 2, 2021 would each include two days of data.

On November 26, 2020, Massachusetts announced on their COVID-19 page that there would be no update to their data on November 26, 2020 due to the the Thanksgiving holiday. Additionally, they announced that the data for November 27, 2020 would include both the data for November 26, 2020 and November 27, 2020.

On November 25, 2020, Massachusetts reported that their data “was delayed today due to a technological issue that resulted in an interruption of the data download. As a result, today’s numbers reflect case counts from up to a 30 hour period"" instead of the usual previous 24-hour period.

As of November 2, 2020, Massachusetts’ **Currently Hospitalized**, **Currently in ICU**, and **Currently on Ventilator** figures include only confirmed cases. Previously these numbers included confirmed and probable hospitalizations.

As of September 11, 2020, Massachusetts’ total test results reflect total specimens. The number of unique people tested is available in our API as `totalTestsPeopleViral`.

On September 2, 2020, MA [reported](https://www.mass.gov/doc/covid-19-dashboard-september-2-2020/download) that it had shifted to using the more restrictive August 6 definition of probable cases released by the CSTE. This change caused a significant decrease in several data points where probable cases or probable deaths were included, particularly the overall case count, which dropped by more than 7,000. Historical data was also affected. 

On August 31, 2020 we updated Massachusetts' **Total PCR Tests (specimens)** before August 12, 2020 based on the state's ""Tests by Date"" dataset, extending the column back to January 22, 2020.

On August 12, 2020, Massachusetts began reporting **probable cases** weekly instead of daily. This can lead to apparent spikes in the data when the weekly numbers are incorporated, as happened on August 19. Beginning August 20, 2020, we will use the daily total case count from the race and ethnicity section of the dashboard, which includes both confirmed and probable cases, and will backfill the previous week's case counts.

On July 31, 2020, Massachusetts noted that ""Delays in the reporting of test results to DPH from multiple laboratories, including large national commercial laboratories, are reflected in today’s case counts. However, these positive test results have been assigned retrospectively to the appropriate date of test."" We will backfill case data for Massachusetts in the near future.

On June 30, 2020, Massachusetts decreased the number of **cumulative hospitalizations** and **confirmed and probable deaths** ""due to ongoing data cleaning which identifies and removes duplicate reports.""

On June 1, 2020, Massachusetts began to report **probable cases** and **probable deaths*, causing **Total cases** and **Total deaths** to appear to increase sharply in our data. ",https://www.mass.gov/doc/covid-19-dashboard-january-14-2021/download,https://www.mass.gov/doc/weekly-covid-19-public-health-report-january-14-2021/download,,,,@massdph,https://www.mass.gov/resource/information-on-the-outbreak-of-coronavirus-disease-2019-covid-19,Specimens,totalTestsViral,Total Tests (PCR),Only positives,false,Massachusetts,25
MD,"As of October 16, 2020, Maryland’s total test results are drawn from our totalTestsViral field instead of calculated via positive+negative. This will result in TotalTestResults only going back to 3/24 instead of 3/5.

On August 31, 2020, we updated Maryland's **Total PCR tests (specimens)** and **Positive PCR tests (specimens)**  prior to 8/16 to match state-provided ""Testing Volume"" data.

On July 31, 2020, we began capturing Maryland's data for **Positive PCR tests (specimens)**.  

Between March 12 and March 28, 2020, Maryland did not report data for **negative tests**.",https://coronavirus.maryland.gov/,https://services.arcgis.com/njFNhDsUCentVYJW/arcgis/rest/services/MDCOVID19_TestingVolume/FeatureServer/0/query?where=1%3D1&outFields=*&outStatistics=[%7B%22statisticType%22%3A+%22sum%22%2C+%22onStatisticField%22%3A+%22number_of_positives%22%2C+%22outStatisticFieldName%22%3A+%22total_number_of_positives%22%7D],https://services.arcgis.com/njFNhDsUCentVYJW/arcgis/rest/services/MDCOVID19_SerologyTests/FeatureServer/0/query?where=1%3D1&outFields=%2A,,,@MDHealthDept,https://phpa.health.maryland.gov/Pages/Novel-coronavirus.aspx,Specimens,totalTestsViral,Total Tests (PCR),All data,false,Maryland,24
ME,"Negative test results reported in our API and CSVs are calculated by subtracting **Confirmed cases** from **Total PCR tests (specimens)** in the absence of better data.

On December 25, 2020, Maine announced on their [COVID-19 page](https://www.maine.gov/dhhs/mecdc/infectious-disease/epi/airborne/coronavirus/data.shtml) that some of their data would not be updated between December 25, 2020 and December 27, 2020 due to the holiday. As a result, we were unable to update Maine’s testing and current hospitalization data on December 25, 2020, and unable to update any data on December 26, 2020.

On December 9, 2020, Maine’s **Total Antigen Tests (specimens)** decreased by 248 on their COVID-19 page, which we believe was an error. The sum of **Positive Antigen Tests,** **Negative Antigen Tests,** and indeterminate antigen tests is 38,632 and Maine reported 36,632. In order to ensure that our data is as accurate as possible, we did not update Maine’s Total Antigen Tests (specimens) on December 9, 2020. (Antigen data is available in our CSVs and API.)

On November 30, 2020, Maine’s Total antigen tests (specimens) and Negative antigen tests (specimens) increased by roughly 11,000, and their Positive antigen tests (specimens) increased by about 400 without explanation. 

On November 26, 2020, Maine announced on their COVID-19 page that there would only be partial updates to their data from November 26, 2020 to November 29, 2020 due to the Thanksgiving holiday. As a result, we were unable to update testing data, and current hospitalization data on November 26, 2020, and unable to update all data points except for Currently hospitalized, Currently in ICU, and Currently on ventilator on November 27, 2020.

On November 11, 2020, Maine did not update testing and hospitalization data: only **Cases,** **Deaths,** and **Recovered** were updated.

On November 2, 2020, Maine started reporting antigen and molecular tests separately on the state's dashboard.

On June 23, 2020, Maine began reporting the dates of **cases**, **deaths**, **recoveries**, and **hospitalizations** on the day they occurred instead of the day the event was reported. Maine also began providing separate figures for **Deaths (probable)** and **Deaths (confirmed)**.

As of May 20, 2020, Maine reports PCR tests and antibody tests separately.",https://www.maine.gov/dhhs/mecdc/infectious-disease/epi/airborne/coronavirus/data.shtml,https://www.maine.gov/dhhs/mecdc/infectious-disease/epi/airborne/coronavirus/data.shtml,https://www.maine.gov/dhhs/mecdc/infectious-disease/epi/airborne/coronavirus/data.shtml,https://analytics.maine.gov/t/CDCExternal/views/covid-19-maine-cdc-dashboard-nav-buttons/1_Casetrendsbycounty?:embed=y&:showVizHome=no&:host_url=https%3A%2F%2Fanalytics.maine.gov%2F&:embed_code_version=3&:tabs=no&:toolbar=yes&:showAppBanner=false&:display_spinner=no&:loadOrderID=1,https://analytics.maine.gov/t/CDCExternal/views/covid-19-maine-cdc-dashboard-nav-buttons/1_Casetrendsbycounty?:embed=y&:showVizHome=no&:host_url=https%3A%2F%2Fanalytics.maine.gov%2F&:embed_code_version=3&:tabs=no&:toolbar=yes&:showAppBanner=false&:display_spinner=no&:loadOrderID=1,@mainedhhs,https://www.maine.gov/dhhs/mecdc/infectious-disease/epi/airborne/coronavirus.shtml,Specimens,posNeg,posNeg,Only positives,false,Maine,23
MI,"Michigan updates its **Recovered** metric weekly and does not update any data on Sundays.

Our source for **Now hospitalized** and **Now in ICU** data in Michigan generally updates on Mondays and Fridays only. 

Michigan combines PCR and antigen tests in the total tests figure reported on the state's dashboard. 

On January 2, 2021, Michigan did not publish updated testing data by the time of our daily update. As a result, we were unable to update Total Antibody Tests, Total Tests (PCR), Positive Tests (PCR), Negative Tests (PCR), or Negative (People or Cases) on January 2, 2021.

On December 23, 2020, Michigan announced via a [press release](https://www.michigan.gov/coronavirus/0,9753,7-406-98158-548250--,00.html) that their data would not be updated on December 24, 2020, December 25, 2020, December 31, 2020, or January 1, 2021 due to the holidays.

On November 24, 2020, Michigan announced via a [press release](https://www.michigan.gov/coronavirus/0,9753,7-406-98158-545993--,00.html) that there would be no update to their data on November 26, 2020 due to Thanksgiving holiday. On November 27, 2020, the state resumed data reporting where case counts would include cases since Wednesday, November 25, 2020. The state estimated that the average number of cases across November 26 and November 27, 2020 would be 8,581 cases per day.

On October 29, 2020, Michigan experienced connectivity issues resulting in some cases that would have been reported tomorrow to be reported today. This is due to the fact that the state has a strict 10AM cutoff for daily data reporting. This means the daily increase in cases encompasses more than one day's worth of data.

On October 15, 2020, Michigan announced that due to a laboratory result processing slowdown, several cases that would normally have been included in the October 14, 2020 update were reported on October 15, 2020. The issue has since been resolved. As a result, cases reported on October 15, 2020 may not have been reported within the last 24 hour period.

As of July 7, 2020, Michigan updates its death figures three times a week after conducting reviews of death certificates. As a result, ""new"" deaths may not always reflect deaths in the past 24 hours.

On June 11, 2020, we updated our historical data from a spreadsheet provided by Michigan's Department of Health and Human Services in order to reflect the lab-reported dates of **probable and confirmed cases** and **probable and confirmed deaths** by date of death.

Since March 10, 2020, Michigan has reported each day's Positive and Negative tests (people) by county but has never totaled these metrics for the state. We add new Positive and Negative tests (people) values daily to a running sum and report the total. ","https://www.michigan.gov/coronavirus/0,9753,7-406-98163_98173---,00.html","https://www.michigan.gov/coronavirus/0,9753,7-406-98159-523641--,00.html","https://www.michigan.gov/coronavirus/0,9753,7-406-98163_98173-531113--,00.html",https://app.powerbigov.us/view?r=eyJrIjoiNDY0ZGVlMDItMzUzNC00ZGE5LWFjYzQtNzliOGJkZWQ4YTgzIiwidCI6ImQ1ZmI3MDg3LTM3NzctNDJhZC05NjZhLTg5MmVmNDcyMjVkMSJ9,,@MichiganHHS,https://www.michigan.gov/coronavirus,Specimens,totalTestsViral,posNeg,All data,false,Michigan,26
