state,notes,covid19Site,covid19SiteSecondary,covid19SiteTertiary,twitter,covid19SiteOld,name,fips,pui,pum
MS,"Negatives = Total - Positives.
Hospitalizations are calculated by calculating multiplying % of hospitalized times total cases, pending clarification from the state. Recoveries are estimated, and updated twice weekly.

As of May 23, Mississippi is separating out PCR and antibody tests; we report PCR specimens tested. Total tests might be impacted. Mississippi notes that hospitalization data for May 23 is incomplete.

On June 11, due to a technical issue, Mississippi did not provide new updates. 

On June 17, Mississippi paused reporting data: ""Our daily COVID-19 update will be limited as we work to resolve technical problems in our data reporting system."" Data was sporadically updated until on June 22, Mississippi added five days' backlog of case and death data.

On July 7 we erroneously reported additional Negatives for Mississippi. We have corrected the error.","https://msdh.ms.gov/msdhsite/_static/14,0,420.html",,,@msdh,"https://msdh.ms.gov/msdhsite/_static/14,0,420.html",Mississippi,28,,false
MT,"Negative = Total - Positive.  The dashboard says that the data ""as-of"" is from the day previous - in this case we use current date + time = 0:00.

On June 17, Cumulative Hospitalizations reported by Montana decreased from 79 to 78 with no explanation.",https://montana.maps.arcgis.com/apps/MapSeries/index.html?appid=7c34f3412536439491adcc2103421d4b,https://dphhs.mt.gov/publichealth/cdepi/diseases/coronavirusmt/demographics,,@dphhsmt,https://dphhs.mt.gov/publichealth/cdepi/diseases/coronavirusmt,Montana,30,,false
NC,"Negative = Total tests* - total positives (where total tests include all data from public labs and partial data from hospital and commercial labs).

On July 21, NC announced: ""North Carolina has launched new, more detailed hospitalization data to provide more insights into North Carolina’s hospital capacity. NCDHHS continuously works to improve its data systems and has recently begun transitioning to a more automated system for collecting this information. In transitioning to this system, there will be a small shift in hospitalization numbers - the change over the past 30 days is displayed below. This is due to changes in the system including hospital information feeding in over night being backdated in the new system."" Beginning July 22 this change means that there is Current ICU information available. We will work to backfill its time series of NC hospital data as well.  

On August 12, NCDHHS announced a major correction in its cumulative test counts, resulting in a decrease of over 220,000 tests ever completed. A LabCorp official stated: ""From late April until last week, Pixel by LabCorp at-home test collection kits that originated out-of-state but were processed in North Carolina were inadvertently included in the manual data submission to the state. We quickly corrected the issue and provided the updated manual reports to NCDHHS. LabCorp’s daily electronically reported data was accurate and unaffected by the error, and this issue does not affect other states or any results reported to patients or their providers."" See the NCDHHS website for more information.",https://www.ncdhhs.gov/covid-19-case-count-nc,https://files.nc.gov/covid/documents/dashboard/Weekly-COVID19-Patients-Presumed-to-be-Recovered.pdf,https://public.tableau.com/views/NCDHHS_COVID-19_Dashboard_HospitalizationsE/Hospitalizations?:embed=y&:showVizHome=no&:host_url=https%3A%2F%2Fpublic.tableau.com%2F&:embed_code_version=3&:tabs=no&:toolbar=no&:animate_transition=yes&:display_static_image=no&:display_spinner=no&:display_overlay=yes&:display_count=no&:language=en&publish=yes&:loadOrderID=0,@ncdhhs,https://www.ncdhhs.gov/divisions/public-health/coronavirus-disease-2019-covid-19-response-north-carolina,North Carolina,37,,false
ND,"As of May 2, North Dakota is reporting people tested. 

On May 3, North Dakota began providing counts of deaths for lab-confirmed individuals with death records still pending, and lab-confirmed individuals who died but not due to COVID. As of July 1, we have edited our figures to exclude these numbers from our death counts, resulting in an apparent drop from 24 deaths on May 2 to 16 on May 3. 

On June 18, North Dakota revised down its confirmed death count from 66 to 64. 

On June 24, North Dakota revised its confirmed death count from 67 to 66 to remove an out-of-state case.",https://www.health.nd.gov/diseases-conditions/coronavirus/north-dakota-coronavirus-cases,,,@NDDOH,https://www.health.nd.gov/diseases-conditions/coronavirus,North Dakota,38,,false
NE,"On April 27 the death total of 56 included a death erroneously entered into Nebraska’s electronic system. Nebraska removed it from the total count on April 28. 

On July 8, Nebraska decreased deaths by one with no explanation. On July 12, NE again decreased deaths by one with no explanation.",https://experience.arcgis.com/experience/ece0db09da4d4ca68252c3967aa1e9dd,,,@NEDHHS,http://dhhs.ne.gov/Pages/Coronavirus.aspx,Nebraska,31,,false
NH,"On May 4, New Hampshire revised the recovered down from 1107 to 1017. Negative count is from the four largest labs. Pending count is from the Public Health Laboratories only. As of April 27, New Hampshire is reporting people tested.

As of May 25, New Hampshire is separating out the numbers of people tested with PCR and antibody tests; we report the number of people tested with PCR tests.

On June 13, New Hampshire revised its hospitalizations down from 504 to 503, removing cases that were not New Hampshire residents.",https://www.dhhs.nh.gov/dphs/cdcs/2019-ncov.htm,https://www.nh.gov/covid19/dashboard/summary.htm,,@NHPubHealth,https://www.dhhs.nh.gov/dphs/cdcs/2019-ncov.htm,New Hampshire,33,,false
NJ,"""Positive count includes deaths. Hospitalization + ICU counts include both positive cases and persons under investigation. As of May 11, New Jersey is reporting total PCR specimens tested.

On May 16, New Jersey had a significant jump in recovered (about 7,000) due to backfilling previous days after a shift in how this figure was reported on April 28.

On July 16, New Jersey decreased the number of cumulative recoveries.

On July 19, New Jersey reported 31 fewer cases than the preceding day. We believe this drop was due to reclassifying probable cases.

On July 20, New Jersey decreased the number of cumulative hospitalizations.

On August 4, New Jersey reported current hospitalizations of 470, down from the previous report of 738 on August 3

Beginning on August 5, New Jersey is not publishing the PDF in which it usually reports Cumulative Hospitalized.""

On August 7th, we backfilled New Jersey's probable deaths based on a state-provided time series of probable deaths by death date. We also updated historical values for the total death column so that it combines confirmed deaths by date reported on the NJ dashboard with probable deaths by death date. This removed some previous dramatic changes in the total death number that were due to sporadic reporting of probable deaths (e.g. 1854 all reported on June 25, decreases in deaths on 7/22 and 7/29, etc.).",https://covid19.nj.gov/#live-updates,https://maps.arcgis.com/apps/MapSeries/index.html?appid=c2efd1898e48452e83d7218329e953d7&entry=2,,@NJDeptofHealth,https://www.nj.gov/health/cd/topics/ncov.shtml,New Jersey,34,,false
NM,"Hospitalization count is people in New Mexico hospitals: it includes people who tested positive out of state but are hospitalized in New Mexico, and excludes New Mexicans who tested positive in state and transferred to a hospital out of state. 

As of April 27, New Mexico is reporting people tested. On May 28, New Mexico reported ~1100 less tests than the day before with no explanation.",https://cvprovider.nmhealth.org/public-dashboard.html,,,@NMDOH,https://cv.nmhealth.org/,New Mexico,35,,false
NV,"Individual data fields have different update times; we use the latest as our ""Last Update"" time. Until May 10, hospitalizations, ICU bed usage, and ventilator usage were reported as a percentage of total capacity in daily situation reports, but total capacity is not published, so we did not estimate those numbers. 

As of May 6, Nevada is reporting both specimens and people tested. We report positives and negatives based on the number of people tested. ",https://app.powerbigov.us/view?r=eyJrIjoiMjA2ZThiOWUtM2FlNS00MGY5LWFmYjUtNmQwNTQ3Nzg5N2I2IiwidCI6ImU0YTM0MGU2LWI4OWUtNGU2OC04ZWFhLTE1NDRkMjcwMzk4MCJ9,http://dpbh.nv.gov/coronavirus/,,@dhhsnevada,http://dpbh.nv.gov/coronavirus/,Nevada,32,,false
NY,"Numbers come from [press conference](https://www.governor.ny.gov). 
Recovered = discharged. 

As of April 27, New York is reporting people tested. Cumulative hospitalized and recovered were calculated using the 3 day average change in hospitalization benchmarked from April 12.

There is a significant gap between deaths reported by New York City and New York State. As of June 1, the difference between the state reported deaths, which we use, and the NYC deaths was 5740",https://coronavirus.health.ny.gov/county-county-breakdown-positive-cases,https://covid19tracker.health.ny.gov/views/NYS-COVID19-Tracker/NYSDOHCOVID-19Tracker-Fatalities?%3Aembed=yes&%3Atoolbar=no&%3Atabs=n,https://www.governor.ny.gov/news/governor-cuomo-updates-new-yorkers-states-progress-during-covid-19-pandemic,@healthnygov,https://www.health.ny.gov/diseases/communicable/coronavirus/,New York,36,,false
OH,Ohio now publishes detailed [Key Metrics](https://coronavirus.ohio.gov/wps/portal/gov/covid-19/dashboards/key-metrics/cases),https://coronavirus.ohio.gov/wps/portal/gov/covid-19/,https://coronavirus.ohio.gov/wps/portal/gov/covid-19/dashboards/key-metrics/cases,https://coronavirus.ohio.gov/wps/portal/gov/covid-19/dashboards/key-metrics/hospitalizations,@OHdeptofhealth,https://odh.ohio.gov/wps/portal/gov/odh/know-our-programs/Novel-Coronavirus/welcome/,Ohio,39,,false
OK,"[Executive Order Reports](https://coronavirus.health.ok.gov/executive-order-reports)
first reported [comprehensive test results](https://coronavirus.health.ok.gov/articles/new-data-private-labs-show-tenfold-increase-covid-19-tests-administered-oklahoma-dating) on April 6. We exclude ""Positive (Out-of-State)"" results, as we assume these are isolated outside the state.

As of April 27, Oklahoma is reporting specimens tested. Because some people may be tested more than once, this number is probably higher than the number of people tested.
Due to differences in reporting, the number of negative tests might include inconclusive tests.
Oklahoma noted that reported case counts for July 19 and July 20 were inaccurately low due to technical issues. 

On July 21st, Oklahoma did not update the numbers of cases, positive tests, recoveries, or deaths.",https://coronavirus.health.ok.gov/,,,@HealthyOklahoma,https://coronavirus.health.ok.gov,Oklahoma,40,,false
OR,"Total includes Oregon & Montana residents tested in Idaho. 

As of April 27, Oregon is reporting people tested. 

For June 15, we reported deaths, cases and negatives from Oregon’s press release from [June 14](https://www.oregon.gov/oha/ERD/Pages/Oregon-reports-101-new-confirmed-presumptive-COVID-19-cases-2-new-deaths.aspx). 

On June 20, per weekend report, two cases in Polk County previously reported as COVID-19 were determined to be non-COVID-19 and numbers updated to reflect the change.",https://www.oregon.gov/oha/PH/DISEASESCONDITIONS/DISEASESAZ/Pages/emerging-respiratory-infections.aspx,https://public.tableau.com/profile/oregon.health.authority.covid.19#!/vizhome/OregonCOVID-19Update/CaseandTesting,https://public.tableau.com/profile/oregon.health.authority.covid.19#!/vizhome/OregonCOVID-19TestingandOutcomesbyCounty/OregonsCOVID-19TestingandOutcomesbyCounty?:display_count=y&:toolbar=n&:origin=viz_share_link&:showShareOptions=false,@OHAOregon,https://www.oregon.gov/oha/PH/DISEASESCONDITIONS/DISEASESAZ/Pages/emerging-respiratory-infections.aspx,Oregon,41,,false
PA,"County level data may differ from the state totals. We are not adding deaths back into positives. 

On April 23, Pennsylvania revised down its total deaths from 1,622 to 1,421 to exclude some probable deaths that needed further confirmation to be linked to COVID 19.",https://www.health.pa.gov/topics/disease/coronavirus/Pages/Cases.aspx,https://pema.maps.arcgis.com/apps/opsdashboard/index.html?rand_1596123643354=1596123643354#/034bec0bab3b450888a32012f81b8fe4,,@PAHealthDept,https://www.health.pa.gov/topics/disease/Pages/Coronavirus.aspx,Pennsylvania,42,,false
PR,"Death counts include both confirmed and presumed COVID deaths.
When it is reported, we add inconclusive results to pending.
Positive counts reflect individual who test positive, combining both PCR and antibody.

On April 22, Puerto Rico revised down its positive count from 1,298 to 915 to exclude double-counted cases.

Puerto Rico reported negative testing numbers through April 23, after no updates we removed these from our data on May 6. Total test numbers were impacted by around 9,000.

On July 7, we added back negative testing numbers based on sporadic press reports in May and June.",https://estadisticas.pr/en/covid-19,https://bioseguridad.maps.arcgis.com/apps/opsdashboard/index.html#/3bfb64c9a91944bc8c41edd8ff27e6df,,@DeptSaludPR,http://www.salud.gov.pr/Pages/coronavirus.aspx,Puerto Rico,72,,false
RI,"Recovered numbers are from hospital discharges. Rhode Island updates Monday through Friday by noon. 

On July 8, Rhode Island started reporting test numbers in people in addition to specimens. We backfilled the data from their CSV. Since people is the default reporting metric in CTP for tests, this represents a drop in tests from previous reporting of approximately 50k tests. The number of PCR tests, positives, and negatives is available in our API.",https://health.ri.gov/data/covid-19/,https://docs.google.com/spreadsheets/d/1c2QrNMz8pIbYEKzMJL7Uh2dtThOJa2j1sSMwiDo5Gz4/edit#gid=264100583,https://docs.google.com/spreadsheets/d/1c2QrNMz8pIbYEKzMJL7Uh2dtThOJa2j1sSMwiDo5Gz4/edit#gid=1592746937,@rihealth,https://health.ri.gov/diseases/respiratory/?parm=163,Rhode Island,44,,false
SC,"As of May 22, South Carolina is reporting specimens tested. Because some people may be tested more than once, this number is probably higher than the number of people tested. 

As of June 11, South Carolina is separating out PCR and antibody tests; we report the number of PCR tests. Total test numbers were impacted by around 22,000.

On July 18, the South Carolina DHEC announced it was transitioning to new reporting systems and that ""there may be incomplete data with significant gaps."" Though reporting resumed July 28, this resulted in data being carried over at times. We will backfill with the updated numbers when they are available.",https://scdhec.gov/health/infectious-diseases/viruses/coronavirus-disease-2019-covid-19/monitoring-testing-covid-19,https://www.scdhec.gov/infectious-diseases/viruses/coronavirus-disease-2019-covid-19/sc-demographic-data-covid-19,https://scdhec.gov/infectious-diseases/viruses/coronavirus-disease-2019-covid-19,@scdhec,https://scdhec.gov/health/infectious-diseases/viruses/coronavirus-disease-2019-covid-19,South Carolina,45,,false
SD,"On July 27, South Dakota reduced the count of negative tests from 98531 to 98383.",https://doh.sd.gov/news/Coronavirus.aspx,,,@SDDOH,https://doh.sd.gov/news/Coronavirus.aspx,South Dakota,46,,false
TN,"Tennessee now provides positive and negative test results from all laboratories. 

On April 5, the state reported a decline in recoveries. 

As of June 7, positives include both confirmed and probable cases of COVID-19 reported to or tested by the Tennessee Department of Health. 

As of July 3, hospitalizations include both positive and pending cases. 

On July 3, we updated hospitalizations from March 31 through July 3 to include both positive and pending cases.",https://www.tn.gov/health/cedep/ncov.html,https://apps.health.tn.gov/AEM_embed/TDH-2019-Novel-Coronavirus-Epi-and-Surveillance.pdf#toolbar=0,https://www.tn.gov/health/cedep/ncov/data/hospitalization-data/current-covid-hospitalizations.html,@TNDeptofHealth,https://www.tn.gov/health/cedep/ncov.html,Tennessee,47,,false
TX,"As of May 16, Texas is reporting mostly specimens tested, except for the small number of tests performed by public labs, which are de-duplicated. 

As of May 23, Texas is separating out PCR and antibody tests; we report the number of PCR tests. Total tests might be impacted. On June 16, Texas notes that ""The reported cases for June 16 include 2,622 new cases and 1,476 cases that were previously diagnosed among Texas Department of Criminal Justice inmates but that had not been reported by local health departments (887 from Anderson County and 589 from Brazoria County)."" 

On July 22, we began reporting ICU hospitalizations for Texas. We are currently looking through historical data to maintain an accurate time-series. 

On July 25, Texas reported that 2092 probable cases had been removed from the statewide case totals by the Corpus Christi-Nueces County Public Health District. That removal meant that the number of total cases for Texas appeared smaller than it was. The actual number of new cases in Texas that day was 8112, not 6020. 

On July 27, Texas added 675 additional deaths through death certificate reviews. However only 44 deaths were truly new deaths on July 27. This will inflate the daily increase in deaths until the timeseries has been backfilled based on this revision 

Starting July 23, Texas has reported that its current hospitalization and ICU numbers are incomplete due to its transition to the HHS reporting system. We carried over hospitalization figures until July 28. We will backfill the complete numbers for July 23 - July 28 when reporting is back at 100%.

On July 30, Texas posted that ""Cumulative fatalities have been corrected for July 27, 28 and 29.  As DSHS shifted to using death certificate data to count fatalities this week, an automation error caused approximately 225 fatalities to be included that did not have COVID-19 listed as a direct cause of death.""

On August 2, Texas posted that, ""New data will not be posted on this dashboard on Sunday, August 2 due to a scheduled upgrade to the system that processes electronic lab reports. Data for Sunday will be posted with Monday’s data update.""",https://txdshs.maps.arcgis.com/apps/opsdashboard/index.html#/ed483ecd702b4298ab01e8b9cafc8b83,https://www.dshs.texas.gov/coronavirus/TexasCOVID-19HospitalizationsOverTimebyTSA.xlsx,https://txdshs.maps.arcgis.com/apps/opsdashboard/index.html#/0d8bdf9be927459d9cb11b9eaef6101f,@TexasDSHS,https://dshs.texas.gov/coronavirus/,Texas,48,,false
UT,"Positive count includes non-Utah residents. Negative = Total - Positive. According to the state, negative test results may lag for up to 72 hours.

As of April 27, Utah is reporting people tested. 

As of June 11, Utah reports a combined case count for total intubated patients and patients on a ventilator. We report this figure as cumulative on ventilator.",https://coronavirus-dashboard.utah.gov/,https://coronavirus-dashboard.utah.gov/#hospitalizations,,@utahdepofhealth,https://health.utah.gov/coronavirus,Utah,49,,false
VA,"Virginia hospitalization statistics from [Hospital dashboard](https://www.vhha.com/communications/virginia-hospital-covid-19-data-dashboard/)  We assume the count ""hospitalized in the ICU"" includes the count ""currently on a ventilator."" Cumulative Hospitalized is computed from currently hospitalized + discharged on the Virginia Hospitals dashboard. 

As of May 15, Virginia is reporting specimens tested; including both a value for PCR tests only and all tests (PCR and antibody tests combined). We report the number of PCR tests. Total tests may be impacted.

On Aug 7, due to the release of a backlog, Virginia saw an abnormally large positive case increase of around 2000.",https://public.tableau.com/views/VirginiaCOVID-19Dashboard/VirginiaCOVID-19Dashboard?:embed=yes&:display_count=yes&:showVizHome=no&:toolbar=no,https://www.vhha.com/communications/virginia-hospital-covid-19-data-dashboard/,,@vdhgov,http://www.vdh.virginia.gov/surveillance-and-investigation/novel-coronavirus/,Virginia,51,,false
VI,"Virgin Islands: Positive, Negative, and Pending provided. 

On August 5, the US Virgin Islands COVID-19 page apparently reported an old count of Tested persons from 8/1, but reported a new count of Tested persons in its Situation Report. We used the number from the Situation Report. ",https://doh.vi.gov/covid19usvi,https://www.covid19usvi.com,,@usvidoh,https://doh.vi.gov/,US Virgin Islands,78,,false
VT,"Negative = (Total Tested - Positives). 

Vermont reports both Currently Hospitalized (implicitly, confirmed cases only) and Hospitalized Under Investigation. For Currently Hospitalized, we sum these two numbers. 

As of May 2, Vermont is reporting people tested.

Between May 15 and May 16, Vermont decreased their total tests by about 1,000; as of May 16 it is unclear if this was a typo or a revision of a previously preliminary count.",https://experience.arcgis.com/experience/85f43bd849e743cb957993a545d17170,https://www.healthvermont.gov/response/coronavirus-covid-19/current-activity-vermont#dashboard,,@healthvermont,https://www.healthvermont.gov/response/infectious-disease/2019-novel-coronavirus,Vermont,50,,false
WA,"Washington reports confirmed cases, laboratory tests, and deaths as of the previous day. 

Washington did not report new negative test results between March 31 and April 15.

On April 18, data cleaning removed 190 confirmed cases that were discovered to be out of state residents tested in Washington labs. 

As of April 27, Washington is reporting people tested. 

On June 18, due to a previous mistake in reporting negative cases, Washington state revised down the total number of tests. Additionally, Washington state removed seven deaths from its counts where, though the individual who died tested positive, COVID was not a contributing cause in their death.

On June 22, we updated historic numbers of cases and tests from data on Washington's dashboard. This update will temporarily cause an artificial decline in cases and numbers between June 21 and June 22. 

On July 11, WA revised its hospitalizations down by 3 from 4665 to 4662.

On July 14, Washington state removed 39 deaths from its counts where, though the individual who died tested positive, COVID was not a contributing cause in their death. 

Starting August 2, Washington DOH reported ""DOH is continuing to experience issues with its reporting system today.  We are able to report cases, deaths and hospitalizations but have not reported new negative test results since 8/1.""",https://www.doh.wa.gov/Emergencies/NovelCoronavirusOutbreak2020COVID19/DataDashboard,https://www.doh.wa.gov/Emergencies/Coronavirus,,@WADeptHealth,https://www.doh.wa.gov/Emergencies/Coronavirus,Washington,53,,false
WI,"Negatives include only Wisconsin residents whose negative test results were reported electronically to DHS. This underestimates total negative test results. 

Deaths must be reported by health providers or coroners, and recorded by local health departments, to be counted. 

As of April 27, Wisconsin is reporting people tested. 

On March 30, Wisconsin revised down negatives from 16550 to 15856.

In early June, Wisconsin started breaking out its probable cases. On June 25, we caught these figures, initially causing a large single day jump in cases, but in the late evening we updated our historical case numbers to include these on the appropriate days based on historical data provided to us by the state. In early June, 

Wisconsin started breaking out its probable deaths. On June 29, we caught these figures, and only have data for them past that date.

On July 12, Wisconsin decreased deaths by one with no explanation.",https://www.dhs.wisconsin.gov/outbreaks/index.htm,https://www.dhs.wisconsin.gov/covid-19/data.htm,https://www.dhs.wisconsin.gov/covid-19/hosp-data.htm,@DHSWI,https://www.dhs.wisconsin.gov/disease/covid-19.htm,Wisconsin,55,,false
WV,"Negatives = Totals - Positives. As of April 16, WV reports hospitalization + ICU + ventilator counts from 49 of 55 counties. 

Before April 16, those counts were unreliable -- based on reported percentages of completed investigations, an unpublished number.

As of May 23, West Virginia is separating out PCR and antibody tests; we report the number of PCR tests. Total tests might be impacted. 

As of July 4, West Virginia makes changes to its previous data for antibody testing, so its historical time series might not match ours until we backfill our data to match theirs.",https://dhhr.wv.gov/Coronavirus%20Disease-COVID-19/Pages/default.aspx,https://app.powerbigov.us/view?r=eyJrIjoiYmIyYTE0YWYtZDMyOS00YjAzLTgxZTItZDIyMmNlYTZmMWVkIiwidCI6IjhhMjZjZjAyLTQzNGEtNDMxZS04Y2FkLTdlYWVmOTdlZjQ4NCJ9&pageName=ReportSection3aff85597cada99d298f&pageName=ReportSection9f5bc3be6e9ebda92968,https://app.powerbigov.us/view?r=eyJrIjoiYmIyYTE0YWYtZDMyOS00YjAzLTgxZTItZDIyMmNlYTZmMWVkIiwidCI6IjhhMjZjZjAyLTQzNGEtNDMxZS04Y2FkLTdlYWVmOTdlZjQ4NCJ9&pageName=ReportSection4bb4fbc7d2bc2ad57511,@WV_DHHR,https://dhhr.wv.gov/Coronavirus%20Disease-COVID-19/Pages/default.aspx,West Virginia,54,,false
