date,state,positive,negative,pending,hospitalizedCurrently,hospitalizedCumulative,inIcuCurrently,inIcuCumulative,onVentilatorCurrently,onVentilatorCumulative,recovered,dataQualityGrade,lastUpdateEt,hash,dateChecked,death,hospitalized,total,totalTestResults,posNeg,fips,deathIncrease,hospitalizedIncrease,negativeIncrease,positiveIncrease,totalTestResultsIncrease
20200520,AK,402,36643,,16,,,,,,352,C,5/20/2020 00:00,fbd2c4d7f2f9bb5886519ca013a5582d05a2322c,2020-05-20T20:00:00Z,10,,37045,37045,37045,02,0,0,662,3,665
20200520,AL,12744,151706,,,1493,,524,,309,,B,5/19/2020 00:00,fc74b5a0d85554eb568628788cfab89828235631,2020-05-20T20:00:00Z,517,1493,164450,164450,164450,01,13,40,6516,368,6884
20200520,AR,5003,91255,,78,535,,,14,101,3852,A,5/20/2020 00:00,8cf09ad59fe07fd22c8d7872f13e6a89e2330024,2020-05-20T20:00:00Z,107,535,96258,96258,96258,05,5,0,2477,80,2557
20200520,AS,0,124,,,,,,,,,D,5/19/2020 00:00,b17187aa654adddc868eec1438cbfceb53964c13,2020-05-20T20:00:00Z,0,,124,124,124,60,0,0,0,0,0
20200520,AZ,14897,150538,,810,1792,298,,208,,3773,A+,5/20/2020 00:00,b1b84c773495f600cdad6b1e420d1c25d58354cc,2020-05-20T20:00:00Z,747,1792,165435,165435,165435,04,43,46,3533,331,3864
20200520,CA,84057,1296063,,4681,,1345,,,,,B,5/20/2020 00:00,6be7a20ccb8deab94178b9db3e70d2c1cf2147c7,2020-05-20T20:00:00Z,3436,,1380120,1380120,1380120,06,102,0,38542,2262,40804
20200520,CO,22482,109355,,626,3955,,,,,3478,A,5/20/2020 00:00,f1e624518c3e0cbb8a82aeffa19010138d94fbfe,2020-05-20T20:00:00Z,1257,3955,131837,131837,131837,08,33,56,224,280,504
20200520,CT,39017,151701,,887,10946,,,,,6264,B,5/20/2020 16:00,09a1fb75d7a153b27aff1fabc601dc6f894b5e33,2020-05-20T20:00:00Z,3529,10946,190718,190718,190718,09,57,0,4611,587,5198
20200520,DC,7551,32868,,336,,,,74,,1059,A,5/19/2020 00:00,c104161c3fde2a6cf053ad4c9dfcf42bd6a30c39,2020-05-20T20:00:00Z,407,,40419,40419,40419,11,7,0,928,117,1045
20200520,DE,8194,37218,,220,,,,,,3965,B,5/19/2020 18:00,1238d97d6d08b453fa60c798055bd71e6968c2f6,2020-05-20T20:00:00Z,310,,45412,45412,45412,10,6,0,1123,157,1280
20200520,FL,47471,723877,1357,472,8934,232,,,,,A+,5/20/2020 09:42,3c953fc1fec5361f16fc7dc42c9d79dbbe821cb0,2020-05-20T20:00:00Z,2173,8934,772705,771348,771348,12,44,190,54966,527,55493
20200520,GA,39647,363293,,959,7107,,1617,,,,A,5/20/2020 13:00,0e81a8dafae0910fd2fa794a2031d49b427820c6,2020-05-20T20:00:00Z,1687,7107,402940,402940,402940,13,23,80,23858,926,24784
20200520,GU,165,4807,,,,,,,,125,C,5/20/2020 06:30,a25b34e32099b899780c58630867d556d1d1e3f9,2020-05-20T20:00:00Z,5,,4972,4972,4972,66,0,0,134,11,145
20200520,HI,641,45663,,,82,,,,,578,C,5/19/2020 18:00,36131a820aace240dada1a2ccb5933bbab899fa0,2020-05-20T20:00:00Z,17,82,46304,46304,46304,15,0,0,1280,1,1281
20200520,IA,15614,95134,,381,,126,,84,,8362,A+,5/20/2020 00:00,351c63004cc136c1d76db041c07915f83bc9e45e,2020-05-20T20:00:00Z,388,,110748,110748,110748,19,16,0,2835,265,3100
20200520,ID,2476,36091,,,215,,89,,,1668,B,5/19/2020 19:00,1c1bf50759875898ad6a6ebe8db57d27236cba19,2020-05-20T20:00:00Z,77,215,38567,38567,38567,16,3,2,477,21,498
20200520,IL,100418,542295,,3914,,1005,,554,,,A,5/20/2020 00:00,e9662e68250154ce3144193073d08e9fdb4272cc,2020-05-20T20:00:00Z,4525,,642713,642713,642713,17,146,0,18641,2388,21029
20200520,IN,29274,166464,,1288,4389,431,990,197,,,A+,5/19/2020 23:59,75cb7f6a63e07b80d2754800059960dd752bdb0e,2020-05-20T20:00:00Z,1864,4389,195738,195738,195738,18,40,0,5839,569,6408
20200520,KS,8539,62664,,,760,,258,,116,473,A+,5/20/2020 10:00,239f7a0ad07da70297fe5eca1a62cf53404dcb1e,2020-05-20T20:00:00Z,178,760,71203,71203,71203,20,5,20,4014,199,4213
20200520,KY,8069,145917,,443,2010,269,875,,,2826,A,5/19/2020 17:00,75c889317de52b4219bf1f3fdeb47314e48fcc97,2020-05-20T20:00:00Z,366,2010,153986,153986,153986,21,0,30,0,0,0
20200520,LA,35316,250654,,931,,,,110,,26249,B,5/20/2020 13:00,4ebe431eb0773c78da2988a42f34370d0e67f6c9,2020-05-20T20:00:00Z,2608,,285970,285970,285970,22,27,0,7619,278,7897
20200520,MA,88970,400983,,2518,8897,675,,,,,A,5/20/2020 10:00,dc7f6504182e05be1016791a23d13850fe30b54c,2020-05-20T20:00:00Z,6066,8897,489953,489953,489953,25,128,131,11968,1045,13013
20200520,MD,42323,173007,,1410,7393,539,,,,2993,,5/20/2020 10:00,ede4b150de2fd83dca080e1f391f518df1c9b3fb,2020-05-20T20:00:00Z,2123,7393,215330,215330,215330,24,42,194,5895,777,6672
20200520,ME,1819,35450,,43,231,24,,12,,1100,B,5/20/2020 12:30,6841cbc18f413f5e98ec420d21c42b7feb1774bd,2020-05-20T20:00:00Z,73,231,37269,37269,37269,23,0,6,13358,78,13436
20200520,MI,53009,384063,,1066,,492,,332,,28234,A+,5/20/2020 11:00,9ed106ed0c86b787c8dc359de7ca9ce7a2ea1fe7,2020-05-20T20:00:00Z,5060,,437072,437072,437072,26,43,0,13509,659,14168
20200520,MN,17670,149668,,550,2308,212,773,,,12227,A,5/19/2020 17:00,690fdbcf2ba8608cbc8354c36acc8f0964bde1c9,2020-05-20T20:00:00Z,786,2308,167338,167338,167338,27,29,87,4862,641,5503
20200520,MO,11232,150752,,546,,,,103,,,B,5/20/2020 15:00,59c63344f909faedc336a6f4ddbb045ca5af86fe,2020-05-20T20:00:00Z,631,,161984,161984,161984,29,15,0,7722,152,7874
20200520,MP,21,3796,,,,,,,,13,D,5/20/2020 00:00,f4d221a70d23824b1748360f53c42cd204089fab,2020-05-20T20:00:00Z,2,,3817,3817,3817,69,0,0,0,0,0
20200520,MS,11967,108713,,644,1901,157,,89,,7681,A,5/19/2020 19:00,a4bc97dd1cd3490d15cf952d63c36adfa9f22697,2020-05-20T20:00:00Z,570,1901,120680,120680,120680,28,16,61,2657,263,2920
20200520,MT,478,29248,,3,65,,,,,440,C,5/20/2020 00:00,2f3881f0a568e83a0c15c272c4bc075eeda1211f,2020-05-20T20:00:00Z,16,65,29726,29726,29726,30,0,0,769,7,776
20200520,NC,20122,257481,,554,,,,,,11637,A,5/20/2020 12:15,f1570109d8fcd76a1d363b2c41d9a0ab7bfc387a,2020-05-20T20:00:00Z,702,,277603,277603,277603,37,11,0,12173,422,12595
20200520,ND,2095,57105,,38,142,,,,,1302,C,5/20/2020 01:59,40a29c111a2b27e46383d54173de85d184681ef1,2020-05-20T20:00:00Z,49,142,59200,59200,59200,38,4,7,1368,101,1469
20200520,NE,10846,61289,,,,,,,,,D,5/19/2020 19:00,d6b6f2ef9b9710b1f1929af124f35f2d1048a919,2020-05-20T20:00:00Z,132,,72135,72135,72135,31,7,0,1930,221,2151
20200520,NH,3721,47167,861,105,383,,109,,,1275,B,5/19/2020 09:00,a959302f6fca6e30d64cde469662fde2a6739267,2020-05-20T20:00:00Z,182,383,51749,50888,50888,33,10,15,1345,69,1414
20200520,NJ,150399,380944,,3405,,969,,750,,23945,A+,5/20/2020 13:00,76a32369f16763bc8b9c6061998dde4298477d12,2020-05-20T20:00:00Z,10747,,531343,531343,531343,34,161,0,9775,1386,11161
20200520,NM,6192,136054,,204,1139,,,,,1882,C,5/20/2020 14:25,6e4040eba43846e8714e2f3695e0a0b39c055ede,2020-05-20T20:00:00Z,276,1139,142246,142246,142246,35,6,253,4530,96,4626
20200520,NV,7166,84005,,437,,107,,60,,336,A,5/20/2020 09:00,def1df55e0dc0ea2e0e82bc5215fd24ea3259444,2020-05-20T20:00:00Z,373,,91171,91171,91171,32,8,0,3496,120,3616
20200520,NY,354370,1151466,,5570,76410,1836,,1421,,61886,A,5/20/2020 00:00,00a412db192eec4248dc52194da0117cc8819e2a,2020-05-20T20:00:00Z,22976,76410,1505836,1505836,1505836,36,133,242,36572,1525,38097
20200520,OH,29436,260092,,902,5198,333,1369,248,,,B,5/20/2020 14:00,f4e3a67b373cd29bc1ed42d8c469a2b5ef10c28a,2020-05-20T20:00:00Z,1781,5198,289528,289528,289528,39,61,81,11442,484,11926
20200520,OK,5532,138839,,209,905,92,,,,4266,A+,5/20/2020 00:00,4857c838770da31518dbb551e1f6a31e13b4ff06,2020-05-20T20:00:00Z,299,905,144371,144371,144371,40,5,8,5181,43,5224
20200520,OR,3801,98348,,152,723,42,,17,,1406,A+,5/20/2020 11:00,58fa223ca9b5c41b430e41eef5e3542bc4f9d4fb,2020-05-20T20:00:00Z,144,723,102149,102149,102149,41,4,9,2354,75,2429
20200520,PA,63666,286034,,1818,,,,377,,,B,5/19/2020 00:00,1de580fd8a6da3353e1d1866ead2e9f6f3ea15d5,2020-05-20T20:00:00Z,4624,,349700,349700,349700,42,0,0,0,0,0
20200520,PR,2866,,,,,20,,5,,,C,5/20/2020 06:30,2b90fda9806c71e1d4e7b9ec74535b0cff050187,2020-05-20T20:00:00Z,125,,2866,2866,2866,72,1,0,0,61,61
20200520,RI,13356,107172,,257,1486,58,,45,,1030,A+,5/20/2020 12:00,6439d6ba25e9e0cbb3dc3dc8a40c65376ec15416,2020-05-20T20:00:00Z,538,1486,120528,120528,120528,44,6,22,2877,405,3282
20200520,SC,9056,126007,,,1444,,,,,5451,A+,5/19/2020 16:00,4841aeea3388848e2b0cc7d34e71e216705b6bac,2020-05-20T20:00:00Z,399,1444,135063,135063,135063,45,0,0,0,0,0
20200520,SD,4177,26212,,81,333,,,,,3023,C,5/19/2020 18:00,b9123eda67bb5f394fdedfec7dbb22455ec8ca35,2020-05-20T20:00:00Z,46,333,30389,30389,30389,46,0,6,588,92,680
20200520,TN,18532,335481,,,1515,,,,,11783,B,5/20/2020 15:00,535b55c09bfa37309c56d0f1fdaa8962190742a3,2020-05-20T20:00:00Z,309,1515,354013,354013,354013,47,4,17,7736,154,7890
20200520,TX,51323,718918,,1791,,,,,,30341,B,5/19/2020 16:50,084a9b09c578cd308822376d4a65b4cd32b5cdc3,2020-05-20T20:00:00Z,1419,,770241,770241,770241,48,50,0,23893,1411,25304
20200520,UT,7710,171954,,144,631,,200,,87,4423,B,5/20/2020 10:15,4f48b4dd9dbe40e357c32d4261a90c4acc96da90,2020-05-20T20:00:00Z,90,631,179664,179664,179664,49,10,36,5316,326,5642
20200520,VA,32908,179718,518,1536,6059,370,,202,,4523,A+,5/19/2020 17:00,623fba5248459f3e195740bc92de6bb2c9f50d71,2020-05-20T20:00:00Z,1074,6059,213144,212626,212626,51,33,291,9074,763,9837
20200520,VI,69,1314,26,,,,,,,61,C,5/20/2020 07:09,78bf900590db3972c95202b282811d356b3a3da3,2020-05-20T20:00:00Z,6,,1409,1383,1383,78,0,0,16,0,16
20200520,VT,944,24114,,15,,,,,,824,B,5/20/2020 00:00,8890a2114f65acc0fcf736b0bb25e53c8c321cd2,2020-05-20T20:00:00Z,54,,25058,25058,25058,50,0,0,467,0,467
20200520,WA,18811,274309,,168,,52,,,,,B,5/19/2020 02:59,ccf1756ae5fac5b922fd476ba3b79458c076fab0,2020-05-20T20:00:00Z,1031,,293120,293120,293120,53,29,0,3785,200,3985
20200520,WI,13413,154300,211,609,2161,129,515,,,7728,A+,5/20/2020 00:00,f40d43177d7454c3db8819cf8793f45efb4938de,2020-05-20T20:00:00Z,481,2161,167924,167713,167713,55,14,51,6063,528,6591
20200520,WV,1545,79096,,58,,16,,9,,950,B,5/20/2020 10:00,99c810aa6e8572f1b532c8248b73e3f55b6e080e,2020-05-20T20:00:00Z,69,,80641,80641,80641,54,1,0,2304,36,2340
20200520,WY,787,18053,,9,74,,,,,528,C,5/20/2020 16:15,11ca928b33afd498211d12ff699ac8a9fff6b55b,2020-05-20T20:00:00Z,11,74,18840,18840,18840,56,1,1,969,21,990
20200519,AK,399,35981,,16,,,,,,348,B,5/19/2020 00:00,a6e64be0dcdb35ea2f5116f626fb9e26da9d98ba,2020-05-19T20:00:00Z,10,,36380,36380,36380,02,0,0,769,0,769
20200519,AL,12376,145190,,,1453,,517,,306,,B,5/18/2020 00:00,da768efac6b967b10afef712b89563d433bfa593,2020-05-19T20:00:00Z,504,1453,157566,157566,157566,01,15,37,153,290,443
20200519,AR,4923,88778,,78,535,,,14,101,3739,A,5/19/2020 00:00,31b7e799d1d456ef327a06e12e0866aabb9dbad3,2020-05-19T20:00:00Z,102,535,93701,93701,93701,05,2,5,8352,110,8462
20200519,AS,0,124,,,,,,,,,C,5/19/2020 00:00,a6faa2e1ef283fcc8a86234ee19662c95c93290f,2020-05-19T20:00:00Z,0,,124,124,124,60,0,0,19,0,19
20200519,AZ,14566,147005,,792,1746,318,,201,,3693,A+,5/19/2020 00:00,93c83b05b7ed3f501b76fc8061f3ada8638d5a69,2020-05-19T20:00:00Z,704,1746,161571,161571,161571,04,18,29,4702,396,5098
20200519,CA,81795,1257521,,4363,,1307,,,,,B,5/19/2020 00:00,ad1044e4a2c384424aa492acbe2154e655566e10,2020-05-19T20:00:00Z,3334,,1339316,1339316,1339316,06,32,0,45279,1365,46644
20200519,CO,22202,109131,,626,3899,,,,,3431,A,5/17/2020 00:00,e4a425151a1d0a17152bd23664a733f14b192e08,2020-05-19T20:00:00Z,1224,3899,131333,131333,131333,08,9,27,2574,264,2838
20200519,CT,38430,147090,,914,10946,,,,,6264,B,5/18/2020 19:00,cc8f6030f80826a8035e5c71331e9d8073a4d3e2,2020-05-19T20:00:00Z,3472,10946,185520,185520,185520,09,23,0,7527,314,7841
20200519,DC,7434,31940,,375,,,,77,,1040,A,5/18/2020 00:00,92ad144f7eb2a87c86c646fddf34f3e3b0fbdbbf,2020-05-19T20:00:00Z,400,,39374,39374,39374,11,8,0,1385,164,1549
20200519,DE,8037,36095,,236,,,,,,3760,B,5/18/2020 18:00,d80439e262f073e18134dfdb41751616dfd17a91,2020-05-19T20:00:00Z,304,,44132,44132,44132,10,7,0,1506,168,1674
20200519,FL,46944,668911,1369,472,8744,232,,,,,A+,5/19/2020 10:31,1826220a864220a6e25b5be129044e26767d4af8,2020-05-19T20:00:00Z,2129,8744,717224,715855,715855,12,56,191,38941,502,39443
20200519,GA,38721,339435,,986,7027,,1589,,,,A+,5/19/2020 13:00,00a226427f82aa9b1106e15d895458702a0fec3d,2020-05-19T20:00:00Z,1664,7027,378156,378156,378156,13,22,111,13227,640,13867
20200519,GU,154,4673,,,,,,,,126,C,5/19/2020 05:45,939267589e5b9bb57a94e5d4093f3f660d1f843a,2020-05-19T20:00:00Z,5,,4827,4827,4827,66,0,0,104,0,104
20200519,HI,640,44383,,,82,,,,,574,B,5/17/2020 00:00,341ed35a11901a989e75cae80527fe67e9525119,2020-05-19T20:00:00Z,17,82,45023,45023,45023,15,0,0,2978,0,2978
20200519,IA,15349,92299,,383,,126,,83,,8130,A+,5/19/2020 00:00,b7d3b6bd3d0ec0b75537b7f0cc398d924cba1f20,2020-05-19T20:00:00Z,372,,107648,107648,107648,19,17,0,4106,394,4500
20200519,ID,2455,35614,,,213,,89,,,1649,B,5/18/2020 19:00,7777263fde8a08771a5af00f9767259958a11d48,2020-05-19T20:00:00Z,74,213,38069,38069,38069,16,1,0,1361,36,1397
20200519,IL,98030,523654,,4002,,993,,576,,,A,5/19/2020 00:00,20ee8a98aea8075e3e622fb394656c33e93c21e0,2020-05-19T20:00:00Z,4379,,621684,621684,621684,17,145,0,16898,1545,18443
20200519,IN,28705,160625,,1268,4389,421,990,206,,,A+,5/18/2020 23:59,2ac16300adaff2df6ad4bbe17d2643c4bb6f257f,2020-05-19T20:00:00Z,1824,4389,189330,189330,189330,18,59,0,4968,450,5418
20200519,KS,8340,58650,,,740,,250,,115,465,A,5/18/2020 10:00,a8cf4a1191996cbd2b935b592fed0541b97f242c,2020-05-19T20:00:00Z,173,740,66990,66990,66990,20,0,0,0,0,0
20200519,KY,8069,145917,,447,1980,277,866,,,2826,A+,5/19/2020 17:00,79e80ea07072d2a9ad366228cdcd2474ab231b5a,2020-05-19T20:00:00Z,366,1980,153986,153986,153986,21,32,84,23920,381,24301
20200519,LA,35038,243035,,1004,,,,112,,26249,B,5/19/2020 13:00,c648941afd18baa2fe5552138234362adaadd7e4,2020-05-19T20:00:00Z,2581,,278073,278073,278073,22,18,0,7996,329,8325
20200519,MA,87925,389015,,2472,8766,672,,,,,A+,5/19/2020 10:00,fac9faee8e84a07de4fe7e5f336f3c7d5c7570ee,2020-05-19T20:00:00Z,5938,8766,476940,476940,476940,25,141,227,14199,1915,16114
20200519,MD,41546,167112,,1421,7199,537,,,,2868,,5/19/2020 10:00,3bcccf53d70b3c42480e80e8e01b2017a845e5f4,2020-05-19T20:00:00Z,2081,7199,208658,208658,208658,24,58,113,5368,1784,7152
20200519,ME,1741,22092,,44,225,19,,11,,1088,B,5/19/2020 11:30,5490eaf2acab20db9c49b8f38af115e308c86540,2020-05-19T20:00:00Z,73,225,23833,23833,23833,23,2,2,0,28,28
20200519,MI,52350,370554,,1079,,486,,351,,28234,A+,5/19/2020 11:00,91eb15cd9c5c3b030bf6eceb304e1f07edcf9ac0,2020-05-19T20:00:00Z,5017,,422904,422904,422904,26,102,0,12291,435,12726
20200519,MN,17029,144806,,545,2221,229,750,,,11540,A+,5/18/2020 17:00,5a05e01d4f5cd85ba962df08829beb4bfb464206,2020-05-19T20:00:00Z,757,2221,161835,161835,161835,27,17,93,4572,657,5229
20200519,MO,11080,143030,,721,,,,103,,,B,5/19/2020 15:00,b65c4dd135699e9167a6222a15f990b7e62b83e6,2020-05-19T20:00:00Z,616,,154110,154110,154110,29,11,0,2637,135,2772
20200519,MP,21,3796,,,,,,,,13,D,5/19/2020 00:00,b6a3840e4b6f316ecabc721922d4aeffd5ce20df,2020-05-19T20:00:00Z,2,,3817,3817,3817,69,0,0,397,0,397
20200519,MS,11704,106056,,611,1840,153,,87,,7681,A,5/18/2020 19:00,b0ef85c7dbd6395f2f3b20a36ba7a9a19e78d385,2020-05-19T20:00:00Z,554,1840,117760,117760,117760,28,26,35,1721,272,1993
20200519,MT,471,28479,,5,65,,,,,437,B,5/19/2020 00:00,594a65cefc3118f5aaa66b60198a8c32892e5e5a,2020-05-19T20:00:00Z,16,65,28950,28950,28950,30,0,1,782,1,783
20200519,NC,19700,245308,,585,,,,,,11637,A,5/19/2020 14:00,a72347562abef512e54cbe7193193d3db0ecf1e9,2020-05-19T20:00:00Z,691,,265008,265008,265008,37,30,0,8576,677,9253
20200519,ND,1994,55737,,32,135,,,,,1269,C,5/19/2020 13:00,ef2518560bf19d40d014e7591ffd90126d437848,2020-05-19T20:00:00Z,45,135,57731,57731,57731,38,1,2,1107,63,1170
20200519,NE,10625,59359,,,,,,,,,C,5/18/2020 20:00,7beac64c4470d7aba2cb6330532e3e4613e5c9b6,2020-05-19T20:00:00Z,125,,69984,69984,69984,31,2,0,2206,277,2483
20200519,NH,3652,45822,874,109,368,,109,,,1269,B,5/18/2020 09:00,8c2b7fc889b12a4d87ad2183b3b6607932155e5b,2020-05-19T20:00:00Z,172,368,50348,49474,49474,33,0,9,4540,56,4596
20200519,NJ,149013,371169,,3481,,977,,789,,23657,A+,5/19/2020 13:00,3c01d496dd178d7a0d9b550d33b3fb3266aa39e2,2020-05-19T20:00:00Z,10586,,520182,520182,520182,34,151,0,13639,974,14613
20200519,NM,6096,131524,,213,886,,,,,1796,C,5/18/2020 18:05,01991644c041f5c342ee9f3c1d743be67b21a2bc,2020-05-19T20:00:00Z,270,886,137620,137620,137620,35,5,0,4209,158,4367
20200519,NV,7046,80509,,405,,106,,54,,334,B,5/19/2020 10:00,2486aaec39f0323aa2aabd4d973c75d91113bfba,2020-05-19T20:00:00Z,365,,87555,87555,87555,32,15,0,5583,140,5723
20200519,NY,352845,1114894,,5818,76168,1836,,1481,,61886,A,5/19/2020 00:00,84401a74545d19541faeed8beb09060d06a2d16d,2020-05-19T20:00:00Z,22843,76168,1467739,1467739,1467739,36,114,298,26708,1474,28182
20200519,OH,28952,248650,,913,5117,365,1357,234,,,B,5/19/2020 14:00,4d85dd0867c5c446dab6497062672bec2aedfaef,2020-05-19T20:00:00Z,1720,5117,277602,277602,277602,39,63,119,5255,498,5753
20200519,OK,5489,133658,,167,897,77,,,,4135,A+,5/19/2020 00:00,509000f13b9a0c756930d6be3edd3acf6205bfd5,2020-05-19T20:00:00Z,294,897,139147,139147,139147,40,6,12,15496,91,15587
20200519,OR,3726,95994,,137,714,43,,13,,1406,A+,5/19/2020 11:00,222f371991a6b98dd31453521b89140625de29e8,2020-05-19T20:00:00Z,140,714,99720,99720,99720,41,2,6,2366,39,2405
20200519,PA,63666,286034,,1861,,,,380,,,B,5/18/2020 00:00,d6cbdd3023cefde35bcdc7c96b95601cf362d3ee,2020-05-19T20:00:00Z,4624,,349700,349700,349700,42,119,0,8481,610,9091
20200519,PR,2805,,,,,20,,8,,,C,5/19/2020 05:52,798325aa6fb04f713d3ed32cb15ed67b6fa91571,2020-05-19T20:00:00Z,124,,2805,2805,2805,72,0,0,0,95,95
20200519,RI,12951,104295,,247,1464,59,,44,,1023,A+,5/19/2020 12:00,0b46513d6f108a6cb38e6e90376b9f572d006918,2020-05-19T20:00:00Z,532,1464,117246,117246,117246,44,26,26,1706,156,1862
20200519,SC,9056,126007,,,1444,,,,,5451,A,5/19/2020 16:00,1012b6dcb4873da74e5d4b8f4b22a9c34b0ad1cd,2020-05-19T20:00:00Z,399,1444,135063,135063,135063,45,8,23,3390,114,3504
20200519,SD,4085,25624,,75,327,,,,,2914,B,5/18/2020 18:00,065ca3add179e759db596b2e1101d59373f7ab47,2020-05-19T20:00:00Z,46,327,29709,29709,29709,46,2,11,606,58,664
20200519,TN,18378,327745,,,1498,,,,,10969,A,5/19/2020 15:00,6c82d9ab5dc36e78f8b7ffd1203784f1e4bae7ac,2020-05-19T20:00:00Z,305,1498,346123,346123,346123,47,4,9,8328,367,8695
20200519,TX,49912,695025,,1732,,,,,,29359,A,5/19/2020 16:50,015142493861d1f1e4bb3ce83cb5d8da32d8173b,2020-05-19T20:00:00Z,1369,,744937,744937,744937,48,22,0,20705,1219,21924
20200519,UT,7384,166638,,179,595,,197,,84,4183,B,5/18/2020 10:29,bc6bf9ba3246a5b5f06d2ecca5f260e956fa5fea,2020-05-19T20:00:00Z,80,595,174022,174022,174022,49,0,0,0,0,0
20200519,VA,32145,170644,473,1497,5768,377,,199,,4271,A+,5/18/2020 17:00,227ab934ee80ad38289b9ea0e90f767fcf7af65c,2020-05-19T20:00:00Z,1041,5768,203262,202789,202789,51,27,159,5558,1005,6563
20200519,VI,69,1298,17,,,,,,,61,C,5/19/2020 06:34,bdf2f85c14cb02420f24c84469a8e818ffe052c4,2020-05-19T20:00:00Z,6,,1384,1367,1367,78,0,0,20,0,20
20200519,VT,944,23647,,24,,,,,,820,B,5/19/2020 00:00,80389ae3a194e5c47b7d1d1e6a182f967a7b38c0,2020-05-19T20:00:00Z,54,,24591,24591,24591,50,0,0,762,4,766
20200519,WA,18611,270524,,168,,52,,,,,A,5/18/2020 02:59,410bf949a4abf34d3e5461e74f70beb28f7de4e3,2020-05-19T20:00:00Z,1002,,289135,289135,289135,53,1,0,3714,178,3892
20200519,WI,12885,148237,211,609,2110,129,503,,,7371,A+,5/19/2020 00:00,658370d99840ae09dd846a5040fd91fa70e508cb,2020-05-19T20:00:00Z,467,2110,161333,161122,161122,55,8,42,3735,198,3933
20200519,WV,1509,76792,,54,,18,,9,,922,B,5/19/2020 10:00,9b7358d385ceac53b68bee8b0fc3d0e8791684f8,2020-05-19T20:00:00Z,68,,78301,78301,78301,54,1,0,2248,18,2266
20200519,WY,766,17084,,8,73,,,,,504,B,5/18/2020 00:00,158314945e235e3e6033a906c941e5f3f92abbee,2020-05-19T20:00:00Z,10,73,17850,17850,17850,56,2,0,753,12,765
20200518,AK,399,35212,,9,,,,,,345,B,5/18/2020 00:00,b3ccfa9231cf1d4225bef777e18aef9279196f72,2020-05-18T20:00:00Z,10,,35611,35611,35611,02,0,0,957,3,960
20200518,AL,12086,145037,,,1416,,512,,302,,B,5/18/2020 00:00,5b2cfe9999f12edaaadf251db01027248479f4b9,2020-05-18T20:00:00Z,489,1416,157123,157123,157123,01,1,24,458,315,773
20200518,AR,4813,80426,,77,530,,,12,101,3645,A,5/18/2020 00:00,a1fc38a56f67ed2a8ff4225276f3fd91a77308f4,2020-05-18T20:00:00Z,100,530,85239,85239,85239,05,2,10,0,54,54
20200518,AS,0,105,,,,,,,,,C,5/10/2020 00:00,bb4faca167517d155c2456a9c9ab3db494c094b4,2020-05-18T20:00:00Z,0,,105,105,105,60,0,0,0,0,0
20200518,AZ,14170,142303,,820,1717,329,,200,,3570,A+,5/18/2020 00:00,02c1b4f1b08529a66b998e389dec4466b306a4e6,2020-05-18T20:00:00Z,686,1717,156473,156473,156473,04,6,18,4479,233,4712
20200518,CA,80430,1212242,,4391,,1325,,,,,B,5/17/2020 00:00,a4c726f97ca716cb19c945927806f45e0bb3cbea,2020-05-18T20:00:00Z,3302,,1292672,1292672,1292672,06,41,0,55838,1591,57429
20200518,CO,21938,106557,,650,3872,,,,,3346,A,5/16/2020 00:00,6b63ab17f120d5e9edef21b5bbc109a21d330e97,2020-05-18T20:00:00Z,1215,3872,128495,128495,128495,08,23,6,2642,305,2947
20200518,CT,38116,139563,,920,10946,,,,,6264,B,5/17/2020 20:30,61f61760e371fd4e3b08ceaf3b853f96858ec521,2020-05-18T20:00:00Z,3449,10946,177679,177679,177679,09,41,0,6375,697,7072
20200518,DC,7270,30555,,374,,,,70,,1028,A,5/17/2020 00:00,85ce1b3271226f1eb141c4c81f1fa6cac6e441d1,2020-05-18T20:00:00Z,392,,37825,37825,37825,11,9,0,1152,147,1299
20200518,DE,7869,34589,,240,,,,,,3545,B,5/17/2020 18:00,e1e7d0f5c4bd71480c90a3be930c23056bf6b6ff,2020-05-18T20:00:00Z,297,,42458,42458,42458,10,7,0,1394,199,1593
20200518,FL,46442,629970,1346,472,8553,232,,,,,A+,5/18/2020 09:28,d655a24232ba199c8d3accf4c58fb3e343e7ae21,2020-05-18T20:00:00Z,2073,8553,677758,676412,676412,12,24,75,23766,854,24620
20200518,GA,38081,326208,,1025,6916,,1565,,,,A+,5/18/2020 13:00,1e46a0334a6f47d211cdd2330e57601c566d3dc3,2020-05-18T20:00:00Z,1642,6916,364289,364289,364289,13,36,126,12734,380,13114
20200518,GU,154,4569,,,,,,,,126,C,5/16/2020 04:30,b3894e885c0148326056081afdcfa2e6eabe079e,2020-05-18T20:00:00Z,5,,4723,4723,4723,66,0,0,119,0,119
20200518,HI,640,41405,,,82,,,,,573,B,5/17/2020 00:00,74d86a5df0f1a48eff09b72d5052ec2ad6665abc,2020-05-18T20:00:00Z,17,82,42045,42045,42045,15,0,0,370,1,371
20200518,IA,14955,88193,,382,,121,,85,,7324,A+,5/17/2020 13:00,f401b39ad0693c21562bdb03b414482fed33e182,2020-05-18T20:00:00Z,355,,103148,103148,103148,19,4,0,2603,304,2907
20200518,ID,2419,34253,,,213,,89,,,1612,B,5/16/2020 19:00,2983fd157f7300a700929768358b22039cf5d916,2020-05-18T20:00:00Z,73,213,36672,36672,36672,16,0,0,0,0,0
20200518,IL,96485,506756,,4120,,1096,,636,,,A,5/18/2020 00:59,b8244579a51ceaf3c75df057dfe600686fa83b4a,2020-05-18T20:00:00Z,4234,,603241,603241,603241,17,57,0,19003,2294,21297
20200518,IN,28255,155657,,1244,4389,426,990,212,,,A+,5/17/2020 23:59,9f5ed277223fc4aeaa539e2398d3b72394fedd55,2020-05-18T20:00:00Z,1765,4389,183912,183912,183912,18,14,0,6192,477,6669
20200518,KS,8340,58650,,,740,,250,,115,465,A,5/18/2020 10:00,57f5aa39168f003b464c8939e435089b21596a40,2020-05-18T20:00:00Z,173,740,66990,66990,66990,20,1,16,4944,454,5398
20200518,KY,7688,121997,,381,1896,218,797,,,2768,A+,5/16/2020 17:19,bbc248dee1f365eb947a8c7e1533fd22e9e814b3,2020-05-18T20:00:00Z,334,1896,129685,129685,129685,21,0,0,0,0,0
20200518,LA,34709,235039,,1031,,,,118,,26249,B,5/18/2020 13:00,262daea05432ee16b7615659a9c2211f852b79f6,2020-05-18T20:00:00Z,2563,,269748,269748,269748,22,72,0,4301,277,4578
20200518,MA,86010,374816,,2597,8539,702,,,,,A+,5/17/2020 10:00,7d19fbf3be434c0bc4af0894ac0300d3731e1239,2020-05-18T20:00:00Z,5797,8539,460826,460826,460826,25,0,0,0,0,0
20200518,MD,39762,161744,,1447,7086,555,,,,2817,,5/18/2020 10:00,715b7c0e8acb291d17431bb3293beac4d31fa0e2,2020-05-18T20:00:00Z,2023,7086,201506,201506,201506,24,31,93,5622,958,6580
20200518,ME,1713,22092,,42,223,16,,10,,1053,B,5/18/2020 12:15,1dec2adb62139c5dd7f8f83d925ded3f4f1adea7,2020-05-18T20:00:00Z,71,223,23805,23805,23805,23,1,7,0,26,26
20200518,MI,51915,358263,,1075,,473,,418,,28234,A+,5/18/2020 11:00,1c42e7d17a41be59313595a01a457da9bfd24551,2020-05-18T20:00:00Z,4915,,410178,410178,410178,26,24,0,12447,773,13220
20200518,MN,16372,140234,,488,2128,229,731,,,10764,A+,5/17/2020 17:00,9da7fabf094cdfe74748f834aa430603c126c592,2020-05-18T20:00:00Z,740,2128,156606,156606,156606,27,9,38,5317,704,6021
20200518,MO,10945,140393,,570,,,,91,,,B,5/18/2020 15:00,99b7dbaaf87d66c48cf6609e107c4fab00bf2cb1,2020-05-18T20:00:00Z,605,,151338,151338,151338,29,11,0,4927,156,5083
20200518,MP,21,3399,,,,,,,,12,D,5/18/2020 00:00,503a9c4190cc900e012f12368b1c60946a23f0f8,2020-05-18T20:00:00Z,2,,3420,3420,3420,69,0,0,81,0,81
20200518,MS,11432,104335,,559,1805,141,,75,,7681,A,5/17/2020 19:00,dec246c0223df492f414005653860e9047276f91,2020-05-18T20:00:00Z,528,1805,115767,115767,115767,28,7,32,2505,136,2641
20200518,MT,470,27697,,4,64,,,,,434,B,5/18/2020 00:00,aedd55fbadfbe3d1e8ff4dad5c7a9dfc3124d940,2020-05-18T20:00:00Z,16,64,28167,28167,28167,30,0,1,1280,2,1282
20200518,NC,19023,236732,,511,,,,,,11637,A,5/18/2020 11:00,513d24870fbaf0eb3f49e4b5da7298e4fc2ca05f,2020-05-18T20:00:00Z,661,,255755,255755,255755,37,2,0,6300,511,6811
20200518,ND,1931,54630,,32,133,,,,,1219,C,5/18/2020 13:00,a066d02c602f753e043d52019887772dde64a142,2020-05-18T20:00:00Z,44,133,56561,56561,56561,38,1,3,1309,31,1340
20200518,NE,10348,57153,,,,,,,,,C,5/17/2020 20:00,e13e73f97593d330d40ea184c240290509605ad4,2020-05-18T20:00:00Z,123,,67501,67501,67501,31,0,0,1733,128,1861
20200518,NH,3596,41282,1481,114,359,,109,,,1268,B,5/18/2020 09:00,ee3c53d27dcbb35e8dae13cd8697c4077ca5ed09,2020-05-18T20:00:00Z,172,359,46359,44878,44878,33,1,12,86,40,126
20200518,NJ,148039,357530,,3509,,1053,,819,,23496,A+,5/18/2020 13:00,9fd971392a15734029c07e9cd8e5b37935afb141,2020-05-18T20:00:00Z,10435,,505569,505569,505569,34,79,0,16299,1705,18004
20200518,NM,5938,127315,,211,886,,,,,1755,C,5/17/2020 17:29,56b07b5a997fc8eaa080c32e1bbc9e91e1873e63,2020-05-18T20:00:00Z,265,886,133253,133253,133253,35,6,0,4588,81,4669
20200518,NV,6906,74926,,423,,105,,65,,355,B,5/18/2020 11:00,cfe236e5059ddf193978f33d787dd38f82419077,2020-05-18T20:00:00Z,350,,81832,81832,81832,32,1,0,1146,49,1195
20200518,NY,351371,1088186,,5840,75870,1908,,1538,,61681,A,5/18/2020 00:00,46fa5352dd39fe8d99308c648d0ba385f1fd5f4c,2020-05-18T20:00:00Z,22729,75870,1439557,1439557,1439557,36,110,345,24911,1250,26161
20200518,OH,28454,243395,,912,4998,367,1328,247,,,B,5/18/2020 14:00,3be87dc6dc45a488db9574631a8f7e49e8e9f56e,2020-05-18T20:00:00Z,1657,4998,271849,271849,271849,39,32,77,6856,531,7387
20200518,OK,5398,118162,,76,885,45,,,,4008,A+,5/18/2020 00:00,35edd4c0871466b93d9730ca049be2c5ad7c7ea7,2020-05-18T20:00:00Z,288,885,123560,123560,123560,40,0,5,0,88,88
20200518,OR,3687,93628,,137,708,43,,13,,1406,A+,5/18/2020 11:00,76df4b3283b6de456af6ebbaa60d708ded327e06,2020-05-18T20:00:00Z,138,708,97315,97315,97315,41,1,5,2895,64,2959
20200518,PA,63056,277553,,1885,,,,397,,,C,5/18/2020 00:00,2dd6c2680ac73b0f4d35d7442131b55ce6dc91a5,2020-05-18T20:00:00Z,4505,,340609,340609,340609,42,87,0,6883,822,7705
20200518,PR,2710,,,,,17,,4,,,C,5/18/2020 06:30,9dcfdb48a759e73d65f2a9f94b6f909d67c4f774,2020-05-18T20:00:00Z,124,,2710,2710,2710,72,1,0,0,64,64
20200518,RI,12795,102589,,236,1438,62,,46,,1012,A+,5/18/2020 12:00,97ab361477f2225295dbba0fdcff556235db102e,2020-05-18T20:00:00Z,506,1438,115384,115384,115384,44,7,20,2713,121,2834
20200518,SC,8942,122617,,,1421,,,,,5076,A,5/18/2020 16:15,3a4d210f2121c07bb57c1f757389342753772472,2020-05-18T20:00:00Z,391,1421,131559,131559,131559,45,11,0,10947,281,11228
20200518,SD,4027,25018,,77,316,,,,,2784,B,5/18/2020 11:30,2f3d1de74a0b1039b0fbd5af8bd753813ad4654c,2020-05-18T20:00:00Z,44,316,29045,29045,29045,46,0,4,446,40,486
20200518,TN,18011,319417,,,1489,,,,,9886,A,5/18/2020 15:00,96485679354c2b9efe219694dad92b358bd9df9b,2020-05-18T20:00:00Z,301,1489,337428,337428,337428,47,3,7,11525,623,12148
20200518,TX,48693,674320,,1551,,,,,,28371,A,5/18/2020 16:25,3e8fcb7abdfc9e26f1ff93022e988ac2ed70e87d,2020-05-18T20:00:00Z,1347,,723013,723013,723013,48,11,0,28828,909,29737
20200518,UT,7384,166638,,179,595,,197,,84,4183,B,5/18/2020 10:29,9c7fabdd050ddb48c0a603ea72a5b84a9016261a,2020-05-18T20:00:00Z,80,595,174022,174022,174022,49,0,9,3124,146,3270
20200518,VA,31140,165086,530,1502,5609,361,,194,,4107,A+,5/17/2020 17:00,1e1fe4a432656ba6b5ba356a6ff1f3c68bf59ef3,2020-05-18T20:00:00Z,1014,5609,196756,196226,196226,51,5,92,5113,752,5865
20200518,VI,69,1278,45,,,,,,,61,C,5/17/2020 18:35,92c7eb24a740b63009dd06d505b3636a9721b27e,2020-05-18T20:00:00Z,6,,1392,1347,1347,78,0,0,0,0,0
20200518,VT,940,22885,,22,,,,,,815,B,5/18/2020 00:00,9664c6fd753991d65005ac2239c0b3327637d539,2020-05-18T20:00:00Z,54,,23825,23825,23825,50,0,0,1543,0,1543
20200518,WA,18433,266810,,168,,52,,,,,A,5/17/2020 02:59,65734614b88e11863b2a6ad825cefe7d45a44b85,2020-05-18T20:00:00Z,1001,,285243,285243,285243,53,1,0,-3667,-157,-3824
20200518,WI,12687,144502,194,574,2068,128,496,,,6786,A+,5/18/2020 00:00,a8710b6400500653e80c1ddfb0af62c2b6cb8d36,2020-05-18T20:00:00Z,459,2068,157383,157189,157189,55,6,30,4828,144,4972
20200518,WV,1491,74544,,48,,11,,7,,919,B,5/18/2020 10:00,b3e5bf52466ac10031975091fd6e25c5da459f9a,2020-05-18T20:00:00Z,67,,76035,76035,76035,54,0,0,544,1,545
20200518,WY,754,16331,,8,73,,,,,498,B,5/17/2020 00:00,94b760d56d11bb9d2988c9f7ec46894613abc7b4,2020-05-18T20:00:00Z,8,73,17085,17085,17085,56,0,3,0,0,0
20200517,AK,396,34255,,13,,,,,,344,B,5/17/2020 00:00,65ce5b20ebcfe9a6260ba1d15a840072474f3924,2020-05-17T20:00:00Z,10,,34651,34651,34651,02,0,0,1366,4,1370
20200517,AL,11771,144579,,,1392,,504,,296,,B,5/16/2020 00:00,540fc4ecea85eb597ddf161ce4bc54e4e9b780a6,2020-05-17T20:00:00Z,488,1392,156350,156350,156350,01,3,5,2608,248,2856
20200517,AR,4759,80426,,65,520,,,9,101,3590,A,5/17/2020 00:00,28092115d4cbcaa02ed0184e52163f38412774e3,2020-05-17T20:00:00Z,98,520,85185,85185,85185,05,0,0,3360,181,3541
20200517,AS,0,105,,,,,,,,,C,5/10/2020 00:00,25ede1d0f7b90a1989a45a025463b8d1a63f3ce3,2020-05-17T20:00:00Z,0,,105,105,105,60,0,0,0,0,0
20200517,AZ,13937,137824,,796,1699,337,,201,,3450,A+,5/17/2020 00:00,cb43c97c57f170e9df1177fb0c9a53c6ba6a9fe6,2020-05-17T20:00:00Z,680,1699,151761,151761,151761,04,1,16,4667,306,4973
20200517,CA,78839,1156404,,4291,,1293,,,,,B,5/17/2020 00:00,efe3d2e04569547fc50e7c3d8084f6f4ea4d4cc7,2020-05-17T20:00:00Z,3261,,1235243,1235243,1235243,06,57,0,54071,2046,56117
20200517,CO,21633,103915,,650,3866,,,,,3346,A,5/15/2020 00:00,92fd0516c0ba23629efb451d09f1eace6475f37c,2020-05-17T20:00:00Z,1192,3866,125548,125548,125548,08,42,24,3307,401,3708
20200517,CT,37419,133188,,937,10946,,,,,6264,B,5/16/2020 20:30,e39cea4086461938bd535d666b8175309784d70d,2020-05-17T20:00:00Z,3408,10946,170607,170607,170607,09,69,0,5136,716,5852
20200517,DC,7123,29403,,369,,,,74,,1023,A,5/16/2020 00:00,0be2a2f3324c58b61fe672bc9083a47d5edfdc28,2020-05-17T20:00:00Z,383,,36526,36526,36526,11,8,0,913,81,994
20200517,DE,7670,33195,,229,,,,,,3478,B,5/17/2020 11:57,af520571eed3b129bb32d06060325add7ab5135a,2020-05-17T20:00:00Z,290,,40865,40865,40865,10,4,0,984,123,1107
20200517,FL,45588,606204,1479,472,8478,232,,,,,A+,5/17/2020 10:08,5b4835bb4b4216c78e687d24b8d1bd0bb87306aa,2020-05-17T20:00:00Z,2049,8478,653271,651792,651792,12,9,85,20968,777,21745
20200517,GA,37701,313474,,1010,6790,,1557,,,,A+,5/17/2020 13:00,50c47abbf5882a9406b82bb459ac2f89ec742a27,2020-05-17T20:00:00Z,1606,6790,351175,351175,351175,13,14,55,29552,554,30106
20200517,GU,154,4450,,,,,,,,126,C,5/16/2020 04:30,0e427eb8db13720a7d15bbd6191814b59a05e3fc,2020-05-17T20:00:00Z,5,,4604,4604,4604,66,0,0,85,0,85
20200517,HI,639,41035,,,82,,,,,572,B,5/16/2020 18:00,76811d19b76495184c8d5e7da131d9466deb73fa,2020-05-17T20:00:00Z,17,82,41674,41674,41674,15,0,1,790,1,791
20200517,IA,14651,85590,,376,,124,,85,,7154,A+,5/16/2020 13:00,f963862b996b61fb24eca2d72ccdce87ceff78fc,2020-05-17T20:00:00Z,351,,100241,100241,100241,19,5,0,3618,323,3941
20200517,ID,2419,34253,,,213,,89,,,1612,B,5/16/2020 19:00,c02b7bdc243dcd84ced0a47a37b3447617718f05,2020-05-17T20:00:00Z,73,213,36672,36672,36672,16,0,0,954,30,984
20200517,IL,94191,487753,,4190,,1144,,735,,,A,5/17/2020 00:00,066bf29c654c015e7a712884a37cbcf9ab02ee61,2020-05-17T20:00:00Z,4177,,581944,581944,581944,17,48,0,18561,1734,20295
20200517,IN,27778,149465,,1246,4389,441,990,205,,,A+,5/16/2020 23:59,370425930245713eaf4ab036c5043c16ac39f0b7,2020-05-17T20:00:00Z,1751,4389,177243,177243,177243,18,10,0,5387,498,5885
20200517,KS,7886,53706,,,724,,246,,112,443,A,5/15/2020 10:00,1ae19998b9836ea3a30dfa0a0245ec6d4a162ab8,2020-05-17T20:00:00Z,172,724,61592,61592,61592,20,0,0,0,0,0
20200517,KY,7688,121997,,381,1896,218,797,,,2768,A+,5/16/2020 17:19,a864ee71b15b969194a8b89c5d36f95916bf3077,2020-05-17T20:00:00Z,334,1896,129685,129685,129685,21,2,0,1707,244,1951
20200517,LA,34432,230738,,1019,,,,111,,22608,B,5/17/2020 13:00,0eb37699053395eeec68eef15a22eb7e17998941,2020-05-17T20:00:00Z,2491,,265170,265170,265170,22,12,0,5113,315,5428
20200517,MA,86010,374816,,2597,8539,702,,,,,A+,5/17/2020 10:00,3ee5dc3a064857c633de13fcf0d4e9d3e80f262e,2020-05-17T20:00:00Z,5797,8539,460826,460826,460826,25,92,83,11660,1077,12737
20200517,MD,38804,156122,,1460,6993,562,,,,2816,,5/17/2020 10:00,081dd702b5b76b95a909f169533b8dd0d6fc146b,2020-05-17T20:00:00Z,1992,6993,194926,194926,194926,24,35,238,3915,836,4751
20200517,ME,1687,22092,,37,216,16,,11,,1028,B,5/17/2020 11:30,019aefc12708232fd38f9a3c8250553b6ce8cfd0,2020-05-17T20:00:00Z,70,216,23779,23779,23779,23,0,2,0,39,39
20200517,MI,51142,345816,,1114,,488,,434,,28234,A+,5/16/2020 11:00,afa5e6a23217b238cbf9b76fdb8e431afba9ba3f,2020-05-17T20:00:00Z,4891,,396958,396958,396958,26,11,0,38399,638,39037
20200517,MN,15668,134917,,487,2090,221,716,,,10175,A+,5/16/2020 17:00,2b5d044039c4633ebd06cfc705cc607357ab6535,2020-05-17T20:00:00Z,731,2090,150585,150585,150585,27,22,51,6605,699,7304
20200517,MO,10789,135466,,775,,,,116,,,B,5/17/2020 15:00,d53a5240bcbfd8ee5879991d1b8118413c7ec932,2020-05-17T20:00:00Z,594,,146255,146255,146255,29,5,0,6801,114,6915
20200517,MP,21,3318,,,,,,,,12,D,5/16/2020 00:00,3bd2f352ea2d32d232e70ba958174c3eef76c1e1,2020-05-17T20:00:00Z,2,,3339,3339,3339,69,0,0,0,0,0
20200517,MS,11296,101830,,608,1773,158,,81,,6268,A,5/16/2020 19:00,60b23dfc42bf80c51d2e94541429c32677047acc,2020-05-17T20:00:00Z,521,1773,113126,113126,113126,28,11,25,4477,173,4650
20200517,MT,468,26417,,3,63,,,,,431,B,5/17/2020 00:00,ff771f7abaa79ff6458360c6f8af771dc6607f05,2020-05-17T20:00:00Z,16,63,26885,26885,26885,30,0,0,794,0,794
20200517,NC,18512,230432,,493,,,,,,9115,A,5/17/2020 11:00,bcb44ec6dd0d583582c78f0f9b9da5660a8d8f08,2020-05-17T20:00:00Z,659,,248944,248944,248944,37,7,0,9828,530,10358
20200517,ND,1900,53321,,30,130,,,,,1178,C,5/17/2020 13:00,a8d20aa9876b5d472628a95749091307c2117524,2020-05-17T20:00:00Z,43,130,55221,55221,55221,38,1,0,1682,52,1734
20200517,NE,10220,55420,,,,,,,,,C,5/16/2020 18:15,7c50194650a79122ae543459a1168a556a82b27e,2020-05-17T20:00:00Z,123,,65640,65640,65640,31,4,0,5214,448,5662
20200517,NH,3556,41196,1216,115,347,,109,,,1258,B,5/16/2020 09:00,bf07c588817b4f92aae46d71691ea63f79042571,2020-05-17T20:00:00Z,171,347,45968,44752,44752,33,12,12,1984,92,2076
20200517,NJ,146334,341231,,3411,,1030,,819,,23299,A+,5/17/2020 13:00,7a422af8f551e1f526391977393630697a5f6e7e,2020-05-17T20:00:00Z,10356,,487565,487565,487565,34,107,0,11096,1245,12341
20200517,NM,5857,122727,,208,886,,,,,1739,C,5/16/2020 18:05,2f144e87a3cb344b4b7ea05e40b724a4f61424c1,2020-05-17T20:00:00Z,259,886,128584,128584,128584,35,6,0,3931,195,4126
20200517,NV,6857,73780,,423,,105,,65,,272,B,5/17/2020 11:00,453b9500d39ee3f54e47dd5880e6b0c5483bc03e,2020-05-17T20:00:00Z,349,,80637,80637,80637,32,4,0,6778,195,6973
20200517,NY,350121,1063275,,5897,75525,1981,,1601,,61381,A,5/17/2020 00:00,dc9b0a8798647b7ae586f484f778baef168b1936,2020-05-17T20:00:00Z,22619,75525,1413396,1413396,1413396,36,141,362,32790,1889,34679
20200517,OH,27923,236539,,914,4921,343,1305,230,,,B,5/17/2020 14:00,bc090dcb6a60e739bae718c2cac30897fa63cc2b,2020-05-17T20:00:00Z,1625,4921,264462,264462,264462,39,15,51,17311,449,17760
20200517,OK,5310,118162,,180,880,73,,,,3983,A+,5/17/2020 00:00,7260960881fb8d20695c84bee427bab0fb53af00,2020-05-17T20:00:00Z,288,880,123472,123472,123472,40,0,2,0,73,73
20200517,OR,3623,90733,,156,703,37,,16,,1406,A+,5/17/2020 11:00,c049266a675510772272907c4a9778e017dea12c,2020-05-17T20:00:00Z,137,703,94356,94356,94356,41,0,4,2146,11,2157
20200517,PA,62234,270670,,1821,,,,422,,,C,5/17/2020 00:00,fe7fbf6fb00f11f6a7828b86fbf1bffc4dda9970,2020-05-17T20:00:00Z,4418,,332904,332904,332904,42,15,0,4445,623,5068
20200517,PR,2646,,,,,24,,5,,,C,5/17/2020 05:51,67605ea1a500468d51da3fc7775fac72c0a325fd,2020-05-17T20:00:00Z,123,,2646,2646,2646,72,1,0,0,57,57
20200517,RI,12674,99876,,260,1418,64,,45,,972,A+,5/17/2020 12:00,6e891e7a9f7d6cd357669e1540aa7ba26629361b,2020-05-17T20:00:00Z,499,1418,112550,112550,112550,44,10,15,3830,240,4070
20200517,SC,8661,111670,,,1421,,,,,5076,A,5/16/2020 17:25,47390c538a14c9c1212aaba5a8ac8310b360d593,2020-05-17T20:00:00Z,380,1421,120331,120331,120331,45,0,0,10461,254,10715
20200517,SD,3987,24572,,77,312,,,,,2724,B,5/16/2020 18:00,688472494bd14c90d2cdc4185cc9d44de253eda4,2020-05-17T20:00:00Z,44,312,28559,28559,28559,46,0,8,355,28,383
20200517,TN,17388,307892,,,1482,,,,,9652,A,5/17/2020 15:00,f146085ec5fef1625e3a7c50e2e700778172070f,2020-05-17T20:00:00Z,298,1482,325280,325280,325280,47,3,8,4979,100,5079
20200517,TX,47784,645492,,1512,,,,,,27570,A,5/17/2020 16:15,7836b585e7396b9580f04f08667c6179277c9f8b,2020-05-17T20:00:00Z,1336,,693276,693276,693276,48,31,0,14020,785,14805
20200517,UT,7238,163514,,181,586,,196,,84,4075,B,5/17/2020 12:04,861349cb9918801e5e086538ec852b1efa3f1cde,2020-05-17T20:00:00Z,80,586,170752,170752,170752,49,2,8,3808,170,3978
20200517,VA,30388,159973,527,1524,5517,379,,195,,3993,A+,5/16/2020 17:00,a59249718a1be16995c9fd9114a3cd8e2d5f1723,2020-05-17T20:00:00Z,1009,5517,190888,190361,190361,51,7,103,4088,705,4793
20200517,VI,69,1278,45,,,,,,,61,C,5/16/2020 18:35,9d0fa5aad36b678f164781ae18d911cdb68c299c,2020-05-17T20:00:00Z,6,,1392,1347,1347,78,0,0,84,0,84
20200517,VT,940,21342,,14,,,,,,810,B,5/17/2020 00:00,380c116c75b6cd64386b5ef1fa643acf2078a8a6,2020-05-17T20:00:00Z,54,,22282,22282,22282,50,1,0,0,6,6
20200517,WA,18590,270477,,168,,52,,,,,A,5/17/2020 00:00,1e2a67498df876dc41205154922873d0972dd432,2020-05-17T20:00:00Z,1000,,289067,289067,289067,53,8,0,409,5,414
20200517,WI,12543,139674,182,543,2038,129,494,,,6542,A+,5/17/2020 00:00,1ba7105ffa819b4e137d4bd750a2bc46b43e5221,2020-05-17T20:00:00Z,453,2038,152399,152217,152217,55,0,20,5468,356,5824
20200517,WV,1490,74000,,48,,11,,7,,919,B,5/17/2020 17:00,048ffd7f5d71a0e52da7a4670ec0bdba8d40e0c7,2020-05-17T20:00:00Z,67,,75490,75490,75490,54,3,0,2064,33,2097
20200517,WY,754,16331,,8,70,,,,,498,B,5/16/2020 15:07,6fa6ad4d03a379e7434965db534859132fa6e45d,2020-05-17T20:00:00Z,8,70,17085,17085,17085,56,1,1,653,38,691
20200516,AK,392,32889,,10,,,,,,344,B,5/16/2020 00:00,ebbc757dba7fd38b8459eb3908d4faa864d1d85a,2020-05-16T20:00:00Z,10,,33281,33281,33281,02,0,0,859,4,863
20200516,AL,11523,141971,,,1387,,501,,295,,B,5/16/2020 00:00,b3b647c1555ac18188f23e454877c1b16b53caf2,2020-05-16T20:00:00Z,485,1387,153494,153494,153494,01,9,10,7124,307,7431
20200516,AR,4578,77066,,65,520,,,10,101,3472,A,5/15/2020 16:20,2715a8779c1af1949901c1b256e0c7db130134ab,2020-05-16T20:00:00Z,98,520,81644,81644,81644,05,0,0,0,115,115
20200516,AS,0,105,,,,,,,,,C,5/10/2020 00:00,b8a80308335510397208555fbb0dfad5bfc5416f,2020-05-16T20:00:00Z,0,,105,105,105,60,0,0,0,0,0
20200516,AZ,13631,133157,,791,1683,344,,210,,3357,A+,5/16/2020 00:00,ed387914a563196c474d12d7bc518d1b58279ffd,2020-05-16T20:00:00Z,679,1683,146788,146788,146788,04,28,54,4325,462,4787
20200516,CA,76793,1102333,,4424,,1313,,,,,B,5/16/2020 00:00,e335473bcecc2092fc63063fe12ed043c5f73751,2020-05-16T20:00:00Z,3204,,1179126,1179126,1179126,06,96,0,43363,1857,45220
20200516,CO,21232,100608,,671,3842,,,,,3312,A,5/14/2020 00:00,37b3ee3bcc584865172e3bb459734380e800f6a0,2020-05-16T20:00:00Z,1150,3842,121840,121840,121840,08,59,53,3416,394,3810
20200516,CT,36703,128052,,994,10946,,,,,6264,B,5/15/2020 20:15,b15eb6e4fb7fe44bff7ac2a1bfca9a81f05db0df,2020-05-16T20:00:00Z,3339,10946,164755,164755,164755,09,54,0,8229,618,8847
20200516,DC,7042,28490,,382,,,,79,,998,A,5/15/2020 00:00,c2d074623d06cc96a1d5109a70bf3a1db3550010,2020-05-16T20:00:00Z,375,,35532,35532,35532,11,7,0,1022,171,1193
20200516,DE,7547,32211,,250,,,,,,3367,B,5/15/2020 18:00,e72ebe9d44101938262f481c472ee49fb881d18d,2020-05-16T20:00:00Z,286,,39758,39758,39758,10,15,0,1306,174,1480
20200516,FL,44811,585236,1676,472,8393,232,,,,,A+,5/16/2020 10:02,669f7208041dc4d6e3c36d45c4608ac05673f911,2020-05-16T20:00:00Z,2040,8393,631723,630047,630047,12,49,400,19609,1601,21210
20200516,GA,37147,283922,,1005,6735,,1554,,,,A+,5/16/2020 13:00,615e1ffae8ef2421dc8edc71fbc764a7a684b8f2,2020-05-16T20:00:00Z,1592,6735,321069,321069,321069,13,35,297,18729,466,19195
20200516,GU,154,4365,,,,,,,,126,C,5/16/2020 04:30,cd281610279644edd5b352fe4106638475dfa83c,2020-05-16T20:00:00Z,5,,4519,4519,4519,66,0,0,4,0,4
20200516,HI,638,40245,,,81,,,,,565,B,5/15/2020 18:00,ddb1e7e615deedf0c450e518e7c0265994e0f8fd,2020-05-16T20:00:00Z,17,81,40883,40883,40883,15,0,0,2106,1,2107
20200516,IA,14328,81972,,387,,128,,83,,6927,A+,5/15/2020 00:00,bbb10fc91d491208a93c64373e99ccec3e17c6f6,2020-05-16T20:00:00Z,346,,96300,96300,96300,19,10,0,2455,279,2734
20200516,ID,2389,33299,,,213,,89,,,1588,B,5/15/2020 19:00,ef4072707fdc103bf83417a32f0b60302df4b06f,2020-05-16T20:00:00Z,73,213,35688,35688,35688,16,1,1,905,38,943
20200516,IL,92457,469192,,4306,,1135,,653,,,A,5/16/2020 00:00,780a5f44f8f1f3fce54393f2ce9dff7dd8e1ab45,2020-05-16T20:00:00Z,4129,,561649,561649,561649,17,71,0,20959,2088,23047
20200516,IN,27280,144078,,1274,4389,426,990,199,,,A+,5/15/2020 23:59,948b0408d66d5d1fd7c7ac97e005c135ad8f77cb,2020-05-16T20:00:00Z,1741,4389,171358,171358,171358,18,50,0,5285,625,5910
20200516,KS,7886,53706,,,724,,246,,112,443,A,5/15/2020 10:00,a7e73dc4deed8f9c44f040b62b95d223eb7b911c,2020-05-16T20:00:00Z,172,724,61592,61592,61592,20,0,0,0,0,0
20200516,KY,7444,120290,,381,1896,218,797,,,2739,A+,5/15/2020 17:00,a34e71d03d90952edfb034c5ad98c8870c0543be,2020-05-16T20:00:00Z,332,1896,127734,127734,127734,21,4,9,6237,219,6456
20200516,LA,34117,225625,,1028,,,,123,,22608,B,5/16/2020 13:00,696861698bc263b7e289611adc9aeb453b785477,2020-05-16T20:00:00Z,2479,,259742,259742,259742,22,31,0,6273,280,6553
20200516,MA,84933,363156,,2692,8456,747,,,,,A+,5/16/2020 10:00,c2aaf8eedf0b66b9dd89117cd1b5691dc0f8d815,2020-05-16T20:00:00Z,5705,8456,448089,448089,448089,25,113,142,10898,1512,12410
20200516,MD,37968,152207,,1500,6755,598,,,,2806,,5/16/2020 10:00,22e93a3141b4021287cb034c6038ec14cb6f0f85,2020-05-16T20:00:00Z,1957,6755,190175,190175,190175,24,46,76,6367,982,7349
20200516,ME,1648,22092,,37,214,19,,10,,1012,B,5/16/2020 12:00,436d3613b3c416c8d4675e1c6aa98cf01ea5fea8,2020-05-16T20:00:00Z,70,214,23740,23740,23740,23,1,3,0,45,45
20200516,MI,50504,307417,,1256,,532,,440,,28234,A+,5/16/2020 11:00,48990fdbfd5afd62d8c974307181622d7694d606,2020-05-16T20:00:00Z,4880,,357921,357921,357921,26,55,0,0,425,425
20200516,MN,14969,128312,,493,2039,225,700,,,9571,A+,5/15/2020 17:00,f5b34f94adcca495e741bde78e5b190fcdaa9328,2020-05-16T20:00:00Z,709,2039,143281,143281,143281,27,17,54,7883,729,8612
20200516,MO,10675,128665,,775,,,,116,,,B,5/16/2020 15:00,7c6502d1ae945fc1eb70302bce4477dfb2fe23ff,2020-05-16T20:00:00Z,589,,139340,139340,139340,29,13,0,4663,219,4882
20200516,MP,21,3318,,,,,,,,12,D,5/16/2020 00:00,fe92d141e882ff840ef4edb479a0e4fb474c3992,2020-05-16T20:00:00Z,2,,3339,3339,3339,69,0,0,12,2,14
20200516,MS,11123,97353,,641,1748,170,,81,,6268,A,5/15/2020 19:00,c25651155b534ad1142b20adb93fc65679cfb9a6,2020-05-16T20:00:00Z,510,1748,108476,108476,108476,28,17,36,1331,322,1653
20200516,MT,468,25623,,3,63,,,,,431,B,5/16/2020 00:00,be317bee944f675389cdf640bba65cac8f659b97,2020-05-16T20:00:00Z,16,63,26091,26091,26091,30,0,0,671,2,673
20200516,NC,17982,220604,,481,,,,,,9115,A,5/16/2020 11:00,2d07a8a77e59adfb616974b22f30fa7390268eda,2020-05-16T20:00:00Z,652,,238586,238586,238586,37,11,0,6186,853,7039
20200516,ND,1848,51639,,33,130,,,,,1111,C,5/16/2020 13:00,7c167acf2eb3a0c18831eac7d26e3e1c5fe067ca,2020-05-16T20:00:00Z,42,130,53487,53487,53487,38,0,0,1685,87,1772
20200516,NE,9772,50206,,,,,,,,,C,5/15/2020 15:45,41aae3f2c25b0f3f29f4c1422a17fe71a1cd7593,2020-05-16T20:00:00Z,119,,59978,59978,59978,31,6,0,2407,356,2763
20200516,NH,3464,39212,1401,110,335,,109,,,1254,B,5/15/2020 09:00,9e367dbae784781a994f8b46d3b098c2b8a59d0c,2020-05-16T20:00:00Z,159,335,44077,42676,42676,33,0,0,64,0,64
20200516,NJ,145089,330135,,3564,,1061,,846,,22939,A+,5/16/2020 13:00,a1d5ee1890ca01342f04526d2be0d2997e662e3e,2020-05-16T20:00:00Z,10249,,475224,475224,475224,34,111,0,11068,1184,12252
20200516,NM,5662,118796,,223,886,,,,,1671,C,5/15/2020 18:01,69a90501b35471efd8ea0f7ca84faec9f744368d,2020-05-16T20:00:00Z,253,886,124458,124458,124458,35,11,0,4698,159,4857
20200516,NV,6662,67002,,423,,105,,65,,272,B,5/16/2020 12:00,2e41b8fbad82d469691783657fe2180d379fd861,2020-05-16T20:00:00Z,345,,73664,73664,73664,32,6,0,1470,48,1518
20200516,NY,348232,1030485,,6220,75163,2077,,1674,,60796,A,5/16/2020 00:00,622d82ace7ccf79647d53e9afa44ad8b1dacdcd6,2020-05-16T20:00:00Z,22478,75163,1378717,1378717,1378717,36,174,412,38250,2419,40669
20200516,OH,27474,219228,,866,4870,366,1277,251,,,B,5/16/2020 14:00,81ad312198b01fb16e9bb09a267c963753aaea08,2020-05-16T20:00:00Z,1610,4870,246702,246702,246702,39,29,79,0,520,520
20200516,OK,5237,118162,,180,878,73,,,,3945,A+,5/16/2020 00:00,a0409ac7bf95e7b598968817bc54f0ba791f3ffb,2020-05-16T20:00:00Z,288,878,123399,123399,123399,40,3,15,5056,151,5207
20200516,OR,3612,88587,,153,699,48,,16,,1406,A+,5/16/2020 11:00,07e1ba7619fe165bed8fcb7cc1d6d8321759b2c0,2020-05-16T20:00:00Z,137,699,92199,92199,92199,41,0,8,2622,71,2693
20200516,PA,61611,266225,,1873,,,,429,,,C,5/16/2020 00:00,161a82440681a4267d2b5f7718eba9aa273f4964,2020-05-16T20:00:00Z,4403,,327836,327836,327836,42,61,0,7015,989,8004
20200516,PR,2589,,,161,,15,,5,,,B,5/16/2020 04:59,289f74f1265ff0d89efa36ba8091465362fcbc2c,2020-05-16T20:00:00Z,122,,2589,2589,2589,72,0,0,0,47,47
20200516,RI,12434,96046,,273,1403,66,,44,,947,A+,5/16/2020 12:00,9bd1830c437e39445f146c19ff4f68251e59b16d,2020-05-16T20:00:00Z,489,1403,108480,108480,108480,44,10,31,3287,215,3502
20200516,SC,8407,101209,,,1421,,,,,5076,A,5/15/2020 16:00,540817a2c53e356d3d1273c72b424dc322e7782a,2020-05-16T20:00:00Z,380,1421,109616,109616,109616,45,0,0,0,0,0
20200516,SD,3959,24217,,75,304,,,,,2673,B,5/15/2020 18:00,7d72cf26038d1378315afbdd832b7cfaa4195405,2020-05-16T20:00:00Z,44,304,28176,28176,28176,46,0,8,690,72,762
20200516,TN,17288,302913,,,1474,,,,,9529,A,5/16/2020 15:00,3bb4e51fd9e51add7b1df0fedeed808214aaa054,2020-05-16T20:00:00Z,295,1474,320201,320201,320201,47,5,20,10127,318,10445
20200516,TX,46999,631472,,1791,,,,,,26601,A,5/15/2020 16:15,9a5b4cfd52b79d1b18886b7ac183bcddee2b180e,2020-05-16T20:00:00Z,1305,,678471,678471,678471,48,33,0,30678,1801,32479
20200516,UT,7068,159706,,168,578,,194,,84,3896,B,5/16/2020 10:21,003c19b221e8cc5236316593052854ea4eef53da,2020-05-16T20:00:00Z,78,578,166774,166774,166774,49,1,12,3401,155,3556
20200516,VA,29683,155885,485,1505,5414,381,,189,,3909,A+,5/15/2020 17:00,d4628b48983aa7f5c1dfa0035ef1a00106e8b745,2020-05-16T20:00:00Z,1002,5414,186053,185568,185568,51,25,98,6543,1011,7554
20200516,VI,69,1194,37,,,,,,,61,C,5/14/2020 19:04,d23ddae66222ca554045ee488a3f6e2d7476b64d,2020-05-16T20:00:00Z,6,,1300,1263,1263,78,0,0,0,0,0
20200516,VT,934,21342,,20,,,,,,804,B,5/16/2020 00:00,ec82b168f494efd6298f44972736d70c64ebdc0b,2020-05-16T20:00:00Z,53,,22276,22276,22276,50,0,0,-930,1,-929
20200516,WA,18585,270068,,331,,90,,,,,A,5/16/2020 00:00,5e353f19fc33a5c4a6b78f408b2783bfdf861c8c,2020-05-16T20:00:00Z,992,,288653,288653,288653,53,9,0,1286,30,1316
20200516,WI,12187,134206,189,546,2018,127,488,,,6542,A+,5/16/2020 00:00,1873ab37f186c9e770d12e0a4ab07cdc93b36638,2020-05-16T20:00:00Z,453,2018,146582,146393,146393,55,8,41,5549,502,6051
20200516,WV,1457,71936,,55,,13,,6,,889,B,5/16/2020 10:00,d48c366beaca7d30fe464aec140165e17efda6be,2020-05-16T20:00:00Z,64,,73393,73393,73393,54,2,0,2441,16,2457
20200516,WY,716,15678,,8,69,,,,,496,B,5/15/2020 16:20,b0d6736f6416c448865108906ad90edd34c74f0f,2020-05-16T20:00:00Z,7,69,16394,16394,16394,56,0,1,371,1,372
20200515,AK,388,32030,,8,,,,,,343,B,5/14/2020 00:00,f536c18047b4cea1324fe04724f7381ea682bd38,2020-05-15T20:00:00Z,10,,32418,32418,32418,02,0,0,655,1,656
20200515,AL,11216,134847,,,1377,,497,,293,,B,5/15/2020 00:00,8d7c548d019dcc5539c1314bb139ca11c4bd793b,2020-05-15T20:00:00Z,476,1377,146063,146063,146063,01,9,27,3830,248,4078
20200515,AR,4463,77066,,65,520,,,9,101,3390,A,5/15/2020 16:20,96b617922fe57968d27b560bbe8547065ea597fe,2020-05-15T20:00:00Z,98,520,81529,81529,81529,05,1,11,5484,227,5711
20200515,AS,0,105,,,,,,,,,C,5/10/2020 00:00,1bb445d1910b80b0e68ea5e0253644b5251a37ef,2020-05-15T20:00:00Z,0,,105,105,105,60,0,0,0,0,0
20200515,AZ,13169,128832,,808,1629,313,,222,,3145,A+,5/15/2020 00:00,40d27b381b995805d0ef63ea39c2d0033d15d168,2020-05-15T20:00:00Z,651,1629,142001,142001,142001,04,27,-7,7168,495,7663
20200515,CA,74936,1058970,,4519,,1324,,,,,B,5/14/2020 00:00,dd4a56509207e53adc6f228223657494252d0d39,2020-05-15T20:00:00Z,3108,,1133906,1133906,1133906,06,76,0,27483,1772,29255
20200515,CO,20838,97192,,685,3789,,,,,3217,A,5/13/2020 00:00,6cd5b2dd7a32c5d3c0a52851c31eb0f4447152b5,2020-05-15T20:00:00Z,1091,3789,118030,118030,118030,08,29,54,3148,363,3511
20200515,CT,36085,119823,,1033,10946,,,,,6264,B,5/14/2020 20:30,2e25e5303dc2110f3d9f554edef3615bfc65fa56,2020-05-15T20:00:00Z,3285,10946,155908,155908,155908,09,66,0,5725,621,6346
20200515,DC,6871,27468,,393,,,,90,,975,A,5/14/2020 00:00,17190260870f259a18b29c701e5c839610c84c63,2020-05-15T20:00:00Z,368,,34339,34339,34339,11,10,0,1205,135,1340
20200515,DE,7373,30905,,269,,,,,,3210,B,5/14/2020 18:00,a3cd9f55970e9f1d0ff2a9f378a066004877bc18,2020-05-15T20:00:00Z,271,,38278,38278,38278,10,11,0,1271,150,1421
20200515,FL,43210,565627,1228,472,7993,232,,,,,A+,5/14/2020 12:33,12ded49a944b5cb60be8fd54c4bf211689017228,2020-05-15T20:00:00Z,1991,7993,610065,608837,608837,12,43,0,0,0,0
20200515,GA,36681,265193,,,6438,,1534,,,,A+,5/15/2020 13:00,4bbc1a255b9dc9d678a11542dd94cab3e2c0edd3,2020-05-15T20:00:00Z,1557,6438,301874,301874,301874,13,30,93,15170,823,15993
20200515,GU,154,4361,,,,,,,,124,C,5/15/2020 04:45,c2b73015710cb6db34bb9a9fa6189737868ef8df,2020-05-15T20:00:00Z,5,,4515,4515,4515,66,0,0,135,1,136
20200515,HI,637,38139,,,81,,,,,564,B,5/14/2020 18:00,f8e2590d4432dcd5368909981404ab9c5e8c9316,2020-05-15T20:00:00Z,17,81,38776,38776,38776,15,0,0,-104,-1,-105
20200515,IA,14049,79517,,387,,130,,87,,6561,A+,5/14/2020 00:00,568deee21a555e5c243058ca7c99349ecec9de68,2020-05-15T20:00:00Z,336,,93566,93566,93566,19,18,0,3898,374,4272
20200515,ID,2351,32394,,,212,,89,,,1573,B,5/14/2020 19:00,76682158af27b10897f2c42cc7ba37217c009805,2020-05-15T20:00:00Z,72,212,34745,34745,34745,16,3,0,964,27,991
20200515,IL,90369,448233,,4367,,1129,,675,,,A,5/15/2020 00:00,beeae9be7c9b11830edb2ac7e350bc68104cfb9e,2020-05-15T20:00:00Z,4058,,538602,538602,538602,17,130,0,24133,2432,26565
20200515,IN,26655,138793,,1294,4389,492,990,213,,,A+,5/14/2020 23:59,ca875b5ae6440b327c99b92adde8d4b44ff04098,2020-05-15T20:00:00Z,1691,4389,165448,165448,165448,18,45,0,4607,602,5209
20200515,KS,7886,53706,,,724,,246,,112,443,A,5/15/2020 10:00,9f1b4f268dd09e1df9d728692dcd14f003fe72a0,2020-05-15T20:00:00Z,172,724,61592,61592,61592,20,8,20,3546,418,3964
20200515,KY,7225,114053,,385,1887,220,794,,,2712,A+,5/14/2020 17:00,f6a5783ab7b4b4673fc7840a3d8e13c456996bf1,2020-05-15T20:00:00Z,328,1887,121278,121278,121278,21,2,52,3738,145,3883
20200515,LA,33837,219352,,1091,,,,132,,22608,B,5/15/2020 13:00,653ddbe0dc6d7d773f91f0940e5fd83f6f0e0848,2020-05-15T20:00:00Z,2448,,253189,253189,253189,22,31,0,5253,348,5601
20200515,MA,83421,352258,,2767,8314,749,,,,,A+,5/14/2020 10:00,81928ad2704f6448278c92c1818face4b76c8e21,2020-05-15T20:00:00Z,5592,8314,435679,435679,435679,25,110,107,10079,1239,11318
20200515,MD,36986,145840,,1496,6679,598,,,,2685,,5/15/2020 10:00,2cb4a6832706a6ca86893ad03ad287c3211c9594,2020-05-15T20:00:00Z,1911,6679,182826,182826,182826,24,45,126,3289,1083,4372
20200515,ME,1603,22092,,35,211,16,,8,,993,B,5/15/2020 12:00,0a71b98212d1edb4afad76a1aae5b3d3e00340ef,2020-05-15T20:00:00Z,69,211,23695,23695,23695,23,0,4,0,38,38
20200515,MI,50079,307417,,1256,,532,,440,,22686,A+,5/14/2020 11:00,dd9ffb53da782e1777a84cbbd982c96f4118268e,2020-05-15T20:00:00Z,4825,,357496,357496,357496,26,38,0,21116,497,21613
20200515,MN,14240,120429,,498,1985,200,679,,,8820,A+,5/14/2020 17:00,d1508d33e157adcf74822567b643aa93636abbac,2020-05-15T20:00:00Z,692,1985,134669,134669,134669,27,29,70,5112,805,5917
20200515,MO,10456,124002,,812,,,,120,,,B,5/15/2020 15:00,2b67ad198e9984e2fc656375303b71067dc62d76,2020-05-15T20:00:00Z,576,,134458,134458,134458,29,14,0,7209,139,7348
20200515,MP,19,3306,,,,,,,,12,D,5/15/2020 00:00,79ca91de44d0d00f007685f7d287220129f782ca,2020-05-15T20:00:00Z,2,,3325,3325,3325,69,0,0,0,0,0
20200515,MS,10801,96022,,573,1712,172,,81,,6268,A,5/14/2020 19:00,d774a232a25ab76a1be9a328d59ac4462a49dddb,2020-05-15T20:00:00Z,493,1712,106823,106823,106823,28,13,45,1179,318,1497
20200515,MT,466,24952,,3,63,,,,,431,B,5/15/2020 00:00,ae1e5f8325427cd9c49130a4ad24cc3cd7345317,2020-05-15T20:00:00Z,16,63,25418,25418,25418,30,0,0,865,4,869
20200515,NC,17129,214418,,492,,,,,,9115,A,5/15/2020 11:00,fa4ea6838c5c4342686f68cfc1be06e505f7a6ec,2020-05-15T20:00:00Z,641,,231547,231547,231547,37,26,0,11657,622,12279
20200515,ND,1761,49954,,35,130,,,,,1071,C,5/15/2020 13:00,c7e05e3eabb93e0e01c62c40640c3dee07f92094,2020-05-15T20:00:00Z,42,130,51715,51715,51715,38,2,1,1355,114,1469
20200515,NE,9416,47799,,,,,,,,,C,5/14/2020 15:45,685e51f1e2467d7b22ec7a87334726f3c6fa7386,2020-05-15T20:00:00Z,113,,57215,57215,57215,31,6,0,3533,341,3874
20200515,NH,3464,39148,543,115,335,,109,,,1247,B,5/14/2020 09:00,5593f127756fdfe3e5af9014ef803c2b8fb42555,2020-05-15T20:00:00Z,159,335,43155,42612,42612,33,9,9,3272,165,3437
20200515,NJ,143905,319067,,3823,,1127,,865,,15642,A+,5/15/2020 13:00,45b3cca36b07757bb1dd2905e39af31f77ee1de4,2020-05-15T20:00:00Z,10138,,462972,462972,462972,34,192,0,10075,1201,11276
20200515,NM,5503,114098,,209,886,,,,,1576,C,5/14/2020 17:55,1dfaa4bc502bb6eee842aea578747c3d564e255e,2020-05-15T20:00:00Z,242,886,119601,119601,119601,35,11,0,4451,139,4590
20200515,NV,6614,65532,,425,,115,,73,,272,B,5/15/2020 12:00,18254a5b6544c9ddd3b8a6ecde34dc765e2d69a7,2020-05-15T20:00:00Z,339,,72146,72146,72146,32,8,0,2547,115,2662
20200515,NY,345813,992235,,6394,74751,2156,,1774,,60302,A,5/14/2020 00:00,9b7193c6e15e6af3ddd33905595f6175ab1b495d,2020-05-15T20:00:00Z,22304,74751,1338048,1338048,1338048,36,134,318,36529,2762,39291
20200515,OH,26954,219228,,944,4791,370,1277,260,,,B,5/15/2020 14:00,25e1d7a8e26a4568d1aac8367392b444ba9e4545,2020-05-15T20:00:00Z,1581,4791,246182,246182,246182,39,47,73,12233,597,12830
20200515,OK,5086,113106,,215,863,98,,,,3801,A+,5/15/2020 00:00,66bc81ffe572f39fcd6fb4f3d50dd9805967bf0b,2020-05-15T20:00:00Z,285,863,118192,118192,118192,40,1,5,5885,124,6009
20200515,OR,3541,85965,,161,691,46,,19,,1406,A+,5/15/2020 11:00,c6f893a086cdb467e07874c280d349b638a672d6,2020-05-15T20:00:00Z,137,691,89506,89506,89506,41,0,6,5394,62,5456
20200515,PA,60622,259210,,1934,,,,431,,,C,5/15/2020 00:00,9b3433b7d1e782e12119dec7bfdc8482e852d7d4,2020-05-15T20:00:00Z,4342,,319832,319832,319832,42,124,0,7651,986,8637
20200515,PR,2542,,,147,,18,,3,,,B,5/15/2020 05:51,bbd4c37cf50b40eb2fdf0dbb70777015dc114828,2020-05-15T20:00:00Z,122,,2542,2542,2542,72,5,0,0,115,115
20200515,RI,12219,92759,,272,1372,63,,41,,919,A+,5/15/2020 12:00,0a5b2c3086dbcec6bac43dfc246ce34c0cebfb55,2020-05-15T20:00:00Z,479,1372,104978,104978,104978,44,11,21,3174,203,3377
20200515,SC,8407,101209,,,1421,,,,,5076,A,5/15/2020 16:00,b84f7972ce5863e94d569b44321ecc9101e56772,2020-05-15T20:00:00Z,380,1421,109616,109616,109616,45,9,83,6863,218,7081
20200515,SD,3887,23527,,80,296,,,,,2574,B,5/14/2020 18:00,ad2bdf1acf6f736f57696ee85c7f1a4eda2211a5,2020-05-15T20:00:00Z,44,296,27414,27414,27414,46,1,6,846,95,941
20200515,TN,16970,292786,,,1454,,,,,9280,A,5/15/2020 15:00,a3876666a9061ffbeaacfc721940b547564a50d4,2020-05-15T20:00:00Z,290,1454,309756,309756,309756,47,3,19,7168,271,7439
20200515,TX,45198,600794,,1716,,,,,,25454,A,5/15/2020 16:15,61391ac9a81fe7bc2178ffdf028d776bb6ebee6a,2020-05-15T20:00:00Z,1272,,645992,645992,645992,48,56,0,21361,1347,22708
20200515,UT,6913,156305,,161,566,,190,,83,3719,B,5/15/2020 10:27,007075841b29601971eb9ba33b101093f8caf638,2020-05-15T20:00:00Z,77,566,163218,163218,163218,49,2,8,2935,164,3099
20200515,VA,28672,149342,458,1511,5316,362,,195,,3805,A+,5/14/2020 17:00,d6cb7f78bd8e7c0308cd4b4abfbde55751bf3f5f,2020-05-15T20:00:00Z,977,5316,178472,178014,178014,51,22,105,10325,859,11184
20200515,VI,69,1194,37,,,,,,,61,C,5/14/2020 19:04,f1c1940001cd862d3562c906f96a30c2f60eb9b0,2020-05-15T20:00:00Z,6,,1300,1263,1263,78,0,0,30,0,30
20200515,VT,933,22272,,17,,,,,,796,B,5/15/2020 00:00,e8e19cde347c192dacbc392ea63813aefccc671a,2020-05-15T20:00:00Z,53,,23205,23205,23205,50,0,0,699,1,700
20200515,WA,18555,268782,,374,,114,,,,,A,5/15/2020 00:00,2e6523de711c9ba4e4f6c71a0d2507d00840f58a,2020-05-15T20:00:00Z,983,,287337,287337,287337,53,8,0,4185,130,4315
20200515,WI,11685,128657,191,548,1977,113,485,,,6250,A+,5/15/2020 00:00,9ac761b834f4b9300e0fce510d0b59d002f7298d,2020-05-15T20:00:00Z,445,1977,140533,140342,140342,55,11,38,6059,410,6469
20200515,WV,1441,69495,,57,,15,,8,,870,B,5/15/2020 10:00,ca1aa6c47bc1c8255c16522b372c3e9a9fd79ce5,2020-05-15T20:00:00Z,62,,70936,70936,70936,54,2,0,2209,14,2223
20200515,WY,715,15307,,8,68,,,,,487,B,5/14/2020 00:00,14ba619ea080945f3c0cc252b493a56d5f908dd0,2020-05-15T20:00:00Z,7,68,16022,16022,16022,56,0,1,578,14,592
20200514,AK,387,31375,,12,,,,,,339,B,5/14/2020 00:00,4cd61592289ebde7cc18776a1c562217a6c9459d,2020-05-14T20:00:00Z,10,,31762,31762,31762,02,0,0,1109,4,1113
20200514,AL,10968,131017,,,1350,,489,,291,,B,5/14/2020 00:00,0c7e2b77ab27b5d8e3747dd1c934869148ecd012,2020-05-14T20:00:00Z,467,1350,141985,141985,141985,01,18,33,5262,351,5613
20200514,AR,4236,71582,,64,509,,,13,100,3277,A,5/14/2020 08:20,d99ce33ac0b3b642f75b868f76180c249f3fb456,2020-05-14T20:00:00Z,97,509,75818,75818,75818,05,2,12,2531,72,2603
20200514,AS,0,105,,,,,,,,,C,5/10/2020 00:00,223918d2f967c849abaac5dbe21c854dd676c9cc,2020-05-14T20:00:00Z,0,,105,105,105,60,0,0,0,0,0
20200514,AZ,12674,121664,,781,1636,323,,201,,3074,A+,5/14/2020 00:00,91666cd6ed247ef298d02ea73bd66d5bfdf6122a,2020-05-14T20:00:00Z,624,1636,134338,134338,134338,04,30,46,6090,498,6588
20200514,CA,73164,1031487,,4655,,1324,,,,,B,5/14/2020 00:00,ab1526dbbdbe36c6e661db2aa371d77dd19df51d,2020-05-14T20:00:00Z,3032,,1104651,1104651,1104651,06,98,0,37036,2023,39059
20200514,CO,20475,94044,,685,3735,,,,,3217,A,5/12/2020 00:00,f31c2e774e1d3f9c6f9db9c695dc6d978a37fbcb,2020-05-14T20:00:00Z,1062,3735,114519,114519,114519,08,53,40,2951,318,3269
20200514,CT,35464,114098,,1103,10946,,,,,6264,B,5/13/2020 20:30,4322b1e818e1cfd2f3a77d7bd573699eb23b8e11,2020-05-14T20:00:00Z,3219,10946,149562,149562,149562,09,94,1557,6010,609,6619
20200514,DC,6736,26263,,397,,,,90,,966,A,5/13/2020 00:00,37fed425316ee8a96f4437af258c5bcdb1554905,2020-05-14T20:00:00Z,358,,32999,32999,32999,11,8,0,1189,152,1341
20200514,DE,7223,29634,,273,,,,,,3080,B,5/13/2020 18:00,425a83893eb5dd7c03dedcc9fb85774c9c671b6c,2020-05-14T20:00:00Z,260,,36857,36857,36857,10,13,0,1833,271,2104
20200514,FL,43210,565627,1228,472,7993,232,,,,,A+,5/14/2020 12:33,08cd50784b8e27d4ca75aeb5fcff7fb05dafb15a,2020-05-14T20:00:00Z,1948,7993,610065,608837,608837,12,50,158,13266,808,14074
20200514,GA,35858,250023,,,6345,,1513,,,,A+,5/14/2020 13:30,99bcce9e3a8809756adb209161131d0b1efd2115,2020-05-14T20:00:00Z,1527,6345,285881,285881,285881,13,22,86,11451,526,11977
20200514,GU,153,4226,,,,,,,,124,C,5/14/2020 05:45,faa0873fd8d09b226cd2c35b49264bbb5071fb98,2020-05-14T20:00:00Z,5,,4379,4379,4379,66,0,0,116,1,117
20200514,HI,638,38243,,,81,,,,,563,B,5/13/2020 18:00,ead9c2c5ac72338b889240aac5358950e79dbeae,2020-05-14T20:00:00Z,17,81,38881,38881,38881,15,0,0,513,3,516
20200514,IA,13675,75619,,405,,134,,93,,6231,A+,5/13/2020 00:00,132d33d134340bb424885e8380e609b02dd8752a,2020-05-14T20:00:00Z,318,,89294,89294,89294,19,12,0,3189,386,3575
20200514,ID,2324,31430,,,212,,88,,,1557,B,5/13/2020 19:00,51b8808ae7a6e446afd5580dd162e24c302fdfdd,2020-05-14T20:00:00Z,69,212,33754,33754,33754,16,0,-2,595,31,626
20200514,IL,87937,424100,,4473,,1132,,689,,,A,5/14/2020 00:00,a876c20dbff144e5f0e79d1938b9715f87ac6b40,2020-05-14T20:00:00Z,3928,,512037,512037,512037,17,136,0,19439,3239,22678
20200514,IN,26053,134186,,1381,4389,488,990,217,,,A+,5/13/2020 23:59,6c625a3b8e3a729824c368ea58f1b9b2c39a4ddc,2020-05-14T20:00:00Z,1646,4389,160239,160239,160239,18,27,0,5576,580,6156
20200514,KS,7468,50160,,,704,,238,,108,422,A,5/13/2020 10:00,9336495b809672bcb93b80eff453b9ffacdf9046,2020-05-14T20:00:00Z,164,704,57628,57628,57628,20,0,0,0,0,0
20200514,KY,7080,110315,,377,1835,215,784,,,2649,A+,5/13/2020 17:00,974c86ea643c02fbba54fa1c3d4c9a722df886bf,2020-05-14T20:00:00Z,326,1835,117395,117395,117395,21,5,10,6534,227,6761
20200514,LA,33489,214099,,1193,,,,140,,22608,B,5/14/2020 13:00,d4c7186772b7c37de7ad8a1263e57da38205e75d,2020-05-14T20:00:00Z,2417,,247588,247588,247588,22,36,0,8857,827,9684
20200514,MA,82182,342179,,2859,8207,781,,,,,A+,5/13/2020 10:00,dde4f439c0bf5c6d3f4ff4acab6d3ccf8a968afc,2020-05-14T20:00:00Z,5482,8207,424361,424361,424361,25,167,175,12644,1685,14329
20200514,MD,35903,142551,,1538,6553,569,,,,2569,,5/14/2020 10:00,6f833fc13c26af144289698bd73562356958fcc0,2020-05-14T20:00:00Z,1866,6553,178454,178454,178454,24,57,149,3789,1091,4880
20200514,ME,1565,22092,,37,207,18,,7,,958,B,5/14/2020 12:30,c9e3bd1005fd7a9893bcdd12f8ba68b6f1f71d3c,2020-05-14T20:00:00Z,69,207,23657,23657,23657,23,3,3,0,50,50
20200514,MI,49582,286301,,1330,,653,,515,,22686,A+,5/14/2020 11:00,728134334478e07a42d3e0e291ec3f7c0293d756,2020-05-14T20:00:00Z,4787,,335883,335883,335883,26,73,0,26432,1191,27623
20200514,MN,13435,115317,,498,1915,203,663,,,8473,A+,5/13/2020 17:00,ac8a7a1ac321ed491129848882ce0bb688ec72e5,2020-05-14T20:00:00Z,663,1915,128752,128752,128752,27,25,64,6199,518,6717
20200514,MO,10317,116793,,796,,,,115,,,B,5/14/2020 15:00,973eabc5c0120a25364c84d49207a1a0e8fed7a8,2020-05-14T20:00:00Z,562,,127110,127110,127110,29,20,0,2793,175,2968
20200514,MP,19,3306,,,,,,,,12,D,5/14/2020 00:00,b08bc9764ef8dee231d256d47380136ed58e572e,2020-05-14T20:00:00Z,2,,3325,3325,3325,69,0,0,285,0,285
20200514,MS,10483,94843,,589,1667,131,,72,,6268,A,5/13/2020 19:00,113111017b63e87323c208beee6256a988b5efb6,2020-05-14T20:00:00Z,480,1667,105326,105326,105326,28,15,51,4885,393,5278
20200514,MT,462,24087,,3,63,,,,,431,B,5/14/2020 00:00,cd4417db3e0c03025a90d79157fa5ca3dcea6372,2020-05-14T20:00:00Z,16,63,24549,24549,24549,30,0,0,697,0,697
20200514,NC,16507,202761,,507,,,,,,9115,A,5/14/2020 11:00,1ec07a85eac921f142afb5c7a7428f2109300cf1,2020-05-14T20:00:00Z,615,,219268,219268,219268,37,18,0,8120,691,8811
20200514,ND,1647,48599,,38,129,,,,,1007,C,5/14/2020 13:00,0b141c449c1b04fdfeb11c7fbb05245f0f8387f4,2020-05-14T20:00:00Z,40,129,50246,50246,50246,38,0,2,1301,0,1301
20200514,NE,9075,44266,,,,,,,,,C,5/13/2020 20:00,8e26a97f89cbcf4abc6a04c143417b5fcc9e55a9,2020-05-14T20:00:00Z,107,,53341,53341,53341,31,4,0,3233,383,3616
20200514,NH,3299,35876,735,126,326,,97,,,1236,B,5/13/2020 09:00,a2354a712234d8d44acbf4b67920df1c8689bc0d,2020-05-14T20:00:00Z,150,326,39910,39175,39175,33,8,7,1899,60,1959
20200514,NJ,142704,308992,,3958,,1157,,898,,15642,A+,5/14/2020 13:00,3bbe31c305d3d528719662b3798df23dc133f3f2,2020-05-14T20:00:00Z,9946,,451696,451696,451696,34,244,0,9102,1144,10246
20200514,NM,5364,109647,,200,886,,,,,1515,C,5/13/2020 20:20,d25b02d05f9c15802c397707d99d1705250d04d9,2020-05-14T20:00:00Z,231,886,115011,115011,115011,35,12,0,4570,152,4722
20200514,NV,6499,62985,,515,,126,,75,,244,B,5/14/2020 12:00,60c5110fdf243000ca8f3249205b7f3839f45104,2020-05-14T20:00:00Z,331,,69484,69484,69484,32,10,0,2707,105,2812
20200514,NY,343051,955706,,6706,74433,2223,,1846,,59758,A,5/14/2020 00:00,d1e88d9c65cc15cd5d79fa8b1ff1d1c8579f3c5f,2020-05-14T20:00:00Z,22170,74433,1298757,1298757,1298757,36,157,470,37460,2390,39850
20200514,OH,26357,206995,,953,4718,360,1268,253,,,B,5/14/2020 14:00,8cb4d6353252db8a65a52452a1c1610c590c636d,2020-05-14T20:00:00Z,1534,4718,233352,233352,233352,39,51,100,6862,636,7498
20200514,OK,4962,107221,,217,858,102,,,,3660,A+,5/14/2020 00:00,b6161bd93c9bba3b0484642f6224df4d5c837071,2020-05-14T20:00:00Z,284,858,112183,112183,112183,40,6,10,2946,110,3056
20200514,OR,3479,80571,,163,685,38,,17,,1406,A+,5/14/2020 11:00,e93183106b451a5d42982483bab37114bf785371,2020-05-14T20:00:00Z,137,685,84050,84050,84050,41,3,7,0,63,63
20200514,PA,59636,251559,,1983,,,,446,,,C,5/14/2020 00:00,2705d062b62ed8fe149e4a5c3fee9b136163108a,2020-05-14T20:00:00Z,4218,,311195,311195,311195,42,275,0,7388,938,8326
20200514,PR,2427,,,159,,18,,5,,,B,5/14/2020 06:30,b70f52c40e2003b8f2a97501f0dda4227288fede,2020-05-14T20:00:00Z,117,,2427,2427,2427,72,2,0,0,98,98
20200514,RI,12016,89585,,271,1351,65,,42,,903,A+,5/14/2020 12:00,3817955f87e430acd4f8aeeb10b3542de4d07e0c,2020-05-14T20:00:00Z,468,1351,101601,101601,101601,44,6,23,3498,181,3679
20200514,SC,8189,94346,,,1338,,,,,4914,A,5/14/2020 15:34,db68b8034fbc75e17c75c7a79890ecc538b49bc5,2020-05-14T20:00:00Z,371,1338,102535,102535,102535,45,16,0,9133,262,9395
20200514,SD,3792,22681,,85,290,,,,,2437,B,5/13/2020 18:00,2ebb501ba6f33a29893f01274a8ae7a83f02aa52,2020-05-14T20:00:00Z,43,290,26473,26473,26473,46,4,9,569,60,629
20200514,TN,16699,285618,,,1435,,,,,8881,A,5/14/2020 15:00,a344fd94720a960c94d1d106287801b03dcfeb48,2020-05-14T20:00:00Z,287,1435,302317,302317,302317,47,14,47,9071,329,9400
20200514,TX,43851,579433,,1648,,,,,,24487,A,5/14/2020 16:30,079503d0ff0282cf02e23eafef7222e841c55677,2020-05-14T20:00:00Z,1216,,623284,623284,623284,48,58,0,34405,1448,35853
20200514,UT,6749,153370,,142,558,,187,,83,3566,B,5/14/2020 10:07,1eed6f28aaf2ab2567abde09ec15967882cb73e1,2020-05-14T20:00:00Z,75,558,160119,160119,160119,49,0,5,3204,129,3333
20200514,VA,27813,139017,496,1533,5211,355,,201,,3678,A+,5/13/2020 17:00,d718e85fd7b1a662fb8937f10ee43e938f3a6b7b,2020-05-14T20:00:00Z,955,5211,167326,166830,166830,51,28,131,4371,1067,5438
20200514,VI,69,1164,45,,,,,,,61,C,5/13/2020 17:44,eee09f56f69f7871409f2796d76ea56209e3ba46,2020-05-14T20:00:00Z,6,,1278,1233,1233,78,0,0,36,0,36
20200514,VT,932,21573,,18,,,,,,792,B,5/14/2020 00:00,55ca549126a7637b60fdde3005f1a6dcd8e5299f,2020-05-14T20:00:00Z,53,,22505,22505,22505,50,0,0,826,3,829
20200514,WA,18425,264597,,365,,111,,,,,A,5/14/2020 00:00,4f012360c453ab463e14078128955f6b725fae2f,2020-05-14T20:00:00Z,975,,283022,283022,283022,53,13,0,4920,225,5145
20200514,WI,11275,122598,169,507,1939,121,478,,,5994,A+,5/14/2020 00:00,e1da001e0870bc0c814799abcd939f859c6f3ab0,2020-05-14T20:00:00Z,434,1939,134042,133873,133873,55,13,31,5487,373,5860
20200514,WV,1427,67286,,52,,9,,5,,870,B,5/14/2020 10:00,fb56528146ff63b89433d64c35bc8b8a230cd901,2020-05-14T20:00:00Z,60,,68713,68713,68713,54,2,0,2004,29,2033
20200514,WY,701,14729,,8,67,,,,,480,B,5/14/2020 00:00,2c39ee8aebd346ddf047dcd3185f744bc00855e1,2020-05-14T20:00:00Z,7,67,15430,15430,15430,56,0,0,345,26,371
20200513,AK,383,30266,,12,,,,,,338,B,5/13/2020 00:00,f0aa4fdcbcf8798aa196f83b3272544e5c3a941d,2020-05-13T20:00:00Z,10,,30649,30649,30649,02,0,0,688,0,688
20200513,AL,10617,125755,,,1317,,477,,284,,B,5/13/2020 00:00,0c929ad796f110118adce3c056060cecf4cde550,2020-05-13T20:00:00Z,449,1317,136372,136372,136372,01,20,30,2847,307,3154
20200513,AR,4164,69051,,59,497,,,12,99,3220,A,5/12/2020 18:33,72af1969cef24d39d08a6be137b8ef56f633511c,2020-05-13T20:00:00Z,95,497,73215,73215,73215,05,0,12,2771,0,2771
20200513,AS,0,105,,,,,,,,,C,5/10/2020 00:00,bcf6d9f15e8b1e7a68106b63798a38260000149f,2020-05-13T20:00:00Z,0,,105,105,105,60,0,0,0,0,0
20200513,AZ,12176,115574,,755,1590,292,,191,,2979,A+,5/13/2020 00:00,b76df3dfb275ebcb96fcfa48e0f5062f241055d6,2020-05-13T20:00:00Z,594,1590,127750,127750,127750,04,32,26,4468,440,4908
20200513,CA,71141,994451,,4545,,1314,,,,,B,5/13/2020 00:00,8a5867cd4322367e6ab3f8a0fb2b92285aa60b64,2020-05-13T20:00:00Z,2934,,1065592,1065592,1065592,06,87,0,30463,1759,32222
20200513,CO,20157,91093,,688,3695,,,,,3171,A,5/11/2020 00:00,5b76edb8a4e871129833425856f807723383ec35,2020-05-13T20:00:00Z,1009,3695,111250,111250,111250,08,22,32,2315,278,2593
20200513,CT,34855,108088,,1158,9389,,,,,5413,B,5/13/2020 14:00,9f64d067c58a26177100ab576630d39d10b4e1c2,2020-05-13T20:00:00Z,3125,9389,142943,142943,142943,09,84,0,3997,522,4519
20200513,DC,6584,25074,,423,,,,82,,934,A,5/12/2020 00:00,60a5a8205ad106c17df8430de9ec79ec988d13bc,2020-05-13T20:00:00Z,350,,31658,31658,31658,11,14,0,509,99,608
20200513,DE,6952,27801,,282,,,,,,2942,B,5/12/2020 18:00,89c3aa7e781ac9d58f5f1bae6a307c1afc5097aa,2020-05-13T20:00:00Z,247,,34753,34753,34753,10,10,0,1251,211,1462
20200513,FL,42402,552361,1191,,7835,,,,,,A+,5/13/2020 09:43,7766681d762a4c3ecce27b7599fcdb5298c6c7c3,2020-05-13T20:00:00Z,1898,7835,595954,594763,594763,12,49,181,14680,479,15159
20200513,GA,35332,238572,,,6259,,1494,,,,A+,5/13/2020 13:25,426dc2758151720472ddd5b9db4bd03d4e94f0b0,2020-05-13T20:00:00Z,1505,6259,273904,273904,273904,13,44,129,11028,697,11725
20200513,GU,152,4110,,,,,,,,124,C,5/13/2020 07:55,4a7dfbff7cef9bb628d4da02e7880c1ec1ed8d30,2020-05-13T20:00:00Z,5,,4262,4262,4262,66,0,0,171,0,171
20200513,HI,635,37730,,,81,,,,,563,B,5/12/2020 18:00,26416e0e81e32454f332ba7a2462f08be63995b3,2020-05-13T20:00:00Z,17,81,38365,38365,38365,15,0,0,425,1,426
20200513,IA,13289,72430,,388,,133,,101,,5954,A+,5/12/2020 00:00,7078aec8259446a6b063280cf2da9b2ed255b4ce,2020-05-13T20:00:00Z,306,,85719,85719,85719,19,17,0,4054,377,4431
20200513,ID,2293,30835,,,214,,88,,,1536,B,5/12/2020 19:00,3bf18933be28c366ecce611428a9a73197f586cb,2020-05-13T20:00:00Z,69,214,33128,33128,33128,16,-1,4,390,33,423
20200513,IL,84698,404661,,4563,,1208,,714,,,A,5/13/2020 00:00,850a3d380e16b1a41147bdf42cad86804414204a,2020-05-13T20:00:00Z,3792,,489359,489359,489359,17,191,0,15991,1677,17668
20200513,IN,25473,128610,,1336,4389,481,990,217,,,A+,5/12/2020 23:59,571f1446b987b3bcd5bb0e77dfa164f4f65b7c47,2020-05-13T20:00:00Z,1619,4389,154083,154083,154083,18,41,0,3227,346,3573
20200513,KS,7468,50160,,,704,,238,,108,422,A,5/13/2020 10:00,60f9cb70675f6aa8680647af9392458ed8400983,2020-05-13T20:00:00Z,164,704,57628,57628,57628,20,6,44,3167,352,3519
20200513,KY,6853,103781,,379,1825,215,783,,,2546,A+,5/12/2020 17:00,e62d39fb90ce7f21c28c982cb8b93123839ad7b3,2020-05-13T20:00:00Z,321,1825,110634,110634,110634,21,10,58,6434,176,6610
20200513,LA,32662,205242,,1194,,,,147,,22608,B,5/13/2020 13:00,0f10a4ca63459290d22c161e545e63eaca3a62d4,2020-05-13T20:00:00Z,2381,,237904,237904,237904,22,34,0,9280,612,9892
20200513,MA,80497,329535,,3101,8032,794,,,,,A+,5/13/2020 10:00,0361f85391c9351ec6cd8a1a6679b819bba00927,2020-05-13T20:00:00Z,5315,8032,410032,410032,410032,25,174,190,7371,1165,8536
20200513,MD,34812,138762,,1550,6404,572,,,,2456,,5/13/2020 10:00,f9cc0944f478cc08e0e95735b65e1cef089c6deb,2020-05-13T20:00:00Z,1809,6404,173574,173574,173574,24,53,117,3320,751,4071
20200513,ME,1515,22092,,41,204,20,,7,,943,B,5/13/2020 12:30,20cebe6a0dde50f21335799472837100f364019c,2020-05-13T20:00:00Z,66,204,23607,23607,23607,23,1,2,0,38,38
20200513,MI,48391,259869,,1384,,693,,525,,22686,A+,5/13/2020 11:00,8c362386bb61b44481f31cefb3e2fb6a6607884a,2020-05-13T20:00:00Z,4714,,308260,308260,308260,26,40,0,0,370,370
20200513,MN,12917,109118,,494,1851,199,647,,,8149,A+,5/12/2020 17:00,cb2b7b13c5966374bc33f734f8cf46a79339ad71,2020-05-13T20:00:00Z,638,1851,122035,122035,122035,27,24,52,778,423,1201
20200513,MO,10142,114000,,771,,,,129,,,B,5/13/2020 15:00,2a5d4cdbefd6105fb82708c9457a7883d72e52d6,2020-05-13T20:00:00Z,542,,124142,124142,124142,29,18,0,2710,136,2846
20200513,MP,19,3021,,,,,,,,12,D,5/13/2020 00:00,928c81f38edb611befb506b92974b588a3693a02,2020-05-13T20:00:00Z,2,,3040,3040,3040,69,0,0,167,0,167
20200513,MS,10090,89958,,604,1616,150,,79,,6268,A,5/12/2020 19:00,5694ba1eb7d050ab826606ab2f4fcaeb33d28ca1,2020-05-13T20:00:00Z,465,1616,100048,100048,100048,28,8,34,2174,182,2356
20200513,MT,462,23390,,3,63,,,,,430,B,5/13/2020 00:00,361e8774d1eb2ee74016227b7b2c8e1aa970c248,2020-05-13T20:00:00Z,16,63,23852,23852,23852,30,0,0,816,1,817
20200513,NC,15816,194641,,521,,,,,,9115,A,5/13/2020 10:40,f2c7adc6470979e3d0020cdec2a2c65ad8ae8958,2020-05-13T20:00:00Z,597,,210457,210457,210457,37,20,0,7743,470,8213
20200513,ND,1647,47298,,37,127,,,,,969,C,5/13/2020 13:00,318a9e66fa74eb4f693061ca3eee2b00fa2f8025,2020-05-13T20:00:00Z,40,127,48945,48945,48945,38,2,5,1037,76,1113
20200513,NE,8692,41033,,192,,81,,56,,,B,5/12/2020 20:00,03d5496c5e3e98969ecdb244cab1cd95b25900c0,2020-05-13T20:00:00Z,103,,49725,49725,49725,31,3,0,1662,120,1782
20200513,NH,3239,33977,51,121,319,,97,,,1234,B,5/12/2020 09:00,bd2864c1732c7c51efa2c636d5a748767e45ba3b,2020-05-13T20:00:00Z,142,319,37267,37216,37216,33,9,1,1576,79,1655
20200513,NJ,141560,299890,,4226,,1226,,928,,15642,A+,5/13/2020 13:00,f080f7b1131f2cd1e51e3984e7275eafd2fbf137,2020-05-13T20:00:00Z,9702,,441450,441450,441450,34,194,0,7573,817,8390
20200513,NM,5212,105077,,199,886,,,,,1434,C,5/12/2020 18:05,cc555962aec1775c9b2aa39e2ea20c8d360ca464,2020-05-13T20:00:00Z,219,886,110289,110289,110289,35,11,0,3425,143,3568
20200513,NV,6394,60278,,522,,121,,64,,198,B,5/13/2020 12:30,f46eef093bc1eeb5fb3866f8105008601d5bb001,2020-05-13T20:00:00Z,321,,66672,66672,66672,32,9,0,2514,83,2597
20200513,NY,340661,918246,,6946,73963,2308,,1908,,59193,A,5/13/2020 00:00,1d5851bab770a5879020e77f52e0b97326cdb80b,2020-05-13T20:00:00Z,22013,73963,1258907,1258907,1258907,36,168,820,31618,2176,33794
20200513,OH,25721,200133,,924,4618,353,1248,244,,,B,5/13/2020 14:00,1321d9f890ba99e305ca496b34de3698619412e9,2020-05-13T20:00:00Z,1483,4618,225854,225854,225854,39,47,79,7652,471,8123
20200513,OK,4852,104275,,218,848,93,,,,3559,A+,5/13/2020 00:00,b3ffbb4664ecaafea7c4d541c9a67a2de68fb08b,2020-05-13T20:00:00Z,278,848,109127,109127,109127,40,0,20,12896,120,13016
20200513,OR,3416,80571,,162,678,38,,17,,1406,A+,5/13/2020 11:00,438a05f6bb0140dd606b5e9ee9a7700f234b29c4,2020-05-13T20:00:00Z,134,678,83987,83987,83987,41,4,5,6251,130,6381
20200513,PA,58698,244171,,2012,,,,473,,,C,5/13/2020 00:00,43c50f8a017e6821f22efc238e2b98387fe5b6e7,2020-05-13T20:00:00Z,3943,,302869,302869,302869,42,137,0,6182,707,6889
20200513,PR,2329,,,,,10,,6,,,C,5/12/2020 06:30,57a9745f2eb1affe18e0f04f5260d6b9dbaa5fbc,2020-05-13T20:00:00Z,115,,2329,2329,2329,72,1,0,0,30,30
20200513,RI,11835,86087,,269,1328,68,,48,,886,A+,5/13/2020 12:00,93ba1f99e544c799306fd6357827f5258cd40afd,2020-05-13T20:00:00Z,462,1328,97922,97922,97922,44,18,21,2462,221,2683
20200513,SC,7927,85213,,,1338,,,,,6817,A,5/12/2020 16:14,70f6e29cf342781052323ec4f1b865022490ea78,2020-05-13T20:00:00Z,355,1338,93140,93140,93140,45,0,0,0,0,0
20200513,SD,3732,22112,,79,281,,,,,2367,B,5/13/2020 11:30,2aaa32c067f9470c0024e7f98385d39217d55398,2020-05-13T20:00:00Z,39,281,25844,25844,25844,46,0,10,578,69,647
20200513,TN,16370,276547,,,1388,,,,,8624,A,5/13/2020 15:00,ebaedd06baf811ad7f323b6813a59ea7d61735bb,2020-05-13T20:00:00Z,273,1388,292917,292917,292917,47,8,25,8834,259,9093
20200513,TX,42403,545028,,1676,,,,,,23519,A,5/13/2020 16:20,d6fd6ce0459ae48915e4bfeb01cdc78679da1777,2020-05-13T20:00:00Z,1158,,587431,587431,587431,48,25,0,47904,1355,49259
20200513,UT,6620,150166,,158,553,,182,,81,3406,B,5/13/2020 15:00,c96cabfeb092c582c0c85316242bda57bff1b78b,2020-05-13T20:00:00Z,75,553,156786,156786,156786,49,2,18,3113,188,3301
20200513,VA,26746,134646,485,1526,5080,374,,202,,3554,A+,5/12/2020 17:00,563149eb30c1da27c4136ef18ff4863d26a8d4a2,2020-05-13T20:00:00Z,927,5080,161877,161392,161392,51,36,151,5117,946,6063
20200513,VI,69,1128,62,,,,,,,61,C,5/12/2020 18:22,71b6080224de80acc7690e1b487e0ae3b5df3fd8,2020-05-13T20:00:00Z,6,,1259,1197,1197,78,0,0,13,0,13
20200513,VT,929,20747,,17,,,,,,789,B,5/13/2020 00:00,13cda773971c73a07880da558c1da75f083fdca0,2020-05-13T20:00:00Z,53,,21676,21676,21676,50,0,0,412,2,414
20200513,WA,18200,259677,,384,,114,,,,,A,5/13/2020 00:00,7441ac29f412b614a7ec3979286948ecf736d523,2020-05-13T20:00:00Z,962,,277877,277877,277877,53,17,0,5868,267,6135
20200513,WI,10902,117111,194,527,1908,110,469,,,5673,A+,5/13/2020 00:00,de4d8a420d2a38d3221e26646d14ac0b3b301ba5,2020-05-13T20:00:00Z,421,1908,128207,128013,128013,55,3,31,4363,291,4654
20200513,WV,1398,65282,,58,,11,,6,,813,B,5/13/2020 10:00,cdbda082a3958ef1d0728802889e7e30636f86cb,2020-05-13T20:00:00Z,58,,66680,66680,66680,54,1,0,1584,27,1611
20200513,WY,675,14384,,10,67,,,,,477,B,5/12/2020 15:50,fc0baf8b80b394019ff6c64f6f3b59f9c5daf0b0,2020-05-13T20:00:00Z,7,67,15059,15059,15059,56,0,0,0,0,0
20200512,AK,383,29578,,10,,,,,,334,B,5/12/2020 00:00,ad64932142ec53f8eee1158369c6db3eb643ceed,2020-05-12T20:00:00Z,10,,29961,29961,29961,02,0,0,1279,2,1281
20200512,AL,10310,122908,,,1287,,468,,280,,B,5/12/2020 00:00,dc0d90e43e92b36fb107e2ec174f64c4e91412e9,2020-05-12T20:00:00Z,429,1287,133218,133218,133218,01,28,31,3473,301,3774
20200512,AR,4164,66280,,59,485,,,12,98,3220,A,5/11/2020 18:55,c6b2b29faaf304a3e36270f55c766b0fc9773bc2,2020-05-12T20:00:00Z,95,485,70444,70444,70444,05,1,5,1284,130,1414
20200512,AS,0,105,,,,,,,,,C,5/10/2020 00:00,92e4d4fafe1a2e9955e7a0bac38789993d7da480,2020-05-12T20:00:00Z,0,,105,105,105,60,0,0,0,0,0
20200512,AZ,11736,111106,,765,1564,318,,204,,2909,A+,5/12/2020 00:00,e1f3e3aa6e1b798039369c830077e7267e4a6cde,2020-05-12T20:00:00Z,562,1564,122842,122842,122842,04,20,27,6022,356,6378
20200512,CA,69382,963988,,4544,,1349,,,,,B,5/12/2020 00:00,1c3c812803c41f5b0c75e07b15a8a4428e7d662f,2020-05-12T20:00:00Z,2847,,1033370,1033370,1033370,06,77,0,40030,1443,41473
20200512,CO,19879,88778,,738,3663,,,,,3114,A,5/10/2020 00:00,141998ef5f6d8315b29a660425fd4378eef65180,2020-05-12T20:00:00Z,987,3663,108657,108657,108657,08,6,-26,-113,-20,-133
20200512,CT,34333,104091,,1189,9389,,,,,5413,B,5/12/2020 14:00,94125cc6367af615dfdf3201a4acadd5160e7787,2020-05-12T20:00:00Z,3041,9389,138424,138424,138424,09,33,0,5348,568,5916
20200512,DC,6485,24565,,416,,,,82,,886,A,5/11/2020 00:00,9437f63c6fb36500cb3681a8b3667804ea58935d,2020-05-12T20:00:00Z,336,,31050,31050,31050,11,8,0,693,96,789
20200512,DE,6741,26550,,276,,,,,,2802,B,5/11/2020 18:00,aae09df87e288b5d98307ab1d05ee660312b75ef,2020-05-12T20:00:00Z,237,,33291,33291,33291,10,12,0,1187,176,1363
20200512,FL,41923,537681,1064,,7654,,,,,,A+,5/12/2020 09:28,c095dad326b6e29d6cdc568a6f8b53a910be8121,2020-05-12T20:00:00Z,1849,7654,580668,579604,579604,12,44,196,17606,941,18547
20200512,GA,34635,227544,,,6130,,1443,,,,A+,5/11/2020 13:00,b0656969e39a973d0cb2d4fdbf46bac5ffc9f638,2020-05-12T20:00:00Z,1461,6130,262179,262179,262179,13,20,115,10183,708,10891
20200512,GU,152,3939,,,,,,,,124,C,5/11/2020 18:00,b07de06424b91c7563ec1fd794d01ec27c2988d9,2020-05-12T20:00:00Z,5,,4091,4091,4091,66,0,0,101,1,102
20200512,HI,634,37305,,,81,,,,,561,B,5/11/2020 18:00,4c15f93f1f310f449317b691c7504e27d4b0a992,2020-05-12T20:00:00Z,17,81,37939,37939,37939,15,0,0,254,2,256
20200512,IA,12912,68376,,385,,143,,101,,5618,A+,5/12/2020 00:00,851003bc001f9d3c6070b7a0744f75232b70cfef,2020-05-12T20:00:00Z,289,,81288,81288,81288,19,18,0,2957,539,3496
20200512,ID,2260,30445,,,210,,87,,,1508,B,5/11/2020 19:00,cdfbbe6e13eb9a49d4af2261bc1c8e26d78e13a9,2020-05-12T20:00:00Z,70,210,32705,32705,32705,16,3,3,533,30,563
20200512,IL,83021,388670,,4626,,1215,,730,,,A,5/12/2020 00:00,7eeee0fea9bfea9b5d442150defcb14e725265a0,2020-05-12T20:00:00Z,3601,,471691,471691,471691,17,142,0,25252,4014,29266
20200512,IN,25127,125383,,1283,4389,472,,212,,,A+,5/11/2020 23:59,ec63c274fb44ab277a9da75afd8d13931ce0bd12,2020-05-12T20:00:00Z,1578,4389,150510,150510,150510,18,38,0,3322,500,3822
20200512,KS,7116,46993,,,660,,233,,101,376,A,5/11/2020 10:00,e4e4b08f70f7483e20e2d1ab1e8a88a904c403de,2020-05-12T20:00:00Z,158,660,54109,54109,54109,20,0,0,0,0,0
20200512,KY,6677,97347,,383,1767,220,768,,,2335,A+,5/11/2020 17:00,49f080fd95b649d6f35a2acacf5d6189f063f556,2020-05-12T20:00:00Z,311,1767,104024,104024,104024,21,7,10,16864,237,17101
20200512,LA,32050,195962,,1320,,,,146,,22608,B,5/12/2020 13:00,725798364fbd1d9d469c7f8d7a9f48c9d6dc5826,2020-05-12T20:00:00Z,2347,,228012,228012,228012,22,39,0,6947,235,7182
20200512,MA,79332,322164,,3127,7842,818,,,,,A+,5/12/2020 10:00,c0ec660677afe7ab283ad8476d692eac9ab0c5c5,2020-05-12T20:00:00Z,5141,7842,401496,401496,401496,25,33,110,5898,870,6768
20200512,MD,34061,135442,,1563,6287,590,,,,2394,,5/12/2020 10:00,1b2bdc997453e056cd3567e9331675dee5759225,2020-05-12T20:00:00Z,1756,6287,169503,169503,169503,24,73,104,4035,688,4723
20200512,ME,1477,22092,,34,202,17,,8,,913,B,5/12/2020 12:30,8d555f344de837c9297183826a631604f9095d84,2020-05-12T20:00:00Z,65,202,23569,23569,23569,23,0,2,0,15,15
20200512,MI,48021,259869,,1384,,693,,525,,22686,A+,5/12/2020 11:00,f89a13701a2f7ee5383d462bde185e0e48ce1c94,2020-05-12T20:00:00Z,4674,,307890,307890,307890,26,90,0,8473,469,8942
20200512,MN,12494,108340,,496,1799,199,625,,,7609,A,5/11/2020 17:00,94e73ef963e7f3b480431b17800b26277fe73864,2020-05-12T20:00:00Z,614,1799,120834,120834,120834,27,23,83,4358,695,5053
20200512,MO,10006,111290,,787,,,,140,,,B,5/12/2020 15:00,a0b380a66f7e018682c96854e0dc4ebd6529dba4,2020-05-12T20:00:00Z,524,,121296,121296,121296,29,36,0,5588,88,5676
20200512,MP,19,2854,,,,,,,,12,D,5/12/2020 00:00,de6e7a04c4dcd1ab903b996dfb4990a2a9981bba,2020-05-12T20:00:00Z,2,,2873,2873,2873,69,0,0,178,0,178
20200512,MS,9908,87784,,604,1582,146,,75,,6268,A,5/11/2020 19:00,c2ad322a2ca23780c0423744f1c8d342b86e2cde,2020-05-12T20:00:00Z,457,1582,97692,97692,97692,28,22,36,1573,234,1807
20200512,MT,461,22574,,4,63,,,,,425,B,5/12/2020 00:00,2b3dc441154f5955223ec8be3d6b25315ae87038,2020-05-12T20:00:00Z,16,63,23035,23035,23035,30,0,1,461,2,463
20200512,NC,15346,186898,,475,,,,,,9115,A,5/12/2020 11:00,99811235d4384d8dc44fb9b020be9a445fca0410,2020-05-12T20:00:00Z,577,,202244,202244,202244,37,27,0,6078,301,6379
20200512,ND,1571,46261,,38,122,,,,,877,C,5/12/2020 12:10,6439186903c6409dca9c56820e62dc85e6ab838e,2020-05-12T20:00:00Z,38,122,47832,47832,47832,38,2,7,765,53,818
20200512,NE,8572,39371,,192,,81,,56,,,B,5/11/2020 20:05,82de0819c060549c93f72549b792b5de897151e2,2020-05-12T20:00:00Z,100,,47943,47943,47943,31,2,0,1447,257,1704
20200512,NH,3160,32401,54,117,318,,97,,,1231,B,5/11/2020 09:00,4ea2337b6353839aa3392a0949b5de5037f18200,2020-05-12T20:00:00Z,133,318,35615,35561,35561,33,0,0,678,0,678
20200512,NJ,140743,292317,,4328,,1306,,982,,15642,A+,5/12/2020 13:00,a551c9bb3078185c8537e653e9855a75e1844e2f,2020-05-12T20:00:00Z,9508,,433060,433060,433060,34,198,0,6329,798,7127
20200512,NM,5069,101652,,207,886,,,,,1300,C,5/11/2020 22:33,6d7039f5d1bc3661cde6775cc8c8f54088ec2a2b,2020-05-12T20:00:00Z,208,886,106721,106721,106721,35,8,97,4017,206,4223
20200512,NV,6311,57764,,522,,121,,64,,185,C,5/12/2020 12:30,a1ac2e2156586d3396c44f016461670c4d570e8e,2020-05-12T20:00:00Z,312,,64075,64075,64075,32,6,0,3832,159,3991
20200512,NY,338485,886628,,7063,73143,2375,,1964,,58679,A,5/12/2020 00:00,557195b2b5a5899f0b86cf3d014ed6a5b11dd26a,2020-05-12T20:00:00Z,21845,73143,1225113,1225113,1225113,36,205,0,19032,1430,20462
20200512,OH,25250,192481,,1032,4539,401,1232,270,,,B,5/12/2020 14:00,de8d2b78e3adb0f6a856466164f7abbfe651e297,2020-05-12T20:00:00Z,1436,4539,217731,217731,217731,39,79,126,6728,473,7201
20200512,OK,4732,91379,,190,828,83,,,,3423,A+,5/12/2020 00:00,ab5d94f248233e426e55e603e11be5d53cb0fc1d,2020-05-12T20:00:00Z,278,828,96111,96111,96111,40,4,0,0,119,119
20200512,OR,3286,74320,,165,673,39,,25,,1125,A+,5/12/2020 11:52,2d615f054ea8e40981ad1c1119401e4cfae83193,2020-05-12T20:00:00Z,130,673,77606,77606,77606,41,0,0,0,0,0
20200512,PA,57991,237989,,2187,,,,497,,,C,5/12/2020 12:00,fa3ba6d4689c14fb4158f6072afa997b7d6078e3,2020-05-12T20:00:00Z,3806,,295980,295980,295980,42,75,0,6285,837,7122
20200512,PR,2299,,,,,,,,,,C,5/12/2020 06:30,dd849b252fa9866c8bba2f82baae46c6f552e95d,2020-05-12T20:00:00Z,114,,2299,2299,2299,72,1,0,0,43,43
20200512,RI,11614,83625,,277,1307,72,,53,,863,A+,5/12/2020 12:00,0b3efb331e4b384182d3a043259392a9b43e03e5,2020-05-12T20:00:00Z,444,1307,95239,95239,95239,44,14,27,1743,164,1907
20200512,SC,7927,85213,,,1338,,,,,6817,A,5/12/2020 16:14,d9ad2effd29087d5acdaddd770ddf5116ff02f21,2020-05-12T20:00:00Z,355,1338,93140,93140,93140,45,24,86,8409,274,8683
20200512,SD,3663,21534,,74,271,,,,,2309,B,5/12/2020 11:30,398b44ebe956f8b3706040627f7a9fbc550424f1,2020-05-12T20:00:00Z,39,271,25197,25197,25197,46,5,8,570,49,619
20200512,TN,16111,267713,,,1363,,,,,8336,A,5/12/2020 16:00,b54071de6f6bdd53a83161c3100769996827243e,2020-05-12T20:00:00Z,265,1363,283824,283824,283824,47,14,19,9980,567,10547
20200512,TX,41048,497124,,1725,,,,,,22674,A,5/11/2020 16:25,11b70727dc1782af8dae590db1e184305ba794d7,2020-05-12T20:00:00Z,1133,,538172,538172,538172,48,33,0,11296,1179,12475
20200512,UT,6432,147053,,166,535,,178,,80,3267,B,5/12/2020 15:00,529a080f15d8f439a8f5d45ba54214b08fd1cdbc,2020-05-12T20:00:00Z,73,535,153485,153485,153485,49,5,18,2830,70,2900
20200512,VA,25800,129529,447,1529,4929,364,,201,,3400,A+,5/12/2020 09:00,45d4f6b36abd4c2c07613461218de47ff5c0c389,2020-05-12T20:00:00Z,891,4929,155776,155329,155329,51,41,152,3982,730,4712
20200512,VI,69,1115,58,,,,,,,61,C,5/12/2020 14:19,866582e0254dc6dd9d7793bd722ba6661a15affc,2020-05-12T20:00:00Z,6,,1242,1184,1184,78,1,0,5,0,5
20200512,VT,927,20335,,18,,,,,,787,B,5/12/2020 00:00,753bba5966252600f220802d111cf2b2235eb5e0,2020-05-12T20:00:00Z,53,,21262,21262,21262,50,0,0,390,1,391
20200512,WA,17933,253809,,321,,94,,,,,A,5/12/2020 00:00,40e6f9ed325f9253ba3a680d03f5b895899b581d,2020-05-12T20:00:00Z,945,,271742,271742,271742,53,14,0,5803,236,6039
20200512,WI,10611,112748,180,520,1877,116,464,,,5371,A+,5/12/2020 12:23,0f63f7dde4112e772bcdfc22930c6a3f586ed906,2020-05-12T20:00:00Z,418,1877,123539,123359,123359,55,9,31,4715,193,4908
20200512,WV,1371,63698,,50,,9,,5,,803,C,5/12/2020 10:00,f37078141cf9d5c1e30b4386d7cb47825c2621bd,2020-05-12T20:00:00Z,57,,65069,65069,65069,54,3,0,1595,5,1600
20200512,WY,675,14384,,10,67,,,,,477,B,5/12/2020 15:50,edb8d27bf5882660de5e5b0543f7624c2b51f9d2,2020-05-12T20:00:00Z,7,67,15059,15059,15059,56,0,1,2981,13,2994
20200511,AK,381,28299,,7,,,,,,328,C,5/11/2020 00:00,a7223546ea51f5c1f4befbca92cbba972c4254a3,2020-05-11T20:00:00Z,10,,28680,28680,28680,02,0,0,1314,2,1316
20200511,AL,10009,119435,,,1256,,463,,276,,B,5/11/2020 00:00,7a458a485ba87dec00819901d27fc50e4fbfdb01,2020-05-11T20:00:00Z,401,1256,129444,129444,129444,01,8,16,1791,232,2023
20200511,AR,4034,64996,,61,480,,,11,98,3149,A,5/10/2020 19:05,dbe584b0f033faf71ab1255e32755841c0161597,2020-05-11T20:00:00Z,94,480,69030,69030,69030,05,6,9,3215,287,3502
20200511,AS,0,105,,,,,,,,,D,5/10/2020 00:00,9b5ed3d398c7403c615f2cb9e18aff10510c6d39,2020-05-11T20:00:00Z,0,,105,105,105,60,0,0,22,0,22
20200511,AZ,11380,105084,,717,1537,297,,201,,2852,A+,5/11/2020 00:00,afa17a1ea8cc6e6a5c171643105c247148ac1517,2020-05-11T20:00:00Z,542,1537,116464,116464,116464,04,6,9,5826,261,6087
20200511,CA,67939,923958,,4549,,1329,,,,,B,5/11/2020 00:00,53613cacac307d4a734c079025735a0eec798c35,2020-05-11T20:00:00Z,2770,,991897,991897,991897,06,25,0,34974,1259,36233
20200511,CO,19899,88891,,573,3689,,,,,3076,B,5/9/2020 00:00,d264f761689eb0a1f19c6dd11a87d98c9aa6ea95,2020-05-11T20:00:00Z,981,3689,108790,108790,108790,08,14,66,7656,524,8180
20200511,CT,33765,98743,,1212,9389,,,,,5413,B,5/11/2020 14:00,725f98630b953261d0e361ea3ce240eb58dd87a5,2020-05-11T20:00:00Z,3008,9389,132508,132508,132508,09,41,0,2105,211,2316
20200511,DC,6389,23872,,416,,,,82,,881,A,5/10/2020 00:00,96823a86d077b838aa718a491d8ad8e667579778,2020-05-11T20:00:00Z,328,,30261,30261,30261,11,5,0,574,117,691
20200511,DE,6565,25363,,275,,,,,,2619,B,5/10/2020 18:00,b495a3c92d603717fcb0e0353a8b46934f687d7a,2020-05-11T20:00:00Z,225,,31928,31928,31928,10,1,0,771,118,889
20200511,FL,40982,520075,1080,,7458,,,,,,B,5/11/2020 09:31,41a0c5448dd172e1de13ee660933da7aca6920e0,2020-05-11T20:00:00Z,1805,7458,562137,561057,561057,12,14,54,21723,386,22109
20200511,GA,33927,217361,,,6015,,1414,,,,A,5/11/2020 13:00,36622751034808e79ec4a2f2a0e717a7238d62c4,2020-05-11T20:00:00Z,1441,6015,251288,251288,251288,13,36,18,7255,486,7741
20200511,GU,151,3838,,,,,,,,124,C,5/11/2020 06:45,344915c252ec72e2897d08cedf0096c076238394,2020-05-11T20:00:00Z,5,,3989,3989,3989,66,0,0,195,0,195
20200511,HI,632,37051,,,81,,,,,561,B,5/10/2020 18:00,c1a3fdf904f506a49beb3904919cfb214d1056b1,2020-05-11T20:00:00Z,17,81,37683,37683,37683,15,0,0,412,1,413
20200511,IA,12373,65419,,394,,152,,107,,5249,A+,5/11/2020 00:00,6dc1fea55734472dff46f44afd605f1af78a08de,2020-05-11T20:00:00Z,271,,77792,77792,77792,19,6,0,3204,414,3618
20200511,ID,2230,29912,,,207,,87,,,1473,B,5/9/2020 19:00,320a48fe6833d123bb557c59e853aa6f0948fc96,2020-05-11T20:00:00Z,67,207,32142,32142,32142,16,0,0,0,0,0
20200511,IL,79007,363418,,4319,,1248,,730,,,A,5/11/2020 00:00,f44cdbee224288e9756f9c879b4330cf1a40125a,2020-05-11T20:00:00Z,3459,,442425,442425,442425,17,53,0,11175,1266,12441
20200511,IN,24627,122061,,1346,4389,452,990,213,,,A+,5/10/2020 23:59,a57c95bf26ced24d8dba4841fca0b3ed92f8ddfd,2020-05-11T20:00:00Z,1540,4389,146688,146688,146688,18,32,0,6158,501,6659
20200511,KS,7116,46993,,,660,,233,,101,376,A,5/11/2020 10:00,37cb8fd29d5e89ecc06556f7e2c38e2870d68a69,2020-05-11T20:00:00Z,158,660,54109,54109,54109,20,1,3,1436,168,1604
20200511,KY,6440,80483,,394,1757,226,758,,,2308,A,5/9/2020 17:00,65bd44bbae0cf8f21518a61a2cf25ccc1bd682fc,2020-05-11T20:00:00Z,304,1757,86923,86923,86923,21,0,0,0,0,0
20200511,LA,31815,189015,,1310,,,,157,,22608,B,5/11/2020 13:00,882c80ef83db3a2040f72edd1c0b65c14bcf63be,2020-05-11T20:00:00Z,2308,,220830,220830,220830,22,22,0,4743,215,4958
20200511,MA,78462,316266,,3102,7732,813,,,,,A,5/11/2020 10:00,6e951327a5d89abb820241523b201fdd432bb5e9,2020-05-11T20:00:00Z,5108,7732,394728,394728,394728,25,129,115,5670,669,6339
20200511,MD,33373,131407,,1544,6183,585,,,,2298,,5/11/2020 10:00,18b34eceb38d5a6ff1b85aebb7018b36d8ef661a,2020-05-11T20:00:00Z,1683,6183,164780,164780,164780,24,39,228,4063,786,4849
20200511,ME,1462,22092,,37,200,17,,9,,872,B,5/11/2020 12:00,c25684830089eb770ad7aedc26e6565286ebfbab,2020-05-11T20:00:00Z,65,200,23554,23554,23554,23,1,1,0,26,26
20200511,MI,47552,251396,,1424,,685,,557,,22686,A+,5/11/2020 11:00,a5d0f888a8b221813babc8a27f5015b598c9a9c2,2020-05-11T20:00:00Z,4584,,298948,298948,298948,26,33,0,12856,414,13270
20200511,MN,11799,103982,,452,1716,194,600,,,6945,A,5/10/2020 17:00,ecafaae09dc0d562862664aff3f747447fd8284b,2020-05-11T20:00:00Z,591,1716,115781,115781,115781,27,13,59,4165,528,4693
20200511,MO,9918,105702,,824,,,,137,,,B,5/11/2020 15:00,0a40716dc1fc6b5028e3a0b211783ea46f043cd9,2020-05-11T20:00:00Z,488,,115620,115620,115620,29,6,0,0,74,74
20200511,MP,19,2676,,,,,,,,12,D,5/11/2020 00:00,5083b9724765025f257e7b96c00732bf25063219,2020-05-11T20:00:00Z,2,,2695,2695,2695,69,0,0,355,3,358
20200511,MS,9674,86211,,507,1546,132,,68,,6268,A,5/10/2020 19:00,7b98e0ac888e25cb18aced67458df0e038dbf2cb,2020-05-11T20:00:00Z,435,1546,95885,95885,95885,28,5,15,14110,173,14283
20200511,MT,459,22113,,4,62,,,,,423,C,5/10/2020 00:00,8bbba487e4da82581b0cf57a838d1c0a9b85971f,2020-05-11T20:00:00Z,16,62,22572,22572,22572,30,0,0,867,1,868
20200511,NC,15045,180820,,464,,,,,,9115,B,5/11/2020 14:00,df1be569ae745bfd298a930e35362f09b2dad0c9,2020-05-11T20:00:00Z,550,,195865,195865,195865,37,3,0,3449,281,3730
20200511,ND,1518,45496,,34,115,,,,,846,C,5/11/2020 12:10,0d5f52057ed67028f24db06f823d35bd8a25a4fa,2020-05-11T20:00:00Z,36,115,47014,47014,47014,38,1,5,2118,27,2145
20200511,NE,8315,37924,,,,,,,,,D,5/10/2020 19:45,e58065fd1954d908292eee28a9f7fa0147c1658f,2020-05-11T20:00:00Z,98,,46239,46239,46239,31,2,0,589,81,670
20200511,NH,3160,31723,261,113,318,,97,,,1229,B,5/10/2020 09:00,1e4d21c6c7cb4723f7c568bff5bb5287f0176a6c,2020-05-11T20:00:00Z,133,318,35144,34883,34883,33,2,5,1281,149,1430
20200511,NJ,139945,285988,,4195,,1255,,970,,15642,A+,5/11/2020 13:00,94fa78b2e3195af312b3de2382d6da9df5a34c2d,2020-05-11T20:00:00Z,9310,,425933,425933,425933,34,55,0,112073,1413,113486
20200511,NM,4863,97635,,194,789,,,,,1285,C,5/10/2020 17:50,431ea4a184bf3daa6990f2048eadb3bbffd4e3a3,2020-05-11T20:00:00Z,200,789,102498,102498,102498,35,9,0,5360,85,5445
20200511,NV,6152,53932,,482,,117,,60,,183,C,5/11/2020 13:30,835d3bc0c7cb54e6e40f6e63266d5675959a69a6,2020-05-11T20:00:00Z,306,,60084,60084,60084,32,0,0,1221,54,1275
20200511,NY,337055,867596,,7226,73143,2450,,2020,,58363,A,5/10/2020 00:00,c605cd69fc6d8af2586f5f00c31106bff9a1edd9,2020-05-11T20:00:00Z,21640,73143,1204651,1204651,1204651,36,162,428,19993,1660,21653
20200511,OH,24777,185753,,1011,4413,391,1217,256,,,B,5/11/2020 14:00,cdf49b3d1bbbb6ee921c935e2760c07c4064d760,2020-05-11T20:00:00Z,1357,4413,210530,210530,210530,39,16,62,4972,696,5668
20200511,OK,4613,91379,,177,828,93,,,,3241,A+,5/11/2020 00:00,04935b380656454e2afe3546d5ca7532a81d5efa,2020-05-11T20:00:00Z,274,828,95992,95992,95992,40,2,2,0,24,24
20200511,OR,3286,74320,,164,673,40,,23,,1125,A+,5/11/2020 11:00,04658e44200d2f00f1f31ece71de204266d1e870,2020-05-11T20:00:00Z,130,673,77606,77606,77606,41,3,3,2041,58,2099
20200511,PA,57154,231704,,2176,,,,497,,,C,5/11/2020 00:00,76cf6b30b46ddf22c8cd3d091eea7ae6fde2279b,2020-05-11T20:00:00Z,3731,,288858,288858,288858,42,24,0,3932,543,4475
20200511,PR,2256,,,,,,,,,,D,5/11/2020 05:57,c241a9b6b383c2725aa95666ccfb34e74c9bf690,2020-05-11T20:00:00Z,113,,2256,2256,2256,72,2,0,0,58,58
20200511,RI,11450,81882,,276,1280,73,,52,,841,A+,5/11/2020 12:00,5d97783cd28918685ef4cd8e2b2a4452ced74fc9,2020-05-11T20:00:00Z,430,1280,93332,93332,93332,44,8,29,1943,176,2119
20200511,SC,7653,76804,,,1252,,,,,4120,B,5/10/2020 16:30,5f9e0d3a2ec058ef8d95dd9bf20de96334069a78,2020-05-11T20:00:00Z,331,1252,84457,84457,84457,45,0,0,0,0,0
20200511,SD,3614,20964,,78,263,,,,,2187,C,5/10/2020 18:00,ad203958ee06caa056610e78ffd6ed44dbf5bdea,2020-05-11T20:00:00Z,34,263,24578,24578,24578,46,0,2,587,97,684
20200511,TN,15544,257733,,,1344,,,,,8038,B,5/11/2020 15:00,c4c07a966a9529ae7ebf4274e5f2f04c52e4cfd7,2020-05-11T20:00:00Z,251,1344,273277,273277,273277,47,8,19,10849,559,11408
20200511,TX,39869,485828,,1525,,,,,,21713,B,5/10/2020 16:35,14400b4f7e9ed0cdc8479e35757aa0364baa0578,2020-05-11T20:00:00Z,1100,,525697,525697,525697,48,12,0,22921,1000,23921
20200511,UT,6362,144223,,160,517,,169,,76,3181,B,5/11/2020 15:00,fd0ee60a58a8dba6346a766037e5c849819ee5c8,2020-05-11T20:00:00Z,68,517,150585,150585,150585,49,1,5,3964,111,4075
20200511,VA,25070,125547,432,1504,4777,362,,194,,3273,A+,5/10/2020 17:00,8959bbe05f63848e746dc5bf369ff728539bb0e5,2020-05-11T20:00:00Z,850,4777,151049,150617,150617,51,11,21,6573,989,7562
20200511,VI,69,1110,36,,,,,,,60,C,5/11/2020 09:30,bdb309ceed93be561945a50c86d6472695a67e4b,2020-05-11T20:00:00Z,5,,1215,1179,1179,78,1,0,8,0,8
20200511,VT,926,19945,,14,,,,,,785,B,5/11/2020 00:00,27e58b21612cac37070adf11719309579c80e62a,2020-05-11T20:00:00Z,53,,20871,20871,20871,50,0,0,824,-1,823
20200511,WA,17697,248006,,350,,110,,,,,B,5/11/2020 00:00,2aef4d5ce2bddb0cb17fcfc57eed6107759ab256,2020-05-11T20:00:00Z,931,,265703,265703,265703,53,10,0,5602,281,5883
20200511,WI,10418,108033,180,520,1846,116,460,,,5176,A+,5/11/2020 00:00,633ecbf7b293489344a345f2d9e75dd82a7ed049,2020-05-11T20:00:00Z,409,1846,118631,118451,118451,55,9,26,2870,199,3069
20200511,WV,1366,62103,,49,,10,,6,,775,C,5/11/2020 10:00,bed0929e916b8748d922f830ff1fb1496a4d66d3,2020-05-11T20:00:00Z,54,,63469,63469,63469,54,0,0,819,6,825
20200511,WY,662,11403,,12,66,,,,,443,C,5/10/2020 17:38,c83025544ba417d05dd8af280986c4f1014532fd,2020-05-11T20:00:00Z,7,66,12065,12065,12065,56,0,1,0,1,1
20200510,AK,379,26985,,8,,,,,,324,C,5/10/2020 14:00,c326467537b8aa4035125d086454fe043009b85a,2020-05-10T20:00:00Z,10,,27364,27364,27364,02,0,0,914,1,915
20200510,AL,9777,117644,,,1240,,460,,274,,B,5/10/2020 00:00,b784245157e15325dbb3d93142f0dd3e69664809,2020-05-10T20:00:00Z,393,1240,127421,127421,127421,01,5,12,1717,210,1927
20200510,AR,3747,61781,,64,471,,,14,96,2968,B,5/10/2020 10:15,38a9c539abfb2c4f9d79d7cf330d67eada846df5,2020-05-10T20:00:00Z,88,471,65528,65528,65528,05,0,0,0,0,0
20200510,AS,0,83,,,,,,,,,D,5/3/2020 00:00,d66ec1502bd760d9b7e029ada9baca3d2c30db82,2020-05-10T20:00:00Z,0,,83,83,83,60,0,0,0,0,0
20200510,AZ,11119,99258,,713,1528,300,,195,,2775,A+,5/10/2020 00:00,287b2d1ba3cf9773d4cee612cbc898f28a3468cc,2020-05-10T20:00:00Z,536,1528,110377,110377,110377,04,4,14,4408,159,4567
20200510,CA,66680,888984,,4555,,1328,,,,,B,5/10/2020 00:00,b618e4b193ed0312e703672e19ebad8c2eb045b9,2020-05-10T20:00:00Z,2745,,955664,955664,955664,06,67,0,40975,2119,43094
20200510,CO,19375,81235,,790,3623,,,,,3023,B,5/8/2020 00:00,f72f58ccf6af1a898150bec8283bf2ce6aa55eaf,2020-05-10T20:00:00Z,967,3623,100610,100610,100610,08,7,23,3290,548,3838
20200510,CT,33554,96638,,1242,9389,,,,,5413,B,5/10/2020 14:00,a4c7c8644339c7b4965da9d6c0785d7457fe871b,2020-05-10T20:00:00Z,2967,9389,130192,130192,130192,09,35,0,6053,570,6623
20200510,DC,6272,23298,,447,,130,,91,,880,A+,5/9/2020 00:00,9ab94b199d79e73252cf8b30ca7cb25d6d2074ee,2020-05-10T20:00:00Z,323,,29570,29570,29570,11,12,0,1217,170,1387
20200510,DE,6447,24592,,285,,,,,,2537,B,5/10/2020 12:03,4a92e6d0367c63db9ab97284439e2a5026f20810,2020-05-10T20:00:00Z,224,,31039,31039,31039,10,3,0,1573,170,1743
20200510,FL,40596,498352,1265,,7404,,,,,,B,5/10/2020 11:52,5fd55763ed688491e61a8ff37692f6c31604dde6,2020-05-10T20:00:00Z,1791,7404,540213,538948,538948,12,6,79,10622,595,11217
20200510,GA,33441,210106,,,5997,,1412,,,,A,5/10/2020 15:25,86f151b7601a5de5d6bd7691bf065a15a90b1286,2020-05-10T20:00:00Z,1405,5997,243547,243547,243547,13,5,10,7314,909,8223
20200510,GU,151,3643,,,,,,,,124,C,5/9/2020 03:50,757ed03d2cb576479b027e5acb6a0cb8fe526263,2020-05-10T20:00:00Z,5,,3794,3794,3794,66,0,0,0,0,0
20200510,HI,631,36639,,,81,,,,,551,B,5/9/2020 18:00,072e29ed5e44933022ac843a0e38baa07b4b6c7a,2020-05-10T20:00:00Z,17,81,37270,37270,37270,15,0,0,1006,2,1008
20200510,IA,11959,62215,,413,,157,,105,,5154,A+,5/10/2020 00:00,924bfb5cb0d7fcd1dae4deea5efeddce43984d4c,2020-05-10T20:00:00Z,265,,74174,74174,74174,19,13,0,2410,288,2698
20200510,ID,2230,29912,,,207,,87,,,1473,B,5/9/2020 19:00,db58dfc95e993ed07a381d837e9ea4db4f3374a7,2020-05-10T20:00:00Z,67,207,32142,32142,32142,16,0,1,311,25,336
20200510,IL,77741,352243,,4293,,1232,,709,,,A,5/10/2020 00:00,4ad02b7be8aa92e1bb30db588bbfa73e13e1109e,2020-05-10T20:00:00Z,3406,,429984,429984,429984,17,57,0,11997,1656,13653
20200510,IN,24126,115903,,1328,4389,462,990,205,,,A+,5/9/2020 23:59,61f42e3076ad88cad0e3b26405c5f0d608837b14,2020-05-10T20:00:00Z,1508,4389,140029,140029,140029,18,18,0,3949,394,4343
20200510,KS,6948,45557,,,657,,231,,101,371,A,5/10/2020 10:00,ba178b544ad80845a654827695bf3827b00dcebe,2020-05-10T20:00:00Z,157,657,52505,52505,52505,20,0,22,2375,197,2572
20200510,KY,6440,80483,,394,1757,226,758,,,2308,A,5/9/2020 17:00,f83a17b5bd4ea2dc5974c49812e17a75bb6559be,2020-05-10T20:00:00Z,304,1757,86923,86923,86923,21,6,61,324,152,476
20200510,LA,31600,184272,,1324,,,,161,,20316,B,5/10/2020 13:00,a7949c9c91fd8ecf8e3c4d85cc8308867da5c044,2020-05-10T20:00:00Z,2286,,215872,215872,215872,22,19,0,3532,183,3715
20200510,MA,77793,310596,,3128,7617,810,,,,,A,5/10/2020 10:00,9576e492f559b32690054f3fa3411e2be1cca071,2020-05-10T20:00:00Z,4979,7617,388389,388389,388389,25,139,66,10802,1050,11852
20200510,MD,32587,127344,,1640,5955,611,,,,2293,,5/10/2020 10:00,b7cb3d9e88496eb85ce756d3a094bdad5f916ca0,2020-05-10T20:00:00Z,1644,5955,159931,159931,159931,24,30,23,2850,1053,3903
20200510,ME,1436,22092,,36,199,17,,10,,861,B,5/10/2020 11:30,8461ff8b72c814e211682b26c9e699e173e3ca65,2020-05-10T20:00:00Z,64,199,23528,23528,23528,23,0,1,0,28,28
20200510,MI,47138,238540,,1437,,674,,536,,22686,A+,5/10/2020 11:00,71718f2c1a21e702418aca594f0d9f731b4d6626,2020-05-10T20:00:00Z,4551,,285678,285678,285678,26,25,0,11810,382,12192
20200510,MN,11271,99817,,434,1657,199,581,,,6304,A,5/9/2020 17:00,70cfe68a1823a8bff7ff71f1f3126bffd00a226f,2020-05-10T20:00:00Z,578,1657,111088,111088,111088,27,20,45,4344,481,4825
20200510,MO,9844,105702,,824,,,,137,,,B,5/10/2020 15:00,4d092ef5d6d737c9e01a97f8ca03f88f8e1b773c,2020-05-10T20:00:00Z,482,,115546,115546,115546,29,10,0,6470,178,6648
