state,notes,covid19Site,covid19SiteSecondary,covid19SiteTertiary,twitter,covid19SiteOld,name,fips,pui,pum
AK,"Negatives = (Totals – Positives)
Positives occasionally update before totals do; do not revise negatives down, keep the last calculated negative. 

As of May 16, Alaska reports specimens tested; because some people may be tested more than once, this number may be higher than the number of people tested.

As of July 16, we are reporting adding non-resident cases as part of total case counts for Alaska",http://dhss.alaska.gov/dph/Epi/id/Pages/COVID-19/monitoring.aspx,http://dhss.alaska.gov/dph/Epi/id/Pages/COVID-19/default.aspx,https://alaska-dhss.maps.arcgis.com/apps/opsdashboard/index.html#/8782a14ef52342e99f866a3b8a3e624a,@Alaska_DHSS,http://dhss.alaska.gov/dph/Epi/id/Pages/COVID-19/default.aspx,Alaska,02,,false
AL,"Negatives = (Totals - Positives) 
Positives occasionally update before totals do; do not revise negatives down, keep the last calculated negative.

On July 11, Alabama changed its cumulative hospitalization data source to come directly from hospitals rather than from state case surveillance files. As a result of this new data source, its hospitalizations increased by 3,616 from 3,129 to 6,745.

On July 15 we corrected our reporting of Alabama tests: Alabama reports tests in units of specimens (tests) rather than individuals (people tested). We will correct our historical time series by backfiilling the data as soon as possible. ",https://alpublichealth.maps.arcgis.com/apps/opsdashboard/index.html#/6d2771faa9da4a2786a509d82c8cf0f7,https://dph1.adph.state.al.us/covid-19/,,@alpublichealth,http://www.alabamapublichealth.gov/infectiousdiseases/2019-coronavirus.html,Alabama,01,,false
AR,,https://www.healthy.arkansas.gov/programs-services/topics/novel-coronavirus,https://adem.maps.arcgis.com/apps/opsdashboard/index.html#/f533ac8a8b6040e5896b05b47b17a647,,@adhpio,https://www.healthy.arkansas.gov/programs-services/topics/novel-coronavirus,Arkansas,05,,false
AS,"American Samoa does not have a regularly updated data source. We monitor American Samoa's social media, emergency declarations, and local media for updates.

On July 1, American Samoa reported on its Facebook page that it had acquired testing machines and kits and had conducted 816 tests all with negative results.",https://www.americansamoa.gov/covid-19-advisories,https://www.facebook.com/amsamgov/,,,http://www.samoagovt.ws/2020/03/ministry-of-health-coronavirus-covid-19-update-14-march-2020/,American Samoa,60,,false
AZ,"Negative = Total - Positive.

As of May 8, Arizona is reporting specimens tested, including both PCR and antibody tests. Because some people may be tested more than once, this number is probably higher than the number of people tested.

On June 23, we updated our historical data for cumulative hospitalization to match Arizona's dashboard hospitalized by date admitted data. This data is not typically reported until several days after admittance. Our daily updates to this value going forward will continue to take Arizona’s overall number as of that day, regardless of date admitted.

On July 18, Arizona’s dashboard stopped displaying the confirmed vs. probable breakdown of cases and deaths with its hover-over feature. We are going to back-fill the breakdown once Arizona provides the historical numbers.

On July 28 and July 29, we noticed that Arizona's Currently Hospitalized statistics decreased slightly while its Cumulative Hospitalized statistics increased significantly. We are unsure of the reason.

On August 5, Arizona's dashboard resumed displaying the confirmed vs. probable breakdown of cases and deaths in the hover-over feature. ",https://www.azdhs.gov/preparedness/epidemiology-disease-control/infectious-disease-epidemiology/covid-19/dashboards/index.php,https://tableau.azdhs.gov/views/Hospitalization/HospitalizedCOVID-19Cases?:embed=y&:showVizHome=no&:host_url=https%3A%2F%2Ftableau.azdhs.gov%2F&:embed_code_version=3&:tabs=no&:toolbar=no&:showAppBanner=false&:display_spinner=no&iframeSizedToWindow=true&:loadOrderID=3,https://tableau.azdhs.gov/views/ExternalEMResourceCOVIDSpecificDashboard/InpatientCOVID-19?:embed=y&:showVizHome=no&:host_url=https%3A%2F%2Ftableau.azdhs.gov%2F&:embed_code_version=3&:tabs=yes&:toolbar=no&:showAppBanner=false&:display_spinner=no&iframeSizedToWindow=true&:loadOrderID=4,@azdhs,https://www.azdhs.gov/preparedness/epidemiology-disease-control/infectious-disease-epidemiology/covid-19/dashboards/index.php,Arizona,04,,false
CA,"Before April 1, California was inconsistent in the timing of reporting so we used faster-updating county sources, we then standardized on the state data dashboard(s). This led to a drop in cases and deaths, as the state's data lags county sources.

The state reported a huge batch of negative tests on April 4 and again on April 22.

As of April 22, California now reports specimens tested instead of people tested. Because some people may be tested more than once, this number is probably higher than the number of people tested.

On July 8, California data included a backlog of data from Los Angeles County, which had not reported for several days. About 1000 of the 11,000 new cases are due to this spike in reporting.

From June 29 to July 5, California made a few revisions to daily case numbers, on July 17 we updated the values based on the most recent data from their dashboard.

Starting July 23, California has reported that its current hospitalization and ICU numbers are incomplete due to its transition to the HHS reporting system. We carried over hospitalization figures until July 28. We will backfill the complete numbers for July 23 - July 28 when reporting is back at 100%",https://update.covid19.ca.gov,https://public.tableau.com/views/COVID-19CasesDashboard_15931020425010/Cases?:embed=y&:showVizHome=no,https://public.tableau.com/views/COVID-19HospitalsDashboard/Hospitals?:embed=y&:showVizHome=no,@CAPublicHealth,https://www.cdph.ca.gov/Programs/CID/DCDC/Pages/Immunization/ncov2019.aspx,California,06,,false
CO,"Negative = People Tested - Cases. Cases include people who test positive for COVID-19 AND people who have symptoms of COVID-19 and are a close contact to someone who tested positive. While Colorado publishes a confirmed/probable breakdown, this breakdown pertains to cases resulting in deaths rather than death certificates with COVID-19 listed as a contributing cause. As such, we do not count from it to maintain consistency with the total deaths figure from death certificates.

As of April 27, Colorado is reporting people tested. 

On June 14, Colorado revised some previous daily discharged number. This caused an overall decline in their recovered count. 

On May 15 (which we caught on our update May 16), Colorado started providing a new figure for deaths where COVID-19 is listed on the death certificate, in addition to the figure it already provided, deaths among laboratory-confirmed and probable cases (whether or not COVID was a cause of death). On July 1, we revised our historical data to reflect the deaths certificate figure instead of the deaths among cases. As such, it appears as if there is a drop from 1091 deaths on May 15 to 878 on May 16 in our data. 

On July 16, Colorado decreased the cumulative hospitalization number by 13.

On July 27, Colorado posted a notice that, ""Due to a server issue yesterday and today with our electronic laboratory reporting system, the number of tests completed and cases reported today, July 27, may be artificially low."" We report Colorado data a day after posting due to timing, so this note applies to the data published on July 28.",https://covid19.colorado.gov/case-data,https://covid19.colorado.gov/covid-19-data,https://covid19.colorado.gov/hospital-data,@cdphe,https://www.colorado.gov/pacific/cdphe/2019-novel-coronavirus,Colorado,08,,false
CT,"Negative = Total - Positive.  
Positives occasionally update before totals do; we do not revise negatives down, keep the last calculated negative.

As of May 24, Connecticut is reporting PCR specimens tested. Because some people may be tested more than once, this number is probably higher than the number of people tested.

On May 27, Connecticut reported they had ""removed 356 cases and 808 tests...which were identified as duplicates in the system."" When combined with actual new cases, these removals resulted in a net reduction of 15 positives on May 27.

As of May 29, CHA changed to only reporting the number of patients with laboratory-confirmed COVID-19; data for previous dates include patients with laboratory-confirmed or suspected COVID-19. This impacts the numbers for cumulative hospitalizations and recoveries.

On June 18, Connecticut reported that ""Please note that 81 new cases were reported in the past 24-hours; 70 previously reported cases were removed from the total counts due to correction of data errors.""

On June 24, Connecticut removed 2770 previously reported tests due to correction of a data error. Negatives decreased as a result.
Starting July 11, Connecticut is longer reporting data on weekends.",https://data.ct.gov/coronavirus,,,@ctdph,https://portal.ct.gov/Coronavirus,Connecticut,09,,false
DC,"Positive and Negative include both public and commercial labs. As of April 27, District of Columbia is reporting people tested.

On May 25, the District of Columbia decreased the total test count by 11,000.",https://coronavirus.dc.gov/page/coronavirus-surveillance-data,,,@_DCHealth,https://coronavirus.dc.gov/,District Of Columbia,11,,false
DE,"As of April 27, Delaware is reporting people tested.

On April 11, Delaware revised down negatives from 10415 to 9624.

On July 25, Delaware revised down total cases, confirmed positives, and total tests.",https://dhss.delaware.gov/dhss/dph/epi/2019novelcoronavirus.html,,,@Delaware_DHSS,https://dhss.delaware.gov/dhss/dph/epi/2019novelcoronavirus.html,Delaware,10,,false
FL,"We report using the raw data provided by FDOH but we include both Florida residents and non-residents.

On March 21, negatives jumped due to a methodology change: tests of people not investigated as PUIs are now included. 

On March 26, the dashboard stopped including non-residents in its visible counts, but they're still tracked behind the scenes.  

Per reporting [https://www.miamiherald.com/news/coronavirus/article241882491.html], the number of pending tests might be an under-count since it might include only public labs.

As of May 15, Florida is reporting both specimens (PCR and antibody) and people tested. We report positives and negatives based on the number of people tested. However, the ""people tested"" number reported on Florida's dashboard has come into question as of May 31, because this number is not fully de-duplicated. Florida's report states that: ""People tested on multiple days will be included for each day a new result was received.""

As of July 2, Florida is reporting PCR and antigen tests together.

As of July 10, Florida is reporting current hospitalizations as those with a ""primary diagnosis of COVID-19.""

On August 9, Florida did not update non-resident hospitalizations or deaths on their dashboard or publicly available ArcGIS data by our publication time. We used the data reported on their state report to report the state's data. The state report only includes Florida residents in their data so we carried over yesterday's cumulative number of non-Florida residents (388) who were hospitalized in the state as well as yesterday's number of non-Florida resident deaths (129).

On August 12, Florida Department of Health reported via Twitter that it had received a large backlog of testing data frmo Niznik Lab Corp in Miami: ""The lab reported over 4000 cases occurring over the last 7 weeks, but which had not been reported to FDOH until today. Therefore, this backlog severely skews today's daily report for Miami-Dade and is not reflective of current trends.""",https://experience.arcgis.com/experience/96dd742462124fa0b38ddedb9b25e429/,https://o-vid.herokuapp.com/florida,https://bi.ahca.myflorida.com/t/ABICC/views/Public/COVIDHospitalizationsCounty?%3AshowAppBanner=false&%3Adisplay_count=n&%3AshowVizHome=n&%3Aorigin=viz_share_link&%3AisGuestRedirectFromVizportal=y&%3Aembed=y,@HealthyFla,http://www.floridahealth.gov/diseases-and-conditions/COVID-19/,Florida,12,,false
GA,"Positive includes deaths. Positives occasionally update before totals.
We use the state's ""as of"" time as our Update Time. 

As of May 16, Georgia is reporting specimens tested. Because some people may be tested more than once, this number is probably higher than the number of people tested. 

As of May 27, Georgia started separating serology tests from PCR. Total test numbers were impacted by around 74,000.
Georgia makes changes to its cumulative case counts for previous dates, so its historical time series and trends for case counts might not match ours. When we can, we will update our own historical time series to match theirs.",https://dph.georgia.gov/covid-19-daily-status-report,https://augustagis.maps.arcgis.com/apps/opsdashboard/index.html#/4eec20925b6b4f338368df0ffcba472d,,@GaDPH,https://dph.georgia.gov/novelcoronavirus,Georgia,13,,false
GU,"Testing data from Guam's Situation Report is often older than case data in Guam's press releases, so there are sometimes more cases than test results. 

On May 4, Guam adjusted cases down from 150 to 149 because they found that the case was double counted, number of recovered was also adjusted down because 7 people were returned to isolation.
Guam's counts include 11 people tested at the San Diego naval base.

As of May 25, Guam is reporting people tested.",http://dphss.guam.gov/covid-19/,https://ghs.guam.gov/coronavirus-covid-20,,@guamdphss,https://ghs.guam.gov/coronavirus-covid-19,Guam,66,,false
HI,"As of May 16, Hawaii is reporting people tested

On May 23, Hawaii revised down 5 cases due to updated testing information.

On May 25, Hawaii revised down 1 cumulative hospitalization patient.

On June 5, Hawaii revised down 1 case released from isolation.

As of June 1, Hawaii started reporting total number of unique people tested. Total tests impacted by around 6,000.

As of August 5, we are collecting Current Hospitalization, ICU, and Ventilator numbers from the Lt. Governor of Hawaii's Instagram account since we have determined that these are official statistics not available elsewhere. We have backfilled our time series for all available data from this source.",https://health.hawaii.gov/coronavirusdisease2019/,https://health.hawaii.gov/coronavirusdisease2019/what-you-should-know/current-situation-in-hawaii/,,@HIgov_Health,https://health.hawaii.gov/docd/advisories/novel-coronavirus-2019/,Hawaii,15,,false
IA,"Not all commercial labs report negatives to Iowa, as per their guidance. As of April 27, Iowa is reporting people tested.

As of May 19, Iowa is separating out the numbers of people tested with PCR and antibody tests; we report the number of people tested with PCR. Total testing numbers might be impacted.",https://coronavirus.iowa.gov/,https://coronavirus.iowa.gov/pages/access,,@IAPublicHealth,https://idph.iowa.gov/Emerging-Health-Issues/Novel-Coronavirus,Iowa,19,,false
ID,"Negative = Totals - Positives.  Positives sometimes update before totals do. 
Total includes Oregon residents tested in Idaho.  

As of April 9, Idaho separately reports both probable and confirmed cases. Idaho reports test counts in specimens. 

On June 5, Idaho received a large batch of previously unreported tests.

On July 3, ID revised down the Recovered number by about 1,500 noting that ""an error in auto-calculation was discovered.""

On July 8, ID revised historical hospitalization, on July 17 we updated those values for March 23 - July 15, carrying forward current values until information is updated.

On July 22, ID reported 126 total deaths but also reported 103 lab-confirmed deaths and 33 probable deaths. We believe that the correct number of probable deaths is 23 and that 33 was a mistake. We therefore report 126 total deaths in ID for this date. See ID state page screenshots for July 22. 

On August 4, Idaho reported current hospitalizations of 106, down from the previous report of 223 on July 31.  It reported a similar drop in ICU patients from  51 on July 31 to 22 on August 4.",https://coronavirus.idaho.gov/,https://public.tableau.com/views/DPHIdahoCOVID-19Dashboard_V2/Story1?%3Aembed=y&%3AshowVizHome=no&%3Adisplay_count=y&%3Adisplay_static_image=y&%3AbootstrapWhenNotified=true,,@IDHW,https://coronavirus.idaho.gov/,Idaho,16,,false
IL,"Illinois counts deaths in positives. 

As of May 25, Illinois is reporting PCR specimens tested. Because some people may be tested more than once, this number is probably higher than the number of people tested. ",http://www.dph.illinois.gov/topics-services/diseases-and-conditions/diseases-a-z-list/coronavirus,http://www.dph.illinois.gov/covid19/hospitalization-utilization,,@IDPH,http://www.dph.illinois.gov/topics-services/diseases-and-conditions/diseases-a-z-list/coronavirus,Illinois,17,,false
IN,"Negative = Total – Positive. Negatives are a lower bound, and may not include all private labs. 

On June 23 and June 24 reported cumulative patients admitted to ICU decreased for unknown reasons.",https://www.in.gov/isdh/28470.htm,https://www.regenstrief.org/covid-dashboard/,,@statehealthin,https://www.in.gov/isdh/28470.htm,Indiana,18,,false
KS,"On April 23, Kansas reported 112 deaths.  On April 24, they revised this down to 111 deaths.

As of May 7, 2020, confirmed and probable cases are included in the case totals.

From July 1 - July 3 we reported incorrect numbers for Kansas Positive Cases (PCR). We have corrected the error.

On July 15, Kansas began reporting additional data from hospitals, at that time current hospitilaztion was only available through July 10. Cumulative on ventilator dropped by 1 with no explanation. 

On July 27, Kansas reported a lower number of negative tests, the count went down from 252,858 to 252,764",https://www.coronavirus.kdheks.gov/160/COVID-19-in-Kansas,http://www.kdheks.gov/coronavirus/,https://public.tableau.com/views/COVID-19TableauVersion2/TestingRates?%3Aembed=y&%3AshowVizHome=no,@kdhe,http://www.kdheks.gov/coronavirus/,Kansas,20,,false
KY,"Negative = Total - Positive.
Positives sometimes update before totals do; when this happens, we keep the last calculated negative. 

As of April 27, Kentucky is reporting people tested.

On May 23, Kentucky revised down the total number of tests.

As of May 27, Kentucky started separating serology tests from PCR. This might cause the number of total tests to go down compared to the previous day.

On July 1, Kentucky revised down the cumulative hospitalizations by 12",https://kygeonet.maps.arcgis.com/apps/opsdashboard/index.html#/543ac64bc40445918cf8bc34dc40e334,https://chfs.ky.gov/agencies/dph/Pages/covid19.aspx,https://chfs.ky.gov/agencies/dph/covid19/COVID19DailyReport.pdf,@CHFSKy,https://chfs.ky.gov/agencies/dph/Pages/covid19.aspx,Kentucky,21,,false
LA,"Total = State Lab + Commercial Lab, Negative = Total - Positive

From April 20 through April 24, LA paused reporting commercial testing data to do a review of the data. 

On June 18, a notice on LA dashboard said ""LDH is reviewing all data and will not be updating its dashboard today.""

On June 19, LDH removed 1666 duplicate and non resident cases after implementing a new de-duplicaton process.",http://ldh.la.gov/Coronavirus/,https://services5.arcgis.com/O5K6bb5dZVZcTo5M/arcgis/rest/services/Combined_COVID_Reporting/FeatureServer/0/query?groupByFieldsForStatistics=Measure&outStatistics=%5B%7B%27statisticType%27%3A+%27sum%27%2C+%27onStatisticField%27%3A+%27Value%27%7D%5D&where=1%3D1,,@LADeptHealth,http://ldh.la.gov/Coronavirus/,Louisiana,22,,false
MA,"MA reports both the number of tests performed and the number of people tested. Both data points are available in our API, but MA data on our web pages is reported in units of people tested. 

On June 1, MA began to release probable cases and deaths, causing total cases and total deaths to spike in our data. 

On June 30, MA decreased the number of cumulative hospitalization, confirmed and probable deaths ""due to ongoing data cleaning which identifies and removes duplicate reports.""

On July 31, MA noted that ""Delays in the reporting of test results to DPH from multiple laboratories, including large national commercial laboratories, are reflected in today’s case counts. However, these positive test results have been assigned retrospectively to the appropriate date of test."" We will backfill our own case counts for MA as soon as possible.

On August 5, MA did not publish data by our collection time. A note on their site said ""Significant IT issues are impacting the production of today's data report. It will be posted as soon as it is available.""",https://www.mass.gov/info-details/covid-19-cases-quarantine-and-monitoring,,,@massdph,https://www.mass.gov/resource/information-on-the-outbreak-of-coronavirus-disease-2019-covid-19,Massachusetts,25,,false
MD,"Between March 12 and March 28, Maryland did not report negative test numbers.

On July 31, we began capturing MD's data for positive results of PCR tests in units of tests (as opposed to in units of persons tested). We will backfill the time series, which begins in March. ",https://coronavirus.maryland.gov/,,,@MDHealthDept,https://phpa.health.maryland.gov/Pages/Novel-coronavirus.aspx,Maryland,24,,false
ME,"As of May 13, Maine is reporting total specimens tested; this number is updated once a week on Wednesdays. Because some people may be tested more than once, this number is probably higher than the number of people tested.

As of May 20, Maine is separating out PCR tests and antibody tests; we report the number of PCR tests. Total testing numbers might be impacted.

On June 23, Maine began reporting the dates of cases, deaths, recoveries, and hospitalizations on the day they occurred instead of the day the event was reported. Maine also began providing separate figures for confirmed and probable deaths.",https://www.maine.gov/dhhs/mecdc/infectious-disease/epi/airborne/coronavirus/data.shtml,,,@mainedhhs,https://www.maine.gov/dhhs/mecdc/infectious-disease/epi/airborne/coronavirus.shtml,Maine,23,,false
MI,"Michigan has reported each day's negative results since March 10 but has never totaled them. We sum all the negative results and report the total. Michigan reports specimens tested instead of people tested. 
Recovered counts are updated once a week. 

As of May 16, Michigan uses 'total specimens' reported on lab testing page

As of May 23, Michigan is separating out antibody and PCR tests; we report the number of PCR tests. Total testing numbers might be impacted. 

As of June 5, positives include both confirmed and probable cases of COVID-19, as reported by the Michigan Department of Health & Human Services.

On June 11 Michigan DDHS provided an XLS with historical time series and we updated our data to reflect the correct dates of probable and confirmed cases and deaths. 

As of July 7, Michigan updates its death figures three times a week after conducting reviews of death certificates. As a result, new deaths may not always reflect deaths in the past 24 hours.","https://www.michigan.gov/coronavirus/0,9753,7-406-98163_98173---,00.html","https://www.michigan.gov/coronavirus/0,9753,7-406-98159-523641--,00.html",,@MichiganHHS,https://www.michigan.gov/coronavirus,Michigan,26,,false
MN,"Since March 23, Negative = Total - Positive.

As of June 5, Minnesota reports specimens tested; because some people may be tested more than once, this number may be higher than the number of people tested.

On July 30th, Minnesota reports again number of people tested. Due to this change, the number of total tests by Minnesota will decrease by 200,000. Number of specimens tested will still be tracked and available in our API",https://www.health.state.mn.us/diseases/coronavirus/situation.html,,,@mnhealth,https://www.health.state.mn.us/diseases/coronavirus/index.html,Minnesota,27,,false
MO,"Negative = Total - Positive. As of April 27, Missouri is reporting people tested.

On July 19, Missouri revised the death down from 1130 to 1129.

As of May 22, Missouri is separating out the numbers of people tested with PCR and antibody tests; we report the number of people tested with PCR tests. Total tests might be impacted.

On July 24, Missouri decreased the number of deaths by 1.
",https://health.mo.gov/living/healthcondiseases/communicable/novel-coronavirus/results.php,https://missouri-coronavirus-gis-hub-mophep.hub.arcgis.com/,https://mophep.maps.arcgis.com/apps/opsdashboard/index.html#/d05d2bf6e13745c5afffc8fc87d5b1c5,@HealthyLivingMo,https://health.mo.gov/living/healthcondiseases/communicable/novel-coronavirus/,Missouri,29,,false
MP,"On July 9, MP started providing weekly updates of test totals in units of People. 

As of July 23, we began using the total people tested number as the default unit. This caused a perceived drop in the number of tests on July 23. We will adjust the historic time series to match shortly.",https://www.chcc.gov.mp/coronavirusinformation.php,https://cnmichcc.maps.arcgis.com/apps/opsdashboard/index.html#/4061b674fc964efe84f7774b7979d2b5,,@cnmichcc,https://www.chcc.gov.mp/coronavirusinformation.php,Northern Mariana Islands,69,,false
